sentence,positive,neutral,negative
"sm prime recorded consolidated revenues of p104.08 billion in the year ended 2018, an increase of 14% from p90.92 billion in the year ended 2017, primarily due to the following:

sm prime recorded consolidated revenues from rent of p57.16 billion in 2018, an increase of 11% from p51.41 billion in 2017. the increase in rental revenue was primarily due to the new malls and expansions opened in 2017 and 2018 namely, sm cdo downtown premier, s maison, sm city puerto princesa, sm center tuguegarao downtown, sm city urdaneta central, sm city telabastagan, sm city legazpi and sm center ormoc with a total gross floor area of 0.53 million square meters. out of the total rental revenues, 88% is contributed by the malls and the rest from office and hotels and convention centers. excluding the new malls, same-store rental growth is at 8%. rent from commercial operations also increased due to the opening of three e-com center and sm southmall south tower in 2018.

sm prime recorded a 22% increase in real estate sales in 2018 from p29.43 billion to p35.87 billion primarily due to higher construction accomplishments of projects launched in 2015 to 2017 namely shore 2, fame, coast, spring, shore 3 and s residences and continued increase in sales take-up of various projects due to strong demand fueled by international buyers, overseas filipinos’ remittances, and rising disposable income of the emerging middle class. actual construction of projects usually starts within twelve to eighteen months from launch date and revenues are recognized in the books based on percentage of completion.


sm prime cinema and event ticket sales increased by 9% to p5.22 billion in 2018 from p4.77 billion in 2017 due to higher gross box office receipts from international and local blockbuster movies shown in 2018 compared to 2017. the major blockbusters screened in 2018, accounting for 29% of gross ticket sales, include “avengers: infinity war”, “the hows of us”, “jurassic world: fallen kingdom”, “black panther”, and “aquaman”. the major blockbusters screened in 2017 were “beauty and the beast”, “justice league”, “wonder woman”, “thor: ragnarok“ and “the revenger squad” accounting for 23% of gross ticket sales.

other revenues increased by 10% to p5.83 billion in 2018 from p5.31 billion in 2017. the increase was mainly due to higher income from bowling and ice skating operations, sponsorships, opening of new amusement attractions particulary sm skyranch baguio and increase in net merchandise sales from snackbars. this account also includes amusement income from rides, merchandise sales from snackbars and sale of food and beverages in hotels.

sm prime recorded consolidated costs and expenses of p55.75 billion for the year ended 2018, an increase of 11% from p50.29 billion in 2017, as a result of the following:

consolidated costs of real estate increased by 17% to p17.77 billion in 2018 from p15.15 billion in 2017 primarily due to costs related to higher recognized real estate sales, offset by result of improving cost efficiencies as a result of economies of scale, tighter monitoring and control of construction costs hence, leading to improved gross profit margin on real estate sales from 49% in 2017 to 50% in 2018.

sm prime’s consolidated operating expenses increased by 8% to p37.98 billion in 2018 compared to last year’s p35.14 billion due to new mall openings. out of the total operating expenses, 71% is contributed by the malls where same-store mall growth in operating expenses is at 4%. operating expenses include depreciation and amortization, film rentals, taxes and licenses, marketing and selling expenses, utilities and manpower, including agency costs.

sm prime’s consolidated interest expense increased by 38% to p7.54 billion in 2018 compared to p5.47 billion in 2017 due to the series of retail bonds issued in march 2018 and may 2017 amounting to p20 billion each and new bank loans availed for working capital and capital expenditure requirements, net of the capitalized interest on proceeds spent for construction and development of investment properties.

interest and dividend income increased by 51% to p1.83 billion in 2018 from p1.21 billion in 2017. this account is mainly composed of interest and dividend income received from cash and cash equivalents, investments held for trading and afs investments. the increase is due to higher average balance of cash and cash equivalents and higher dividends received in 2018 on available-for-sale investments.


other charges – net increased by 54% to p0.65 billion in 2018 from p0.42 billion in 2017 due to foreign exchange and other incidental costs related to mall projects.


sm prime’s consolidated provision for income tax increased by 16% to p9.06 billion in 2018 from p7.82 billion in 2017.

sm prime’s consolidated net income attributable to equity holders of the parent in the year ended december 31, 2018 increased by 17% to p32.17 billion as compared to p27.57 billion in 2017.

sm prime’s total assets amounted to p=604.13 billion as of december 31, 2018, an increase of 12% from p=538.42 billion as of december 31, 2017.
cash and cash equivalents decreased by 13% from p=44.37 billion to p=38.77 billion as of december 31, 2017 and december 31, 2018, respectively, mainly due to payments for capital expenditure projects during the period, net of increase in the company’s cash flows from operations and proceeds from long- term debt.
financial assets at fair value through other comprehensive income were sold during the period.
receivables and contract assets increased by 4% from p=33.99 billion to p=35.23 billion as of december 31, 2017 and december 31, 2018, respectively, due to increase in rental receivables from new malls and expansions and increase in sales of residential projects.
condominium and residential units for sale decreased by 7% from p=8.73 billion to p=8.09 billion as of december 31, 2017 and december 31, 2018, respectively, due to faster sales take up of rfo units, particularly those projects located in the bay area.
land and development increased by 35% from p=58.67 billion to p=79.33 billion as of december 31, 2017 and december 31, 2018, respectively, due to landbanking and construction accomplishments for the period, net of cost of sold units and transfers of rfo units to condominium and residential units for sale.
investments in associates and joint ventures increased by 7% from p=24.57 billion to p=26.20 billion as of december 31, 2017 and 2018, respectively, due to increase in equity in net earnings of associates and joint ventures.
equity instruments at fair value through other comprehensive income decreased by 24% from p=31.11 billion to p=23.53 billion as of december 31, 2017 and december 31, 2018, respectively, due to disposals and changes in fair values under this portfolio.
investment properties increased by 8% from p=273.08 billion to p=293.57 billion as of december 31, 2017 and december 31, 2018, respectively, primarily due to ongoing new mall projects, ongoing commercial building construction, including the four e-com center and the ongoing redevelopment of sm mall of asia and other existing malls. also, the increase is attributable to landbanking and construction costs incurred for ongoing projects.
derivative assets decreased by 76% from p=3.55 billion to p=0.85 billion as of december 31, 2017 and december 31, 2018, respectively, mainly resulting from the maturity of the $350 million cross currency swap transaction. while the 57% decrease in derivative liabilities from p=0.78 billion to p=0.34 billion as of december 31, 2017 and december 31, 2018, respectively, mainly resulted from the net fair value changes on the principal only swap transaction and cross currency swap transaction entered into in 2016 to 2017.
other noncurrent assets, which includes the noncurrent portion of receivables from sale of real estate, increased by 91% from p=42.42 billion to p=80.91 billion as of december 31, 2017 and december 31, 2018, due to additional bonds and deposits for real estate acquisitions and construction accomplishments of sold units as well as new sales for the period.
loans payable decreased by 95% from p=0.74 billion to p=0.04 billion as of december 31, 2017 and december 31, 2018, respectively, due to payment of maturing loans.

accounts payable and other current liabilities increased by 21% from p=51.08 billion to p=61.77 billion as of december 31, 2017 and december 31, 2018, respectively, mainly due to payables to contractors and suppliers related to ongoing projects, customers’ deposits from residential buyers and liability for purchased land.
long-term debt increased by 16% from p=192.85 billion to p=222.77 billion as of december 31, 2017 and december 31, 2018, respectively, mainly due to the issuance of p=20.00 billion retail bonds in march 2018 and new loan availments to fund capital expenditures requirements, net of payment of maturing loans.
tenants’ and customers’ deposits increased by 14% from p=16.38 billion to p=18.68 billion as of december 31, 2017 and december 31, 2018, respectively, mainly due to the new malls and office buildings and increase in customers’ deposits from residential buyers.
liability for purchased land increased to p=6.04 billion from p=2.17 billion as of december 31, 2018 and december 31, 2017, respectively, due to landbanking.
deferred tax liabilities increased by 23% from p=2.88 billion to p=3.53 billion as of december 31, 2017 and december 31, 2018, respectively, mainly due to unrealized gross profit on sale of real estate for tax purposes.
other noncurrent liabilities increased by 38% from p=7.62 billion to p=10.51 billion as of december 31, 2017 and december 31, 2018, respectively, due to increase in retention payable and output vat on residential sales.
the company’s key performance indicators are measured in terms of the following: (1) debt to equity which measures the ratio of interest bearing liabilities to equity; (2) net debt to equity which measures the ratio of interest bearing liabilities net of cash and cash equivalents and investment held for trading to equity; (3) return on equity (roe) which measures the ratio of net income to capital provided by stockholders; (4) earnings before interest expense, income taxes, depreciation and amortization (ebitda); (5) debt to ebitda which measures the ratio of ebitda to total interest-bearing liabilities; (6) interest coverage ratio which measures the ratio of ebitda to interest expense; (7) operating income to revenues which basically measures the gross profit ratio; (8) ebitda margin which measures the ratio of ebitda to gross revenues and (9) net income to revenues which measures the ratio of net income to gross revenues. the following discuss in detail the key financial indicators of the company.
interest-bearing debt to equity increased to 0.45:0.55 as of december 31, 2018 from 0.43:0.57 as of december 31, 2017 due to additional borrowings. likewise, net interest-bearing debt to equity increased to 0.40:0.60 as of december 31, 2018 from 0.36:0.64 as of december 31, 2017 due to additional borrowings, net of payments, for capital expenditure and working capital requirements.
roe increased to 12% as of december 31, 2018 from 11% as of december 31, 2017.
debt to ebitda improved to 3.89:1 as of december 31, 2018 from 3.95:1 as of december 31, 2017 due to increase in consolidated operating income. interest coverage ratio decreased to 7.59:1 as of december 31, 2018 from 8.96:1 as of december 31, 2017 as a result of increase in interest expense from additional borrowings. ebitda margin improved to 55% as of december 31, 2018 from 54% as of december 31, 2017.
consolidated operating income to revenues improved to 46% as of december 31, 2018 from 45% as of december 31, 2017. consolidated net income to revenues likewise improved to 31% as of december 31, 2018 from 30% as of december 31, 2017.

the company has no known direct or contingent financial obligation that is material to the company, including any default or acceleration of an obligation. there were no contingent liabilities or assets in the company’s balance sheet. the company has no off-balance sheet transactions, arrangements, obligations during the reporting year as of balance sheet date.
there are no known trends, events, material changes, seasonal aspects or uncertainties that are expected to affect the company’s continuing operations.
as at december 31, 2018 and 2017, the amount of retained earnings appropriated for the continuous corporate and mall expansions amounted to p42,200 million. this represents a continuing appropriation for land banking activities and planned construction projects. the appropriation is being fully utilized to cover part of the annual capital expenditure requirement of the company.
for the year 2019, the company expects to incur capital expenditures of approximately p80 billion. this will be funded with internally generated funds and external borrowings.
sm prime’s malls business unit has seventy-two shopping malls in the philippines with 8.3 million square meters of gross floor area and seven shopping malls in china with 1.3 million square meters of gross floor area. for 2019, sm prime is slated to open four new malls in the philippines. by the end of 2019, the malls business unit will have seventy-six malls in the philippines and seven malls in china with an estimated combined gross floor area of almost 10.0 million square meters.
sm prime currently has forty-four residential projects in the market, thirty-five of which are in metro manila and nine are outside metro manila. for 2019, sm prime is scheduled to launch between 15,000 to 18,000 residential units that includes high-rise buildings, mid-rise buildings and single detached house and lot projects. these projects will be located in metro manila and other key cities in the provinces.
sm prime’s commercial properties group has eleven office buildings with a combined gross floor area of 623,000 square meters. three e-com center, with gross floor area of almost 130,000 square meters, was recently launched in september 2018. sm prime is set to launch the campus-office building named nu tower, and the foure-com center, both in the mall of asia complex, pasay city in 2019 and 2020, respectively.
sm prime’s hotels and convention centers business unit currently has a portfolio of six hotels with over 1,500 rooms, four convention centers and three trade halls. the company is set to launch two new hotels this 2019 namely park inn by radisson – iloilo and park inn by radisson – north edsa.





",0.9386491775512695,0.045461978763341904,0.015888845548033714
