filename,sentence
AC_2020.txt,"This resulted in higher asset accounts such as property plant and equipment, ROU asset and intangibles (goodwill)."
AC_2020.txt,"Other current assets (including contract assets) – 12% increase from ₱66,093 million to ₱74,315 million
Increase coming from ALI’s higher existing project advances and deferred sales commissions and BHL’s infusion to FMI/ Yoma group."
AC_2020.txt,"This account is at 5% of the total assets as of December 31, 2020 and 2019."
AC_2020.txt,"Assets under PFRS 5 – 15% increase from ₱170,467 million to ₱196,137 million
Increase due to MWC’s higher cash and cash equivalents and short-term investments coming from proceeds of sustainability bonds issuance, higher receivables resulting from credit extension of customer payment as a result of limited mobility of customers and to increase of property, plant and equipment and service concession assets due to construction of additional facilities and concession fees."
AC_2020.txt,"This account is at 14% and 13% of the total assets as of December 31, 2020 and 2019, respectively."
AC_2020.txt,"Investment Properties – 8% decrease from ₱246,732 million to ₱226,457 million
Decrease attributable to absence of new project launches of ALI group’s and transfers to real estate inventory account."
AC_2020.txt,"This account is at 16% and 18% of the total assets as of December 31, 2020 and 2019, respectively."
AC_2020.txt,"Property, plant and equipment – 6% increase from ₱88,782 million to ₱94,538 million
Increase due to Islasol and Sacasol accounts."
AC_2020.txt,"This account is at 7% of the total assets as of December 31, 2020 and 2019."
AC_2020.txt,"Right-of-use assets – 9% increase from ₱18,221 million to ₱19,813 million
Increase also due to Islasol and Sacasol accounts."
AC_2020.txt,"This account is at 1% of the total assets as of December 31, 2020 and 2019."
AC_2020.txt,"Service concession assets – 5% decrease from ₱1,639 million to ₱1,556 million
Decrease attributable to AC’s depreciation of service concession assets."
AC_2020.txt,"This account is at below 1% of the total assets as of December 31, 2020 and 2019."
AC_2020.txt,"Intangible assets – 18% increase from ₱16,626 million to ₱19,625 million
Increase due to goodwill on acquisitions of AC Energy (Sacasol and Islasol) and AC Health (Healthway)."
AC_2020.txt,"This account is at 1% of the total assets as of December 31, 2020 and 2019."
AC_2020.txt,"Other noncurrent assets – 24% increase from ₱47,304 million to ₱58,852 million
Increase pertains to AC Energy’s additional investments in financial assets at amortized cost partly offset by decrease in ALI’s recoupment of advances to contractors and suppliers."
AC_2020.txt,"The account also includes the Group’s pension asset amounting to ₱22 million and ₱81 million in December 31, 2020 and 2019, respectively.1 This account is at 4% of the total assets as of December 31, 2020 and 2019."
AC_2020.txt,"Short-term debt – 9% increase from ₱29,789 million to ₱32,440 million
Increase due to borrowings of AC Energy, AC Industrials and AC Infra for operational expansion and IMI for payment of long-term debt; partly offset by ALI’s loan settlement."
AC_2020.txt,"This account is at 4% of the total liabilities as of December 31, 2020 and 2019."
AC_2020.txt,"Long-term debt (current) – 53% increase from ₱23,879 million to ₱36,514 million
Increase due to borrowings of AC and ALI to fund capital expenditures, buy-back of shares and dividends payment, AYC to fund investment in Yoma group; partly offset by IMI’s loan repayments."
AC_2020.txt,"This account is at 4% and 3% of the total liabilities as of December 31, 2020 and 2019, respectively."
AC_2020.txt,"Lease liabilities (current) – 41% increase from ₱1,028 million to ₱1,445 million
Increase coming from IMI, AC Energy and ACI groups."
AC_2020.txt,"This account is at below 1% of the total liabilities as of December 31, 2020 and 2019."
AC_2020.txt,"Service concession obligation (current and noncurrent) – 31% increase from ₱66 million to ₱86 million
Increase from AC’s concession obligation."
AC_2020.txt,"This account is at below 1% of the total liabilities as of December 31, 2020 and 2019."
AC_2020.txt,"Long-term debt (noncurrent) – 6% increase from ₱351,671 million to ₱372,800 million
Increase due to proceeds from AC’s loans and bonds issuance of ALI, AYC (FFL bonds), AC Energy (green and FFL bonds) and MWCI (green bonds); partly offset by IMI’s loan repayments and AYC’s forex translation difference of foreign loans."
AC_2020.txt,"This account is at 43% and 42% of the total liabilities as of December 31, 2020 and 2019, respectively."
AC_2020.txt,"Lease liabilities (noncurrent) – 6% increase from ₱21,353 million to ₱22,672 million
Increase coming from ALI, AC Energy, AC Health and AC Infra groups; party offset by decrease in IMI group."
AC_2020.txt,"This account is at 3% of the total liabilities as of December 31, 2020 and 2019."
AC_2020.txt,"Deferred tax liabilities (net) – 17% increase from ₱8,036 million to ₱9,398 million
Increase coming from ALI group."
AC_2020.txt,"This account is at 1% of the total liabilities as of December 31, 2020 and 2019."
AC_2020.txt,"Pension liabilities3 – 36% increase from ₱3,756 million to ₱5,093 million
Increase attributable to ALI ‘s provisions for pension liability this year."
AC_2020.txt,"This account is below 1% of the total liabilities as of December 31, 2020 and 2019."
AC_2020.txt,"Other noncurrent liabilities – 9% increase from ₱48,447 million to ₱52,776 million
Increase attributable to ALI’s higher deferred revenues on residential units and customers deposits."
AC_2020.txt,"This account is at 6% of the total liabilities as of December 31, 2020 and 2019."
AC_2020.txt,"Share-based payments – 52% decrease from ₱215 million to ₱103 million
Decrease coming from issuance on the exercise of stock ownership plans of AC."
AC_2020.txt,"This account is below 1% of the total equity as of December 31, 2020 and 2019."
AC_2020.txt,"Remeasurement losses on defined benefit plan – 104% increase from negative ₱3,117 million to negative ₱6,351 million
Increase attributable to actuarial loss on pension liabilities as result of adjustments on actuarial assumptions and factors."
AC_2020.txt,"This account is at 1% of the total equity as of December 31, 2020 and 2019."
AC_2020.txt,"Fair value reserve of financial assets at FVOCI – 39% decrease from ₱67 million to ₱41 million
Decrease due to AC Energy’s reclassification of Sacasol and Islasol investments to subsidiaries, ALI’s lower marked to market valuation of its investments and iPeople’s decrease in asset valuation reserve."
AC_2020.txt,"This account is at below 1% of the total equity as of December 31, 2020 and 2019."
AC_2020.txt,"Cumulative translation adjustments (CTA) – 151% decrease from positive ₱3,235 million to negative ₱1,636 million
Decrease due to forex translation (movement in forex for PhP vs. USD) of higher foreign-denominated net asset accounts of AC Energy and forex translation of foreign assets held by Globe and BPI."
AC_2020.txt,Forex of PhP vs USD amounted to ₱48.023 in December 2020 vs. ₱50.635 in December 2019.
AC_2020.txt,"This account is at below 1% of the total equity as of December 31, 2020 and 2019."
AC_2020.txt,"Equity reserve – 22% increase from ₱25,283 million to ₱30,741 million
Increase coming from initial public offering transactions of ALI and IMI."
AC_2020.txt,"This account is at 6% and 5% of the total equity as of December 31, 2020 and 2019, respectively."
AC_2020.txt,"Retained Earnings – 6% increase from ₱225,455 million to ₱238,073 million
Increase due to overall growth in net income of the group."
AC_2020.txt,"This account is 44% of the total equity as of December 31, 2020 and 2019, respectively."
AC_2020.txt,"Treasury stock – 15% increase from ₱5,738 million to ₱6,605 million
Increase due to AC parent’s buy-back of common shares (see Note 21)."
AC_2020.txt,"This account is 1% of the total equity as of December 31, 2020 and 2019."
AC_2020.txt,"Reserves under PFRS 5 – 45% increase from negative ₱1,467 million to negative ₱800 million
Increase due to the CTA of GNPK partly offset by the decrease on CTA of MWC as a result of forex depreciation of its foreign-denominated assts."
AC_2020.txt,"This account is at below 1% of the total equity as of December 31, 2020 and 2019."
AC_2020.txt,A.
AC_2020.txt,"Similar with the approach in the consolidated balance sheets, the accounts of MWC are reclassified as operations under PFRS 5 in the Group’s consolidated income statement for the years ended December 31, 2020 and 2019."
AC_2020.txt,Please see discussion below on Operations of the segment under PFRS 5.
AC_2020.txt,B.
AC_2020.txt,The Covid-19 pandemic has significantly affected the operating results of certain subsidiaries and investees reflected in the consolidated income statement.
AC_2020.txt,"For the year ended December 2020, Ayala Land’s total revenues declined 43% to ₱96.3 billion and net income fell 74% to ₱8.7 billion due to Covid-19 as a result of lower sales bookings, lower construction completion from residential projects caused by community quarantine restrictions, limited malls operations during quarantine, and lower average hotel occupancy due to quarantine and travel bans until July 2020."
AC_2020.txt,Easing of these restrictions starting month of August allowed ALI to show improvements in operating results.
AC_2020.txt,"For IMI, similar government-mandated lockdowns in certain foreign countries and voluntary suspension in other sites, impacted on lower output."
AC_2020.txt,Moderating these restrictions at the onset of Q3 2020 onwards similarly allowed IMI to uplift revenues and bottom lines.
AC_2020.txt,The impact of pandemic is shown in the following key income statement accounts.
AC_2020.txt,"Sale of goods and rendering services – 27% decrease from ₱264,907 million to ₱193,622 million Decrease affected by ECQ: ALI (lower construction completion, residential segment bookings, rental waive and lower occupancy rates); and IMI’s and ACI’s lower revenues caused by lower customer demand and slowdown in operations."
AC_2020.txt,These downtrends were partly offset by partial recovery in Q3 2020 plus higher revenues due to consolidation of AC Energy’s ACEN and AC Health’s Generika and Healthway.
AC_2020.txt,"As a percentage to total revenue, this account is at 88% and 90% in December 31, 2020 and 2019, respectively."
AC_2020.txt,"GNPK revenues from electricity sales of ₱5,108.8 million, other income of ₱1,347.9 million from combined mark-to-market gain on derivative instrument and liquidating damages, and administrative expenses of ₱1,589.5 million as of December 31, 2020 were recognized in the consolidated income statement (see Note 25)."
AC_2020.txt,"Cost of sales and services – 24% decrease from ₱189,983 million to ₱144,181 million
Decrease in account is aligned with the decline in revenues."
AC_2020.txt,"As a percentage to total costs and expenses, this account is at 82% and 86% in December 31, 2020 and 2019, respectively."
AC_2020.txt,"Share in net profits of associates and joint ventures – 21% decrease from ₱22,344 million to ₱17,616 million
Decrease coming from BPI’s aggressive loan loss provisions, which was partially offset by higher net interest income and other fees; and Globe’s lower mobile revenues and higher depreciation and receivable provisions partly offset by increase in home broadband demand and dilution gain in Mynt."
AC_2020.txt,"As a percentage to total revenue, this account is at 8% in December 31, 2020 and 2019."
AC_2020.txt,"Provision for income tax (current and deferred) – 63% decrease from ₱13,984 million to ₱5,239 million
Decrease due to lower net income of ALI for the year."
AC_2020.txt,"Income attributable to owners of the parent – 51% decrease from ₱35,279 million to ₱17,142 million
Decrease resulting from this year’s lower net income results of most of the investees particularly ALI, ACI, AC Infra, BPI and Globe as an effect of restricted operations and BHL’s provision for impairment; plus impact of last year’s AC Energy’s gain on sale of AA Thermal and AC’s gain on AC Education and iPeople merger."
AC_2020.txt,This is partly offset by the reversal of MWC remeasurement loss.
AC_2020.txt,"As a percentage to total net income, this account is at 59% and 84% in December 31, 2020 and 2019, respectively."
AC_2020.txt,"Income attributable to non-controlling interests – 81% increase from ₱6,703 million to ₱12,129 million
Increase resulting from reversal of MWC remeasurement loss and AC Energy’s better results; partly offset by lower net income results of ALI as an effect of the slower progress of construction."
AC_2020.txt,"As a percentage to total net income, this account is at 41% and 16% in December 31, 2020 and 2019, respectively."
AC_2020.txt,"Interest income from real estate and others – 5% increase from ₱11,243 million to ₱11,787 million
Increase coming from ALI’s higher accretion of interest as a result of collections from sale of its trade receivables."
AC_2020.txt,"Dividend and other income – 81% decrease from ₱32,411 million to ₱6,209 million
Decrease due to impact of last year’s AC Energy’s gain on sale of AA Thermal and AC’s gain on AC Education and iPeople merger, and current year’s fair value adjustments on BHL’s investments; partly offset by current year’s higher other income of AC Energy arising from investment gains, liquidated damages on delayed completion of GNPK plant and reversal of derivative losses and IMI’s gain on put options."
AC_2020.txt,Also includes GNPK’s other income accounts (see Note 25).
AC_2020.txt,"Interest and other financing charges – 25% increase from ₱22,410 million to ₱28,014 million
Increase coming from ALI, AC Energy and AYCFL as a result of higher debt balance level this year."
AC_2020.txt,The Group’s adoption of PFRS 16 also increased interest expense by ₱1.8 billion.
AC_2020.txt,"Operations of the segment under PFRS 5 – 132% increase from loss of ₱30,433 million to net income of ₱9,797 million
Includes the net income after tax of MWC less consolidation adjustments."
AC_2020.txt,Increase mainly due to decline in impairment provisions (with partial reversal of remeasurement loss this year) plus the impact of last year’s bill waiver and higher billed volume this year; partly offset by provisions on fair value adjustments of investment in AJVs and various exposures.
AC_2020.txt,"As required by PFRS5/ IFRS 5, the investment in MWC, which was reclassified as asset held for sale, should be subsequently re-measured to its fair market value (FMV) and the corresponding difference against carrying value (CV) be recognized as reversal of or additional loss."
AC_2020.txt,"In addition to the remeasurement loss taken up in December 2019, an amount of ₱1.79 billion (P1.63 billion net of tax) remeasurement loss was recognized in June 2020, which formed part of the GAE of operations of the segment under PFRS 5 in the consolidated income statement."
AC_2020.txt,"In December 2020, a partial reversal of remeasurement loss amounting to ₱6.59 billion (₱3.39 billion of which is attributable to the owners of the Parent Company) was booked which formed part of Other income of operations of the segment under PFRS 5 (Note 25)."
AC_2020.txt,The Philippines suffered a significant blow from the COVID-19 health crisis in 2020 as it endured a nationwide lockdown and a pronounced slowdown in international trade.
AC_2020.txt,"At the peak of the pandemic’s impact, the strictest form quarantine restrictions were imposed, limiting business activity and dampening consumer confidence."
AC_2020.txt,"However, as restrictions were gradually eased in the second half of the year, mobility and business confidence consequently recovered."
AC_2020.txt,"Ayala likewise saw a marked turnaround in demand and operations across its businesses, which continued to improve throughout the early months of 2021."
AC_2020.txt,"As the country enters a stage of recuperation, we see GDP growth in 2021 increasing by 6.8 percent coming from a 9.5 percent decline in 2020."
AC_2020.txt,"The last six months of the year saw a meaningful recovery in mobility, indicating that consumers have found a sense of normalcy in exiting the household while taking the necessary precautions."
AC_2020.txt,"Coupled with an eventual easing of transportation protocols and continued increase in digital consumption, we expect economic output to return to the 2019 level by 2022."
AC_2020.txt,"Should other risks such as another lockdown materialize however, the Philippines may find it difficult to for GDP to grow beyond the 6 percent mark."
AC_2020.txt,"Aside from consumption, two other pillars of the economy have remained strong – overseas remittances and BPO activity."
AC_2020.txt,"Despite massive layoffs and repatriations worldwide, remittances declined by only 0.8 percent to US$33 billion, comprising 9.2 percent of the country’s economic output."
AC_2020.txt,"Meanwhile, the BPO industry was quick to bounce back from just 50 percent productivity in April 2020 to 90 percent by July."
AC_2020.txt,Both drivers softened the blow of the pandemic to the Philippine economy and are likely to remain as solid contributors to economic output.
AC_2020.txt,"However, a risk factor is the Eurozone’s status as renewed lockdowns and a double-dip recession may put pressure on remittances."
AC_2020.txt,"Related to this, we see the Dollar-Peso rate depreciating to the 49 level in 2021 as the worldwide economies slowly reopen and US Dollar demand returns."
AC_2020.txt,Another important factor that supported the Philippines’ business environment in 2020 is the BSP Monetary Board’s move to slash the interest rate to an all-time low of 2.0 percent from 4.0 percent in the year.
AC_2020.txt,Local businesses found strength in the cheap funding environment as low interest rates allowed them to cover their working capital needs in the face of tight cashflows.
AC_2020.txt,"As quarantine measures continue to stay in place, we expect the Central Bank to maintain the interest rate at 2.0 percent."
AC_2020.txt,"Further cuts may be unlikely due to the threat of growing inflation, which has already risen to 3.5 percent in December 2020 and 4.2 percent the following month."
AC_2020.txt,Supply side factors such as rising oil prices and higher pork prices due to the African Swine Flu continue pose as risks in elevating inflation.
AC_2020.txt,"As such, we expect the print to increase to 3.1 percent in 2021 from 2.6 percent last year."
AC_2020.txt,"We also believe that in 2021, many companies will wish to move on the trends observed in 2020 more decisively."
AC_2020.txt,"Thus, we are likely to see the private sector step up capital expenditures to develop their digital and telecommunication assets, logistical capabilities, and factory and farm equipment as well."
AC_2020.txt,This has the potential to trickle down into employment and improve from the -8.7 percent decrease we saw in the fourth quarter of 2020.
AC_2020.txt,"Against this backdrop of developments, the Ayala group closely monitors key trends and potential risks in the global and domestic economies as well as in the industries where it operates."
AC_2020.txt,"That said, the Ayala group will continue executing in its investment programs and has allocated ₱196 billion in combined capital expenditure for 2021."
AC_2020.txt,Ayala maintains a healthy balance sheet with access to various funding options to meet requirements.
AC_2020.txt,"A robust risk management system allows the company to maximize opportunities for reinvention, and navigate the challenges faced by its business units."
