filename,sentence
AC_2020.txt,The further easing of quarantine and mobility restrictions sustained Ayala’s quarter-on-quarter growth.
AC_2020.txt,"Isolating the provisions recognized by various business units during the period and a partial reversal of Manila Water’s remeasurement loss booked in the previous year, Ayala’s core net income grew 46 percent to ₱6.8 billion in the fourth quarter from the previous quarter primarily driven by:
Ayala Land, which posted better performance on higher residential and leasing revenues as operations and construction activities progressed faster with the easing of mobility restrictions."
AC_2020.txt,Stronger results recorded by Manila Water and AC Industrials as well as the better valuation of AC Ventures international fund investments.
AC_2020.txt,"Meanwhile, Ayala’s reported net income increased 69 percent on a quarter-on-quarter basis to ₱5.8 billion, including the effect of the partial reversal on Manila Water’s remeasurement loss and other provisions."
AC_2020.txt,"Excluding the divestment gains from education and power booked in 2019, the impact of the reclassification of Manila Water as asset held under PFRS 5 for both Y2019 and Y2020, and significant loan loss provisions for BPI, Ayala’s core net income declined 16 percent to ₱26 billion in 2020 as the impact of mobility restrictions weighed down on its various business units."
AC_2020.txt,"In December 2019, Ayala recognized a remeasurement loss of ₱18.1 billion as a result of the reclassification of its investment in Manila Water as asset held under PFRS 5 (the accounting standard for assets held for sale)."
AC_2020.txt,"This accounting standard requires applying a fair market value accounting for Ayala’s investment in Manila Water, if the completion of the divestment and or subsequent loss of voting control is expected to occur within one year from the date of the financial statement."
AC_2020.txt,It also requires the assets and liabilities of MWC to be presented as one line item in the consolidated balance sheet and P&L in 2019 as opposed to line by line consolidation in prior years.
AC_2020.txt,Its reported net income decreased 51 percent to ₱17.1 billion.
AC_2020.txt,"Ayala’s businesses recorded lower net profits due to the effects of the pandemic on business
operations."
AC_2020.txt,Ayala Land endured the severe impact of COVID-19 to it business operations in 2020 recording a 74 percent drop in net income to ₱8.7 billion.
AC_2020.txt,BPI’s net income declined 26 percent to ₱21.4 billion on the back of ₱28 billion in loan loss provisions it booked in anticipation of an increase in NPL levels.
AC_2020.txt,The provision was 5x higher than the ₱5.6 billion allocated in the same period the previous year.
AC_2020.txt,"Globe’s net income contracted 16 percent to ₱18.6 billion driven by a moderate decline in gross service revenues, higher depreciation expenses from its continued network investments, and higher non-operating expenses."
AC_2020.txt,"AC Energy recorded a net income of ₱6.2 billion, a decline from its year-ago level of ₱25 billion, which included gains from the partial divestment of its thermal assets."
AC_2020.txt,AC Industrials narrowed its net loss to ₱1.8 billion in 2020 from ₱2.4 billion the previous year mainly due to improved results of IMI and MT Group as well as lower parent impairment provisions.
AC_2020.txt,"Sale of goods and rendering services posted a 27 percent decrease to ₱193.6 billion mainly because of the pandemic negatively affecting Ayala Land’s construction progress, residential bookings, rental waivers, and occupancy rates as well as AC Industrial’s revenues and operations."
AC_2020.txt,The decrease was partially offset by partial recovery in Q3 2020 and higher revenues stemming from the consolidation of AC Energy Philippines into AC Energy and Generika and Healthway into AC Health.
AC_2020.txt,"As a percentage of total revenue, this account is at 88 percent and 90 percent in December 31, 2020 and 2019, respectively."
AC_2020.txt,"Ayala Land endured the severe impact of COVID-19 to it business operations in 2020 recording a 43 percent decline in revenues to ₱96.3 billion and a 74 percent drop in net income to ₱8.7 billion
Property development revenues were down 47 percent to ₱57.9 billion mainly due to limited construction activity resulting in lower bookings."
AC_2020.txt,Residential revenues dropped 47 percent to ₱47.8 billion.
AC_2020.txt,Office for sale revenues declined 72 percent to ₱3.5 billion.
AC_2020.txt,Commercial and industrial lots sales decreased 42 percent to ₱6.6 billion.
AC_2020.txt,"Residential sales reservations in 2020 reached ₱81.9 billion, 56 percent of the previous year’s level, despite the limited selling activity during the quarantine period."
AC_2020.txt,"Fourth quarter sales reservations, which reached 58 percent of pre-COVID levels, totaled to
₱21.1 billion as property demand was sustained on a quarter-on-quarter basis."
AC_2020.txt,Commercial leasing revenues declined 44 percent to ₱21.9 billion because of restricted mall and hotel operations and closure of resorts.
AC_2020.txt,Shopping center leasing revenues went down 59 percent to ₱9.1 billion.
AC_2020.txt,"Office leasing income was sustained at ₱9.4 billion from ₱9.7 billion
Hotels and resorts revenues decreased 56 percent to ₱3.4 billion."
AC_2020.txt,"Capital expenditures reached ₱63.7 billion in 2020, and was mainly spent for the completion of residential and commercial leasing assets."
AC_2020.txt,Ayala Land has earmarked ₱88 billion in capital expenditures and is prepared to launch ₱100 billion-worth of residential projects in 2021 as it prepares for a V-shaped recovery in the next two to three years.
AC_2020.txt,Manila Water's net income decreased 18 percent to ₱4.5 billion in 2020 due to a one-off recognition for additional estimates for probable losses and lower contributions from domestic subsidiaries due to the impact of COVID-19.
AC_2020.txt,"Excluding one-offs, core net income declined 22 percent to ₱5.8 billion."
AC_2020.txt,"The parent company, which houses the East Zone Concession, saw net profits decline seven
percent to ₱4.7 billion driven by the recognition of impairment loss in Manila Water Total Solutions, lower costs and expenses despite higher provisioning for estimated credit losses, and higher depreciation expenses."
AC_2020.txt,Revenues slightly decreased two percent to ₱21.1 billion as improved billed volume in the East Zone was dragged by lower supervision fees from Estate Water.
AC_2020.txt,EBITDA decreased six percent to ₱11.9 billion despite OPEX improvement as the recognition of net foreign exchange losses and provisions for probable losses weighed down on profitability.
AC_2020.txt,EBITDA margin stood at 57 percent.
AC_2020.txt,"In December 2020, Manila Water’s consortium with French water distributor Saur Group and Saudi’s Miahona Company inked a seven-year agreement with the Kingdom of Saudi Arabia’s state-run water agency National Water Company to manage the delivery of water and wastewater services, billing and collection, customer service, and the integration and transformation of its human capital in the North West Cluster served by NWC."
AC_2020.txt,This initiative is among the first of the country’s plan to privatize its water infrastructure sector.
AC_2020.txt,"Last February 2021, Ayala, through its wholly owned subsidiary Philwater and the Razon group through Trident Water executed a share purchase agreement equivalent to the latter’s acquisition of a 39.1 percent voting stake and 8.2 percent economic stake in Manila Water."
AC_2020.txt,"The AC Energy group generated a net income attributable to equity holders of AC Energy's Parent of ₱6.2 billion in 2020, reflecting the group’s strong performance despite the pandemic."
AC_2020.txt,"This was a decline from ₱25 billion in the prior year, which included gains from its partial divestment in AA Thermal."
AC_2020.txt,"Net income contribution from its listed subsidiary, AC Energy Corporation or ACEN, reversed to ₱2.8 billion from a net loss in the previous year on the back of higher contracted capacity and improved plant availability."
AC_2020.txt,ACEN now accounts for half of the group’s net income.
AC_2020.txt,"Equity earnings from international assets increased 68 percent to ₱2.5 billion, supported by full- year operations of the company’s solar assets in Vietnam."
AC_2020.txt,Other income declined to ₱448 million because of the absence of significant divestment gains booked in the prior year.
AC_2020.txt,Other income in 2020 includes earnings from the legacy coal assets offset by bond interest expense and parent overhead.
AC_2020.txt,"The AC Energy group has expanded its geographical reach and currently operates in five markets, with the recent start of construction of its first project in Australia."
AC_2020.txt,"ACEN has 990MW of attributable capacity in the Philippines, 45 percent of which are
renewable."
AC_2020.txt,"It aims to expand its portfolio with recently announced joint ventures with Solar
Philippines and Citicore."
AC_2020.txt,"The group has approximately 1,400MW of attributable capacity offshore, all of which are
renewable."
AC_2020.txt,AC Energy has more than 600MW of renewable energy capacity in Vietnam.
AC_2020.txt,"The expansion of the Ninh Thuan solar project has recently started operations, adding 75MWdc of operating capacity to the portfolio."
AC_2020.txt,"Marking AC Energy’s first investment in Australia, the group recently announced the start of construction of the first phase of the New England Solar Farm in Uralla, New South Wales, with 521.5MWdc of gross capacity."
AC_2020.txt,"Indonesia and India have 180MW and 170MW in attributable capacity, respectively."
AC_2020.txt,"In January 2021, ACEN completed its stock rights offering, bringing Ayala’s effective stake in
ACEN to 70 percent."
AC_2020.txt,"In February 2021, ACEN announced a follow-on offering at a price range of 6.00 to 8.20 per share and submitted a registration statement with the SEC for up to 2,430,248,617 common shares (primary and secondary shares with over-allotment)

AC Industrials narrowed its net loss to ₱1.8 billion in 2020 from ₱2.4 billion the previous year mainly due to improved results of IMI and MT Group as well as lower parent impairment provisions."
AC_2020.txt,Its Philippine automotive business remained challenged due to the negative effects of the health crisis.
AC_2020.txt,IMI registered a net loss of US$3.5 million in 2020 compared to the US$7.8 million net loss it incurred in the same period the previous year.
AC_2020.txt,"The improvement was mainly on the back of sound cost management including materials cost, factory overhead, and non-operating expenses."
AC_2020.txt,"Revenues decreased nine percent to US$1.1 billion in 2020 but was trended up since the height
of quarantine restrictions and surpassed pre-COVID levels in the fourth quarter."
AC_2020.txt,"Topline
increased 11 percent to US$347 million on a quarter-on-quarter basis."
AC_2020.txt,Gross profit margin improved by 30 basis points to 8.5 percent in 2020 due to lower materials cost leading to an appreciation of contribution margin.
AC_2020.txt,"Quarter-on-quarter, it grew by 70 basis
points to 10.3 percent."
AC_2020.txt,AC Industrial’s MT CCON narrowed its net loss to EUR10.2 million from EUR10.4 million in the same period the previous year on the back of margin improvement from cost optimization initiatives.
AC_2020.txt,AC Motors incurred a net loss of ₱886 million as demand in the local automotive space softened due to the health crisis.
AC_2020.txt,"Share in net profits of associates and joint ventures declined 21 percent to ₱17.6 billion due to BPI’s aggressive loan loss provisions, which was partially offset by higher net interest income and other fees."
AC_2020.txt,This was likewise driven by Globe’s lower mobile revenues and higher depreciation and receivable provisions partially offset by an increase in home broadband demand and remeasurement gain in Mynt.
AC_2020.txt,"As a percentage of total revenues, this account is at eight percent in December 31, 2020 and 2019."
AC_2020.txt,BPI’s net income decreased 26 percent to ₱21.4 billion in 2020 due to the ₱28 billion in loan loss provisions it booked in anticipation of an increase in non-performing loans.
AC_2020.txt,The provision is 5x larger than the ₱5.6 billion allocated in the previous year.
AC_2020.txt,Total revenues increased 10 percent to ₱101.9 billion because of net interest income and non- interest income growth.
AC_2020.txt,"Net interest income was up 10 percent to ₱72.3 billion due to a 5.8 percent expansion in
average asset base supported by a 14-basis point improvement in net interest margin, which stood at 3.49 percent."
AC_2020.txt,Non-interest income rose 11 percent to ₱29.7 billion on the back of higher securities trading gains albeit tempered by fee-based income.
AC_2020.txt,"Total loans declined five percent to ₱1.4 trillion primarily on soft corporate lending despite higher mortgage and microfinance loan segments, up 6.6 percent and 6.9 percent, respectively."
AC_2020.txt,Total deposits grew one percent to ₱1.7 trillion with CASA deposits expanding 17 percent.
AC_2020.txt,CASA ratio stood at 79.6 percent.
AC_2020.txt,Loan-to-deposit ratio ended at 82.0 percent.
AC_2020.txt,"NPL ratio and NPL coverage ratio stood at 2.68 percent and 115.2 percent, respectively."
AC_2020.txt,Operating expenses slightly decreased 0.4 percent to ₱48.2 billion because of lower premises and various discretionary costs.
AC_2020.txt,"Cost-to-income ratio stood at 47.2 percent, a 520-basis point improvement year on year."
AC_2020.txt,Total assets grew one percent to ₱2.2 trillion.
AC_2020.txt,Total equity amounted to ₱279.8 billion.
AC_2020.txt,Common equity tier 1 ratio stood at 16.2 percent.
AC_2020.txt,Capital adequacy ratio stood at 17.1 percent.
AC_2020.txt,Return on assets was 0.98 percent.
AC_2020.txt,Return on equity was 7.7 percent.
AC_2020.txt,"BPI's early investments to bolster its digital infrastructure starting 2017, underscored by spending of at least seven percent of revenues per year, has benefitted from the surge in demand for remote banking amid the global health crisis."
AC_2020.txt,"As of December 2020:
Enrollments to its online/mobile platform grew 18 percent to 4.4 million from year ago levels."
AC_2020.txt,Active users increased 41 percent to 2.7 million users from year ago levels.
AC_2020.txt,Digital transactions in December accounted for 92 percent of total while branch transactions comprised only eight percent.
AC_2020.txt,"These were 85 percent and 15 percent, respectively in the same
period the previous year."
AC_2020.txt,Globe’s net income declined 16 percent to ₱18.6 billion in 2020 due to lower EBITDA and higher depreciation charges and non-operating expenses.
AC_2020.txt,"Higher non-operating expenses in the period was due to a one-time impairment loss amounting
to ₱4.2 billion largely from the network change out covering the full sunset of the 3G assets and the existing copper infrastructure."
AC_2020.txt,This was partially offset by a ₱2.3 billion gain mostly from the deemed sale of Globe’s investment in Mynt following a third-part infusion by Bow Wave and loan revaluation.
AC_2020.txt,"Globe’s core net income, which excludes the impact of non-recurring charges and foreign exchange and mark-to-market changes, declined 13 percent to ₱19.5 billion."
AC_2020.txt,Total service revenues dipped two percent to ₱146.4 billion on softness in the mobile segment as a result of quarantine restrictions.
AC_2020.txt,Total data revenues accounted for 76 percent of Globe’s service revenues compared to the year-ago level of 71 percent.
AC_2020.txt,Growth in demand for data was evident in the upward momentum of Globe’s mobile and home categories despite the softening in corporate due to the prevailing work-from-home setup.
AC_2020.txt,Mobile data revenues increased one percent to ₱72 billion.
AC_2020.txt,"Mobile data traffic jumped 48 percent to 2,517 petabytes."
AC_2020.txt,Home broadband revenues surged 23 percent to ₱26.8 billion.
AC_2020.txt,Home broadband subscriber base increased 88 percent to 3.8 million subscribers.
AC_2020.txt,Corporate data revenue declined by three percent to ₱12.5 billion.
AC_2020.txt,Operating expenses including subsidies were flat at ₱73 billion.
AC_2020.txt,"EBITDA declined by three percent to ₱73.5 billion as a result of lower revenues, slightly dragging EBITDA margin to 50 percent from 51 percent the previous year."
AC_2020.txt,GCash maintained its status as the country’s number one finance app throughout 2020.
AC_2020.txt,"It has reached record highs amidst the pandemic, with 33 million registered users or one in every three Filipinos."
AC_2020.txt,"Additionally, it has seen a 3.7x increase in active users as gross transaction value exceeded the ₱1 trillion mark in December."
AC_2020.txt,"Owing to its success, Mynt has attracted US$175 million in fresh investment capital from existing shareholders and Bow Wave in multiple tranches, with post-money valuation of the final tranches at close to US$1 billion."
AC_2020.txt,"Globe’s CAPEX spend grew 18 percent to ₱60.3 billion, representing 41 percent of gross service revenues and 82 percent of EBITDA."
AC_2020.txt,The company has allocated ₱70 billion for 2021 capital expenditures.
AC_2020.txt,"Despite the impact of COVID-19, Globe accelerated its cell site buildout and upgrades, fiber-to- the-home deployments, and 5G coverage."
AC_2020.txt,"Globe was able to build close to 1,300 new cell sites or towers compared to 1,100 in the previous year."
AC_2020.txt,"Also, the aggressive modernization of its existing network infrastructure resulted in a total of 11,529 site upgrades to 4G/LTE this year, higher than the 10,135 in 2019."
AC_2020.txt,"Moreover, Globe deployed 5G sites in Metro Manila and in select Visayas and Mindanao cities, making 5G available in 1,045 areas in the country."
AC_2020.txt,"These network improvements enhanced Globe’s customer experience and the Filipino digital lifestyle, addressing the challenges of the new normal."
AC_2020.txt,"Cost of sales and services declined 24 percent to ₱144.2 billion, which was aligned with the decline in revenues."
AC_2020.txt,"As a percentage of total costs and expenses, this account is an 82 percent and 86 percent December 31, 2020 and 2019, respectively."
AC_2020.txt,Total assets rose four percent to ₱1.41 trillion from end-2019 level.
AC_2020.txt,Inventories increased 19 percent due to an increase in attributable to ALI’s higher real estate inventories due to lower sales amid the pandemic.
AC_2020.txt,"Assets under PFRS 5 increased 14 percent due to MWC’s higher cash and cash equivalents and short-term investments coming from proceeds of loan availments, higher receivables resulting from credit extension of customer payment amid the pandemic and to the increase of property, plant and equipment, and service concession assets due to construction of additional facilities and concession fees."
AC_2020.txt,"Cash and cash equivalents and short-term investments decreased 16 percent due to lower collections of subsidiaries, AC’s and ALI’s share buy-back programs, infusions to business units, new and additional investments such as the Yoma group and assets under AC Energy, and debt payments and dividend payout."
AC_2020.txt,These were partially offset by dividends to AC as well as loan availments of AC and proceeds of ALI on AREIT’s IPO and IMI on VIA’s IPO.
AC_2020.txt,"These accounts comprise six percent and eight percent of total assets as of December 31, 2020 and 2019, respectively."
AC_2020.txt,"Total debt increased nine percent to ₱441.8 billion due to borrowings of Ayala Land for capital expenditures, buy-back of shares, and dividend payments, borrowings of AC Energy and AC Infra for operational expansion, and borrowings of parent for its investment in the Yoma group and FLL bond issuance."
AC_2020.txt,These were partially offset by the loan repayments of Ayala Land and IMI as well as AYC’s forex translation difference of foreign loans.
AC_2020.txt,Parent* level cash stood at ₱19.9 billion.
AC_2020.txt,Parent* net debt stood at ₱104.7 billion.
AC_2020.txt,Parent* net debt-to-equity ratio stood at 80 percent.
AC_2020.txt,Group net debt-to-equity stood at 64 percent.
AC_2020.txt,"Loan-to-value ratio, the ratio of its parent net debt (excluding the fixed-for-life perpetuals which have no maturity) to the total value of its assets, was at 9.2 percent."
AC_2020.txt,Parent blended cost of debt at 4.5 percent ending December 2020 with average remaining life of 17.4 years.
AC_2020.txt,Consolidated capital expenditure reached ₱152 billion in 2020.
AC_2020.txt,"Parent-only CAPEX spending stood at ₱12.1 billion, which went mostly to the newer businesses
of Ayala."
AC_2020.txt,"For 2021, Ayala has programmed approximately ₱196 billion in group CAPEX, of which ₱11.5 billion has been earmarked under the parent to support the emerging businesses in its portfolio."
AC_2020.txt,"The December 31, 2020 and 2019 consolidated financial statements show MWC accounts reclassified as assets/ liabilities and operations under PFRS/ IFRS 5 in the Balance Sheet and Income Statement, respectively arising from MWC and Prime Metroline Holdings signing of a subscription agreement in February 2020."
AC_2020.txt,"Also, the balance sheet accounts of GNPK from AC Energy group were similarly classified as assets and liabilities under PFRS/ IFRS 5."
AC_2020.txt,Further discussions are in Notes 2 and 25 of the Group’s 2020 audited consolidated financial statements (FS).
AC_2020.txt,"The Covid-19 impacted the health and economy globally, consequently, affected the operations of the Group: from lockdown in February 2020 in certain areas of China (where the Group operates) to World Health Organization’s declaring this as pandemic in March 11, 2020."
AC_2020.txt,"The period of until July 2020 saw harsher impact of this Covid-19 pandemic in the Philippines: from state of health emergency in March 8, declaring mega Metro Manila (MM) under enhanced community quarantine (ECQ) in March 15, to implementation of wider coverage of ECQ in other parts of Luzon and certain areas of Visayas and Mindanao and also declaring the country under state of calamity in March 17."
AC_2020.txt,"The declaration of general community quarantine (GCQ) in mega MM and other parts of the country in August 2020, allowed certain business establishments to operate and essential movements of people, which allowed certain business units in the Group to slowly commence and pick up from operations amid slowness or absence of normalcy in the general business environment."
AC_2020.txt,"In this regard, one of the key reasons for the year-on-year variances was the impact of this ECQ/ GCQ in the year ending December 2020."
AC_2020.txt,"The following account balances reflected the effect in operations of this health and economic crisis:
Cash & cash equivalents and Short-term investment – 16% decrease from combined balance of ₱106,793 million to ₱89,476 million
Decline primarily due to lower collections of subsidiaries, buy-back of shares (AC and ALI); infusions to business units, new and additional investments (e.g."
AC_2020.txt,"Yoma group, Sacasol."
AC_2020.txt,"Islasol and Philwind), debt payments and dividend payout; partly offset by dividends received by AC and its loan availments and for most subsidiaries (ALI, AYC, AC Energy) as well as proceeds from initial public offering of ALI - AREIT and IMI-VIA."
AC_2020.txt,"These accounts comprise 6% and 8% and of the total assets as of December 31, 2020 and 2019, respectively."
AC_2020.txt,"Accounts and notes receivable (current) – 5% increase from ₱130,869 million to ₱137,094 million
Increase attributable to ALI’s and AC Energy’s longer collection period due to restricted operations; partly offset by IMI’s decline in receivables caused by lower consumer/ telecom business lines from China sales and collections of Philippine accounts."
AC_2020.txt,"This account is at 10% of the total assets as of December 31, 2020 and 2019."
AC_2020.txt,"Inventories – 19% increase from ₱135,064 million to ₱160,872 million
Increase attributable to ALI’s higher real estate inventories due to lower sales."
AC_2020.txt,"This account is at 11% and 10% of the total assets as of December 31, 2020 and 2019, respectively."
AC_2020.txt,"Accounts payable & accrued expenses, Contract liabilities and Other current liabilities – 9% decrease from combined balance of ₱224,063 million to ₱203,912 million
Decrease due to restricted operations in the current year plus settlement of outstanding suppliers’ and contractors’ accounts, lower customer deposits and AC’s dividend payment."
AC_2020.txt,These were partly offset by impact of consolidation of Islasol and Sacasol entities under AC Energy.
AC_2020.txt,"These accounts comprise at 24% and 27% of the total liabilities as of December 31, 2020 and 2019, respectively."
AC_2020.txt,"Income tax payable – 20% decrease from ₱2,397 million to ₱1,907 million
Decrease from ALI group due to its lower taxable income."
AC_2020.txt,"This account is at below 1% of the total liabilities as of December 31, 2020 and 2019."
AC_2020.txt,Another key transaction that affected the Group’s consolidated balance sheet is AC Energy Group’s consolidation of Islasol and Sacasol (see Notes 2 and 24 of 2020 audited consolidated FS).
