Filename,Ticker,Year,Sentence
AC_2017.txt,AC,2017,"Accounts and notes receivable (non-current) – 25% increase from P=36,484 million to P=45,774 million Increase attributable to ALI’s growth in real estate sales, following the introduction of new longer payment terms resulting to the reclassification of trade receivables from current accounts."
AC_2017.txt,AC,2017,"This account is at 4% of the total assets as of December 31, 2017 and 2016."
AC_2017.txt,AC,2017,"Investments in associates & joint ventures – 12% increase from P=180,314 million to P=202,649 million Growth was attributable to new and additional investments of ACEHI (Chevron and UPC Sidrap units), AC Ventures (Zalora and Mynt accounts) and ALI (Eton); plus share in net earnings from BPI, Globe, and from existing investees of ALI, MWCI, ACEHI, Infra groups; partially offset by BHL’s partial disposal of investments (Vinaphil/ CII)."
AC_2017.txt,AC,2017,"This account is at 20% of the total assets as of December 31, 2017 and 2016."
AC_2017.txt,AC,2017,"Investment Properties – 24% increase from P=110,917 million to P=137,658 million Increase related to ALI group’s expansion projects mainly on malls, office properties and certain land development."
AC_2017.txt,AC,2017,"This account is at 13% and 12% of the total assets as of December 31, 2017 and 2016, respectively."
AC_2017.txt,AC,2017,"Property, plant and equipment – 33% increase from P=64,074 million to P=85,431 million Increase coming from ACEHI’s construction of power plants for GNP Kauswagan's coal investment; ALI’s capital expenditures for its hotels and resorts operations; IMI’s new capex for Europe and Mexico sites; and MWC’s expansion project; plus impact of consolidation of new subsidiaries of ACEHI, IMI and ACI/Automotive."
AC_2017.txt,AC,2017,"This account is at 8% and 7% of the total assets as of December 31, 2017 and 2016, respectively."
AC_2017.txt,AC,2017,"Service concession assets – 10% increase from P=82,422 million to P=91,050 million Increase attributable to MWC’s additional service concession assets."
AC_2017.txt,AC,2017,"This account is at 9% of the total assets as of December 31, 2017 and 2016."
AC_2017.txt,AC,2017,"ntangible assets – 72% increase from P=9,716 million to P=16,705 million Higher balance pertains to goodwill arising from new investments: IMI’s Via and STI acquisitions (net of P=2.9B), ACEHI’s acquisitions in VRC, AEDCI, SCC, Solienda and MSPDC (P=2.2B), and BHL’s intangibles (P=0.6B); plus ALI’s incremental leasehold rights (P=0.9B)."
AC_2017.txt,AC,2017,"This account is at 2% and 1% of the total assets as of December 31, 2017 and 2016, respectively."
AC_2017.txt,AC,2017,"Other noncurrent assets - 22% decrease from P=25,847 million to P=20,054 million Decrease due to ALI’s decline in advances/project development costs; ACEHI’s use of cash deposit to fund investment in an associate; BHL’s net disposal of investment; partially offset by MWC’s increase in relation to deposit for land acquisition."
AC_2017.txt,AC,2017,"The account also includes the Group’s pension asset amounting to P=98 million.1 This account is at 2% and 3% of the total assets as of December 31, 2017 and 2016, respectively."
AC_2017.txt,AC,2017,"Income tax payable – 25% decrease from P=2,270 million to P=1,710 million Decline mainly arising from lower tax payable of ALI group."
AC_2017.txt,AC,2017,"This account is less than 1% of the total liabilities as of December 31, 2017 and 2016."
AC_2017.txt,AC,2017,"Long-term debt (current) – 31% decrease from P=19,793 million to P=13,732 million Decrease on account of AC’s settlement of bonds due 2017; partially offset by increase in loans due to additional borrowings of ALI, MWC and ACEHI including impact of revaluation of certain foreign currency denominated loans and reclassification from noncurrent account."
AC_2017.txt,AC,2017,"This account is at 2% and 4% of the total liabilities as of December 31, 2017 and 2016, respectively."
AC_2017.txt,AC,2017,Service concession obligation (current) – 7% increase from P=754 million to P=804 million Increase was due to MWCI’s higher computed and actual obligation due within one year.
AC_2017.txt,AC,2017,"This account is at less than1% of the total liabilities as of December 31, 2017 and 2016."
AC_2017.txt,AC,2017,"Other current liabilities – 48% increase from P=17,523 million to P=25,984 million Increase due to ALI’s and ACI/ Automotive’s higher customer deposits; impact of consolidation of new subsidiaries of IMI; and AC Ventures’ subscription payable for new investments."
AC_2017.txt,AC,2017,"This account is at 4% and 3% of the total liabilities as of December 31, 2017 and 2016, respectively."
AC_2017.txt,AC,2017,"Long-term debt (noncurrent) – 25% increase from P=245,203 million to P=306,975 million Increase contributed by bond issuance of AC, AYC and ALI including the latter’s long-term notes; plus long-term borrowings for expansion projects of ALI, ACEHI and MWC."
AC_2017.txt,AC,2017,"This account is at 50% and 45% of the total liabilities as of December 31, 2017 and 2016, respectively."
AC_2017.txt,AC,2017,"Service concession obligation (non-current) – 14% increase from P=6,823 million to P=7,748 million Increase was due to MWCI’s higher computed actual obligation."
AC_2017.txt,AC,2017,"This account is at 1% of the total liabilities as of December 31, 2017 and 2016."
AC_2017.txt,AC,2017,"Deferred tax liabilities – 15% decrease from P=9,544 million to P=8,108 million Decrease attributable to ALI’s and MWC’s groups decrease in DTL."
AC_2017.txt,AC,2017,"This account is at 1% and 2% of the total liabilities as of December 31, 2017 and 2016, respectively."
AC_2017.txt,AC,2017,"Pension liabilities1 – 5% increase from P=2,469 million to P=2,601 million Increase due to net adjustment in deferred tax of ACI/Automotive and AC."
AC_2017.txt,AC,2017,"This account is at less than 1% of the total liabilities as of December 31, 2017 and 2016."
AC_2017.txt,AC,2017,"Other noncurrent liabilities – 6% increase from P=40,870 million to P=43,234 million Increase primarily due to ALI’s higher real estate deposits; and IMI’s higher balances arising from consolidation of new subsidiaries; partially offset by MWC’s reclassification of deposit to accounts payable account."
AC_2017.txt,AC,2017,"This account is at 7% and 8% of the total liabilities as of December 31, 2017 and 2016, respectively."
AC_2017.txt,AC,2017,Cost of share based payments – 50% decrease from P=496 million to P=248 million Additions from exercise of stock ownership plans granted during the period was reduced by the adjustment on cost of share based recognized in 2017 following the change on certain valuation assumptions to align with same changes in the stock ownership plan of AC.
AC_2017.txt,AC,2017,"This account is at less than 1% of the total equity as of December 31, 2017 and 2016."
AC_2017.txt,AC,2017,"Remeasurement gains (losses) on defined benefit plan – 16% increase from negative P=1,548 million to negative P=1,303 million Increase attributable to the effect of PAS 19- immediate recognition of service cost and re-measurement of unrealized actuarial gains/losses."
AC_2017.txt,AC,2017,"Net unrealized gains (losses) on available-for-sale financial assets – 137% decline from negative P=467 million to negative P=1,108 million Decline pertains mainly to realized gain recognized in P&L by BHL and AC upon disposal of certain AFS investments; partially offset by increase in the market value of securities held by BPI group as AFS financial assets."
AC_2017.txt,AC,2017,"This account is at less than 1% of the total equity as of December 31, 2017 and 2016."
AC_2017.txt,AC,2017,"Cumulative translation adjustments - 98% increase from P=1,415 million to P=2,794 million Increase due to upward impact of net foreign assets, significantly coming from ALI, IMI, ACI/Automotive groups and ACIFL and BHL."
AC_2017.txt,AC,2017,Forex of PhP= vs US$ increased causing higher CTA figure (P=49.93 in December 2017 vs. P=49.72 in December 2016).
AC_2017.txt,AC,2017,"This account is at less than 1% of the total equity as of December 31, 2017 and 2016."
AC_2017.txt,AC,2017,"Equity Reserve - 5% decrease from P=12,211 million to P=11,600 million Decrease related to equity transactions for investments of ALI (POPI and CHI) and IMI (STI)."
AC_2017.txt,AC,2017,"This account is at 3% of the total equity as of December 31, 2017 and 2016."
AC_2017.txt,AC,2017,"Retained earnings – 17% increase from P=145,622 million to P=170,302 million Increase represents share in full year 2017 group net income net of dividends declared."
AC_2017.txt,AC,2017,"This account is at 41% and 39% of the total equity as of December 31, 2017 and 2016, respectively."
AC_2017.txt,AC,2017,"Non-controlling interests – 10% increase from P=140,073 million to P=154,745 million Higher amount represents share in full year 2017 group net income and OCI net of dividends declared by subsidiaries to its non-controlling interests."
AC_2017.txt,AC,2017,"This account is at 38% of the total equity as of December 31, 2017 and 2016."
AC_2017.txt,AC,2017,"In 2017, the Group changed the presentation of its consolidated statement of income from the single step to the multiple step presentation."
AC_2017.txt,AC,2017,This presentation better reflects and distinguishes other income from revenue and other charges from the operating expenses of the Group.
AC_2017.txt,AC,2017,Prior years consolidated statements of income have been re-presented for comparative purposes.
AC_2017.txt,AC,2017,"The change in presentation has no impact on the consolidated net income, equity, cash flows and earnings per share of the Group in 2016 and 2015."
AC_2017.txt,AC,2017,"Sale of goods and rendering services – 22% increase from a total of P=199,209 million to P=242,228 million Growth in sale of goods came primarily from higher sales of: ALI group (higher lot sales, all segment of housing, residential and condo units); IMI group (consolidation of its new subsidiary and better output of its automotive electronics and industrial segments); and ACI/ Automotive group (vehicle sales across brands plus notable sales for motorcycles)."
AC_2017.txt,AC,2017,Higher revenues from rendering of services of ACEHI group primarily coming from consolidation of new subsidiary and its RES unit; and higher revenues of IMI and MWCI.
AC_2017.txt,AC,2017,"As a percentage to total income, this account is at 84% in December 31, 2017 and 2016."
AC_2017.txt,AC,2017,"Dividend and other income – 64% increase from P=13,146 million to P=21,592 million Increase due to MWC’s higher rehabilitation works (P=5.0B increase); ALI’s reversal of impairment provision for a real estate property based on latest appraisal report, higher management, marketing fees and investment related gain (P=1.7B increase); IMI’s forex gain and MTM valuation of certain investment account (P=652M increase); BHL’s divestments gain (P=544M increase); ACEHI’s fee from services rendered that marked the financial closing and construction of power project and higher dividend income (P=266M increase)."
AC_2017.txt,AC,2017,"This account is at 7% and 6% of the total income in December 31, 2017 and 2016, respectively."
AC_2017.txt,AC,2017,"Cost of sales and rendering services – 24% increase from P=141,350 million to P=175,674 million Increase resulting from higher sales of ALI arising from lot sales and residential units, and higher sales of IMI and ACI/Automotive group and higher service revenues of ACEHI."
AC_2017.txt,AC,2017,"As a percentage to total costs and expenses, this account is at 77% in December 31, 2017 and 2016."
AC_2017.txt,AC,2017,"General and administrative expenses – 20% increase from P=20,933 million to P=25,213 million Increase mainly on combined increments in the group’s expenses specifically from: ALI (contracted services, professional fees, taxes, retirement and trainings), AC, ACEHI and MWC (manpower, insurance costs, depreciation expenses plus AR provisions for MWCI), ACI/ Automotive (marketing and promo expenses) and IMI (manpower costs, professional/ management fees) including impact of consolidation of new subsidiaries of IMI and ACEHI."
AC_2017.txt,AC,2017,"As a percentage to total costs and expenses, this account is at 11% in both December 31, 2017 and 2016."
AC_2017.txt,AC,2017,"Other charges – 72% increase from P=6,805 million to P=11,672 million Increase due to higher rehabilitation works costs of MWC."
AC_2017.txt,AC,2017,"As a percentage to total costs and expenses, this account is at 5% and 4% both in December 31, 2017 and 2016, respectively."
AC_2017.txt,AC,2017,"Provision for income tax (current and deferred) – 17% increase from P=10,507 million to P=12,260 million Increase primarily due to higher taxable income of several subsidiaries significant portion is attributable to ALI group on account of better sales and other operating results."
AC_2017.txt,AC,2017,"Income attributable to Owners of the parent – 16% increase from P=26,011 million to P=30,264 million Increase resulting from better performance of most subsidiaries of the Group."
AC_2017.txt,AC,2017,"Income attributable to Non-controlling interests – 12% increase from P=17,421 million to P=19,603 million Increase resulting from better operating results of most of the subsidiaries of the Group."
