Filename,Ticker,Year,Sentence
AC_2017.txt,AC,2017,"Ayala Corporation recorded a net income of ₱30.3 billion in 2017, climbing 16 percent from the previous year on the back of robust double-digit growth of its real estate and power businesses."
AC_2017.txt,AC,2017,"Sales of goods and services climbed 22 percent to ₱242.2 billion, on the back of higher sales in all housing, residential, and condominium units of Ayala Land; strong vehicle sales across AC Industrials‘ automotive brands; and the improved output of Integrated Micro-Electronics‘ automotive electronics and industrial segments, as well as the consolidation of its new subsidiary."
AC_2017.txt,AC,2017,"In addition, higher service revenues from AC Energy, primarily from the consolidation of its new subsidiary and Retail Electricity Supply (RES) unit, as well as from IMI and Manila Water, contributed to this."
AC_2017.txt,AC,2017,The account stands at 91 percent of Ayala’s total revenues for 2017.
AC_2017.txt,AC,2017,"The resurgence of property sales combined with a solid leasing business drove Ayala Land’s net earnings during the year, jumping 21 percent to ₱25.3 billion."
AC_2017.txt,AC,2017,"Revenues from property development, which includes residential and office-for-sale developments, as well as commercial lot sales, rose 23 percent to ₱101.5 billion on new bookings and project completion."
AC_2017.txt,AC,2017,"Growth in reservation sales bounced back to double-digit levels during the year at 13 percent, reaching ₱122 billion."
AC_2017.txt,AC,2017,"Commercial leasing revenues, meanwhile, grew 10 percent to ₱31 billion driven by new mall openings, stabilized occupancy of office spaces, and the improved performance of its hotels and resorts portfolio."
AC_2017.txt,AC,2017,Ayala Land’s strategy to rebalance its net income mix is increasingly taking shape.
AC_2017.txt,AC,2017,"In terms of location, established estates (Makati, Nuvali, Bonifacio Global City, Alabang and Cebu) accounted for 54 percent, while new estates and growth centers made up for 46 percent of Ayala Land’s net earnings in 2017."
AC_2017.txt,AC,2017,"In terms of business line, Ayala Land’s recurring income (mall and office leasing, hotels and resorts, and property management segments) accounted for 35 percent, while development income (property sales and construction) contributed 65 percent of Ayala Land’s net income during the year."
AC_2017.txt,AC,2017,Ayala Land spent ₱91.4 billion in capital expenditure during the year.
AC_2017.txt,AC,2017,It launched 28 residential projects amounting to ₱88.8 billion.
AC_2017.txt,AC,2017,"In leasing, it opened five new malls with 189,000 in gross leasable area, and six new offices with 185,000 in gross leasable area."
AC_2017.txt,AC,2017,"In addition, it opened six new hotel and resort facilities, adding 556 rooms to its portfolio in 2017."
AC_2017.txt,AC,2017,Manila Water posted a muted net income growth of one percent to ₱6.2 billion as higher operating expenses and business development costs tempered topline growth during the year.
AC_2017.txt,AC,2017,"Revenues rose five percent to ₱18.5 billion, bolstered by strong revenue contributions from Laguna Water and Boracay Water, as well as higher supervision fees recognized by Estate Water balancing out flat revenue growth in the Manila Concession."
AC_2017.txt,AC,2017,"Operating expenses expanded 19 percent to ₱7.4 billion on higher overhead costs owing to Estate Water’s expansion, business development costs, and a one-time write-off of uncollectible accounts in Laguna Water."
AC_2017.txt,AC,2017,"Manila Water posted higher billed volume across all its business lines, with the non-Manila Concession posting strong double-digit billed volume growth."
AC_2017.txt,AC,2017,"This brought total billed volume to 738.7 million cubic meters, three percent higher year-on-year."
AC_2017.txt,AC,2017,"In the Manila Concession, the two percent-increase in billed volume helped offset the impact of tariff reduction."
AC_2017.txt,AC,2017,Manila Water continues to intensify its infrastructure build-up with a 48 percent expansion in capital expenditures.
AC_2017.txt,AC,2017,"Last year, the Manila Concession completed the Marikina North Sewerage Treatment Plant, while the Pasig North and South System Project is scheduled for completion in November 2019."
AC_2017.txt,AC,2017,Both projects have a capacity of 100 million liters per day.
AC_2017.txt,AC,2017,"Further, Manila Water received a notice of award from the City of Ilagan Water District to establish a joint venture for a bulk water supply and septage management company."
AC_2017.txt,AC,2017,Manila Water also received a notice of award from the Leyte Metropolitan Water District to establish a joint venture for a concession company.
AC_2017.txt,AC,2017,"As part of its ongoing expansion in Southeast Asia, Manila Water is establishing a footprint in Thailand with the signing of a share purchase agreement in February to acquire an 18.72 percent stake in Eastern Water Resources Development and Management Public Company Limited, a publicly- listed water supply and distribution company in Thailand."
AC_2017.txt,AC,2017,"AC Industrials registered a net income of ₱1.2 billion, up four percent from its year-ago level, on the better performance of both its electronics manufacturing and vehicle retail units."
AC_2017.txt,AC,2017,"IMI’s net earnings expanded 21 percent to US$34 million on the back of solid revenue growth, which exceeded the US$1 billion mark during the year."
AC_2017.txt,AC,2017,This topline growth was driven by contribution from recent acquisitions and sustained growth in the automotive and industrial markets.
AC_2017.txt,AC,2017,"Last February, IMI successfully completed its ₱4.998 billion rights offer with the issue of 350 million common shares to existing shareholders."
AC_2017.txt,AC,2017,"AC Industrials, which previously held 50.6 percent of IMI’s outstanding shares, subscribed to its proportionate share, as well as any unsubscribed rights shares."
AC_2017.txt,AC,2017,This raised its stake in IMI to 52 percent.
AC_2017.txt,AC,2017,Proceeds of the rights offer will be used to fund IMI’s capital expenditure program and for debt refinancing.
AC_2017.txt,AC,2017,"Meanwhile, revenues from AC Automotive expanded 37 percent to ₱31.2 billion, boosted by strong sales across all brands—Honda, Isuzu, Volkswagen, and KTM."
AC_2017.txt,AC,2017,"AC Industrials continues to ramp up its portfolio in global and domestic industrial technologies by capitalizing on opportunities arising from disruptive technological shifts, changing industry landscapes, and increasing demand from end-users."
AC_2017.txt,AC,2017,"Last month, AC Industrials acquired a controlling stake in Merlin Solar Technologies Inc., with an ownership interest of 78.2 percent after the close of the transaction and completion of other related activities."
AC_2017.txt,AC,2017,"Merlin is an emerging company that is developing differentiated solar solutions resulting in products with high durability, flexibility, and increased solar power output, allowing for potentially innovative applications in areas with demanding environments, such as transportation and infrastructure."
AC_2017.txt,AC,2017,"Headquartered in San Jose, California, Merlin currently has additional manufacturing facilities in Thailand."
AC_2017.txt,AC,2017,"AC Energy’s net earnings jumped 31 percent to ₱3.5 billion in 2017, primarily driven by fresh equity earnings contribution from its geothermal platform, and boosted by solid contributions from its wind energy assets."
AC_2017.txt,AC,2017,A strong wind regime bolstered the better performance of NorthWind and North Luzon Renewables during the year.
AC_2017.txt,AC,2017,Services income derived from the financial close of a new power plant likewise contributed to AC Energy’s net earnings.
AC_2017.txt,AC,2017,AC Energy continues to execute on its diversification strategy.
AC_2017.txt,AC,2017,"Following the acquisition of Salak and Darajat Geothermal in Indonesia in early 2017, AC Energy is assembling a portfolio of renewable energy assets in Southeast Asia."
AC_2017.txt,AC,2017,"It is developing a 75 megawatt wind project in Sidrap, Indonesia, which is expected to come online in the first quarter of 2018."
AC_2017.txt,AC,2017,"Last January, AC Energy, in partnership with BIM Group of Vietnam, agreed to jointly develop over 300 megawatts of solar power projects in Ninh Thuan province, Vietnam."
AC_2017.txt,AC,2017,"The initial 30 megawatts of the solar project broke ground, with investment for this phase expected to reach 800 billion VND and to be completed within the year."
AC_2017.txt,AC,2017,The solar project is envisioned to be expanded by an additional 300 megawatts.
AC_2017.txt,AC,2017,"Similarly, AC Energy is boosting its conventional energy portfolio."
AC_2017.txt,AC,2017,"Last December, the project financing for the second unit of its 2 x 668 MW super-critical coal fired power plant in Bataan, GNPower Dinginin, achieved financial close."
AC_2017.txt,AC,2017,"AC Energy has approximately 50 percent economic stake in the project, which has an estimated cost of US$1.7 billion."
AC_2017.txt,AC,2017,The project will support the increasing electricity demand of Luzon and Visayas.
AC_2017.txt,AC,2017,"Construction of the first unit is well underway, and is targeted for commercial operations by 2019, with the second unit scheduled for completion by 2020."
AC_2017.txt,AC,2017,"Share of profits of associates and joint ventures reached ₱18.5 billion, up two percent, primarily on the steady increase of equity earnings from investees of Ayala Land and AC Energy, and the better performance of BPI."
AC_2017.txt,AC,2017,This was partially offset by a slight decline in share in earnings from Globe.
AC_2017.txt,AC,2017,"Bank of the Philippine Islands recorded a net income of ₱22.4 billion, up 1.7 percent from its year-ago level, as the absence of one-off gains tempered strong growth in its core banking business during the year."
AC_2017.txt,AC,2017,"Excluding one-off gains from the sale of securities in 2016, net income grew 31 percent in 2017."
AC_2017.txt,AC,2017,Total revenues rose seven percent to ₱71 billion as net interest income expanded 13 percent to ₱48 billion driven by asset growth and improvement in net interest margin.
AC_2017.txt,AC,2017,"Non-interest income, meanwhile, dropped five percent to ₱22.9 billion on the absence of significant trading gains registered in 2016."
AC_2017.txt,AC,2017,"This was partially offset by the bank’s higher fee-based income, which grew 16 percent to ₱19.9 billion, lifted by higher credit card fees, trust and investment management fees, insurance fees, bank commissions, and service charges."
AC_2017.txt,AC,2017,"BPI continues to be a leader in profitability metrics, with cost-to-income ratio at 54.3 percent, slightly higher from the 52.5 percent posted a year ago, mainly driven by its digitalization initiatives."
AC_2017.txt,AC,2017,"Total loans jumped 16 percent to ₱1.2 trillion, boosted by corporate loans."
AC_2017.txt,AC,2017,Asset quality improved with the gross 90-day non-performing loans ratio declining from 1.46 percent to 1.29 percent and reserve cover ratio increasing from 119 percent to 129 percent.
AC_2017.txt,AC,2017,"Last year, BPI announced the creation of a business banking segment, a new client group focused on the banking needs of the country’s small and medium scale enterprises."
AC_2017.txt,AC,2017,"It also raised a record ₱12.2 billion from its offering of long-term negotiable certificates of time deposit, the largest issuance by far in the industry."
AC_2017.txt,AC,2017,"Last January, the bank announced a stock rights offering of up to ₱50 billion to support its strategic initiatives, including the strengthening of its market-leading businesses and core franchises through the expansion of lending activities across consumer, SME, and microfinance segments to capture positive momentum in the domestic economy."
AC_2017.txt,AC,2017,"In addition, the stock rights offer will strengthen BPI’s capital base as it pursues its growth strategy in the medium term."
AC_2017.txt,AC,2017,Ayala has signified its participation in the rights offering.
AC_2017.txt,AC,2017,Globe Telecom’s net earnings dropped five percent to ₱15.1 billion in 2017 due to higher operating expenses and depreciation charges as a result of increased investments in its data network.
AC_2017.txt,AC,2017,"Topline growth, however, remains strong, with service revenues reaching ₱127.9 billion during the year, up six percent year-on-year."
AC_2017.txt,AC,2017,This was fueled by sustained demand for data-related products.
AC_2017.txt,AC,2017,Mobile revenues grew seven percent to ₱98.5 billion.
AC_2017.txt,AC,2017,"Globe’s mobile subscriber base reached 60.7 million at the end of 2017, three percent lower from a year ago."
AC_2017.txt,AC,2017,"The decline in the cumulative mobile subscriber base was a result of the change in reporting Globe’s prepaid subscribers in 2017, which excluded prepaid subscribers who do not reload within 90 days of the second expiry period."
AC_2017.txt,AC,2017,"Mobile data continues to drive Globe’s total mobile revenues, accounting for 44 percent from 38 percent a year ago."
AC_2017.txt,AC,2017,Globe’s home broadband segment posted a seven percent increase in revenues to ₱15.6 billion in 2017.
AC_2017.txt,AC,2017,"Total home broadband subscribers climbed 15 percent to 1.3 million year-on-year, putting Globe on track with its target to provide internet service to two million homes by 2020."
AC_2017.txt,AC,2017,Corporate data business increased four percent from a year ago to ₱10.3 billion owing to strong demand for data-driven solutions by corporates.
AC_2017.txt,AC,2017,"Globe’s consolidated EBITDA improved seven percent to ₱53.3 billion, while EBITDA margin stood at 42 percent from 41 percent in the previous year."
AC_2017.txt,AC,2017,Globe spent around ₱42.5 billion in capital expenditure in 2017 to support its continuous network infrastructure enhancement.
AC_2017.txt,AC,2017,"It launched new products to enable the Filipino digital lifestyle, including Mynt’s rollout of the GCash scan-to-pay system in malls, fast food chains, major retailers, and convenience stores."
AC_2017.txt,AC,2017,"Other income surged 66 percent to ₱20.9 billion in 2017, as compared to ₱12.6 billion in the previous year."
AC_2017.txt,AC,2017,This was largely attributed to income from higher rehabilitation works of Manila Water; the reversal of impairment provision for a real estate property and higher management and marketing fees of Ayala Land; commission fees of AC Energy; and gains on disposal of certain investments of AG Holdings.
AC_2017.txt,AC,2017,Other charges which pertain to rehabilitation works consequently increased in 2017.
AC_2017.txt,AC,2017,"Consolidated cost of sales for the year stood at ₱175.7 billion, a 24 percent increase, brought about by higher sales from the real estate segment, particularly in lots and residential units, AC Industrials‘ electronic manufacturing and automotive retail businesses, and stronger service revenues of the energy group."
AC_2017.txt,AC,2017,Consolidated general and administrative expenses rose 20 percent to ₱25.2 billion.
AC_2017.txt,AC,2017,"This was a result of combined increments in the groups expenses, particularly from Ayala Land’s contracted services, professional fees, taxes, retirement, and trainings; the parent’s, AC Energy’s, and Manila Water’s manpower, insurance costs, depreciation expenses, as well as Manila Water’s AR provisions; AC Industrials‘ automotive business‘ marketing and promotional expenses, and IMI’s manpower costs and professional and management fees."
AC_2017.txt,AC,2017,This also includes the impact of consolidation of IMI and AC Energy’s new subsidiaries.
AC_2017.txt,AC,2017,"Ayala’s balance sheet remains at a healthy level, allowing it to continue supporting its investments and meet its debt and dividend obligations."
AC_2017.txt,AC,2017,"Investments in associates and joint ventures rose to ₱202.6 billion, as a result of new investments made by AC Energy, AC Ventures, and Ayala Land."
AC_2017.txt,AC,2017,"The parent’s share in net earnings from BPI and Globe, as well as existing investees of Ayala Land, Manila Water, AC Energy, and AC Infrastructure, also contributed to growth, tempered in part by Bestfull’s disposal of certain investments."
AC_2017.txt,AC,2017,"Investments in property jumped 24 percent to ₱137.7 billion through the real estate unit’s expansion projects in malls, office properties, and select land development."
AC_2017.txt,AC,2017,"Meanwhile, investments in property and equipment recorded a 33 percent increase to ₱85.4 billion."
AC_2017.txt,AC,2017,"This was lifted by AC Energy’s construction of power plants for GNP Kauswagan, Ayala Land’s capex for hotels and resorts, IMI’s new capital spending for its Europe and Mexico sites, and Manila Water’s expansion projects."
AC_2017.txt,AC,2017,The impact from the consolidation of AC Energy’s and IMI’s new subsidiaries also factored in this account’s growth.
AC_2017.txt,AC,2017,"At the end of 2017, total debt at the consolidated level stood at ₱350.6 billion, a 19 percent increase from the December 2016 level of ₱295.9 billion."
AC_2017.txt,AC,2017,"This was due to capital-raising exercises by the parent, AYC, and Ayala Land, as well as borrowings for expansion projects of the real estate, energy, and water segments."
AC_2017.txt,AC,2017,Total assets crossed the ₱1 trillion mark in 2017.
AC_2017.txt,AC,2017,"Cash at the parent level reached ₱18.6 billion, while net debt stood at ₱64.7 billion."
AC_2017.txt,AC,2017,"Net debt-to-equity ratio was 0.68 at the consolidated level, and 0.59 at the parent level."
AC_2017.txt,AC,2017,"Ayala’s loan-to-value ratio, or the ratio of the parent net debt to the total value of its investments, was 6.4 percent as of end-December 2017."
AC_2017.txt,AC,2017,"In 2017, Ayala spent P=16.1 billion with significant allocation for the expansion plans of its power unit, ACEHI, and AC Industrial's Automotive group."
AC_2017.txt,AC,2017,The Company continues to strategically deploy capital across its businesses to explore new avenues of growth.
AC_2017.txt,AC,2017,"Ayala Land spent P91.4 billion in capital expenditures, higher than its estimated budget of P88.0 billion at the start of 2017, to support the aggressive completion of new projects in its pipeline."
AC_2017.txt,AC,2017,"48% was spent on residential projects, 29% on commercial projects, 17% for land acquisition and other investments and 6% for the development of the estates."
AC_2017.txt,AC,2017,"MWC ended 2017 with total capital expenditures of P=13.03 billion, posting a growth of 48% over the previous year."
AC_2017.txt,AC,2017,"Manila Concession spent a total of P=10.63 billion (inclusive of concession fee payments) for capital expenditures in 2017, 64% more than the P=6.46 billion spent in the same period the previous year."
AC_2017.txt,AC,2017,"Of the total amount, 91% was spent on wastewater expansion, network reliability and water supply projects, while the balance of 9% was accounted for by concession fees paid to MWSS."
AC_2017.txt,AC,2017,"Meanwhile, total capital expenditures of the domestic subsidiaries grew by 3% to P=2.41 billion from the P=2.34 billion spent in 2016."
AC_2017.txt,AC,2017,"Of the total amount, P=955 million was used by Laguna Water for its development of new water sources and network expansion, while Boracay Water and Clark Water disbursed P=464 million and P=263 million, respectively."
AC_2017.txt,AC,2017,"Estate Water spent P=481 million for its greenfield and brownfield projects while the balance was spent by Cebu Water, Tagum Water, Zamboanga Water and MWTS."
AC_2017.txt,AC,2017,"In 2017, IMI spent $65.3 million on capital expenditures as it continues to expand its footprint in higher complex box build offerings, while making disciplined investments to fund its growth initiatives."
AC_2017.txt,AC,2017,"For 2018, IMI expects additional $75 million of capital expenditures majority of which are new SMT lines for expansions and new businesses, new manufacturing facilities and expansion buildings, innovation and automation, and additional software licenses."
AC_2017.txt,AC,2017,"These are intended to expand IMI’s capacity and support expected increases in demand, as well as to sustain IMI’s productivity and efficiency."
AC_2017.txt,AC,2017,"In 2017, ACEHI spent P=17.16 billion in capital expenditures which were partly funded through capital infusions from Ayala Corporation, internally generated funds and long-term borrowings."
AC_2017.txt,AC,2017,"These investments are geared towards completion of project development in the country, investment tie-ups for offshore energy projects and the recent retail electricity supply area."
AC_2017.txt,AC,2017,"2017 marked a year of stronger-than-expected, broad-based economic growth for the world, with a recovery in global trade, investment, and manufacturing."
AC_2017.txt,AC,2017,"This is expected to continue in the short-term, though medium-term prospects are somewhat more muted."
AC_2017.txt,AC,2017,Asia continues to remain a bright spot in the global economy.
AC_2017.txt,AC,2017,The Philippines continues to grow at a healthy pace.
AC_2017.txt,AC,2017,"Already-robust domestic consumption is expected to increase further, supported by the passage of the first package of the government’s tax reform program."
AC_2017.txt,AC,2017,"Some pockets of uncertainty remain, particularly in external and internal policy that may affect trade, and the local business and investment climate."
AC_2017.txt,AC,2017,"As such, the group will continue to monitor relevant global and domestic macroeconomic indicators that may have an effect on its businesses."
AC_2017.txt,AC,2017,Ayala remains overall positive about the macroeconomic environment and its prospects for growth as it continues to execute on its five-year growth strategy through 2020.
AC_2017.txt,AC,2017,Ayala maintains a healthy balance sheet with access to various funding options to meet requirements.
AC_2017.txt,AC,2017,"A robust risk management system allows the company to maximize opportunities for reinvention, and navigate the challenges faced by its business units."
AC_2017.txt,AC,2017,"The audited consolidated financial statements show several significant increases in Balance Sheet and Income Statement accounts (vs. December 31, 2016 balances) relating to the following acquisitions of certain subsidiaries: 1."
AC_2017.txt,AC,2017,"AC Energy Inc.’s (ACEI’s) acquisition of 100% ownership of Visayas Renewable Corp. (VRC) (formerly Bronzeoak Clean Energy), AC Energy DevCo Inc. (AEDCI) (formerly San Carlos Clean Energy), SCC Bulk Water Supply, Inc. (SCC) and Solienda, Inc. (Solienda) and 66% in Manapla Sun Power Development Corp. (MSPDC); 2."
AC_2017.txt,AC,2017,IMI’s acquisition of 80% stake in Surface Technology International Enterprises Limited (STI); and 3.
AC_2017.txt,AC,2017,AC Industrial’s acquisition of 94.9% ownership of MT Misslbeck Technologies Gmbh.
AC_2017.txt,AC,2017,"Cash and cash equivalents – 7% increase from P=60,223 million to P=64,259 million Increase arising from: issuance of bonds by AC’s P10.0B and AYC’s USD 400M fixed for life (FFL) – both used for pre-termination of more expensive loans, infusion into Energy projects and new investment initiatives (Zalora & Mynt); ALI’s P7.0B Homestarter bonds and LT debt drawdowns to fund expansion projects/ property acquisition and ST loan payments; MWC’s new loans to fund maturing loans, CAPEX and expansion projects; ACI/Automotive’s higher sales; and IMI’s consolidation of a subsidiary."
AC_2017.txt,AC,2017,"This account is at 6% and 7% of the total assets as of December 31, 2017 and 2016, respectively."
AC_2017.txt,AC,2017,"Short-term investments – 435% increase from P=1,009 million to P=5,400 million Increase due to increase in ALI’s investments partially offset by AYC’s maturity of short-term investments."
AC_2017.txt,AC,2017,"This account is at less than 1% of the total assets as of December 31, 2017 and 2016."
AC_2017.txt,AC,2017,"Accounts and notes receivable (current) – 6% increase from P=116,842 million to P=124,109 million Increase resulting from surge in sales and impact of consolidation of new subsidiary of IMI; higher sales of ACI/ Automotive; ACEHI’s impact of consolidation of new subsidiary and RES business; and higher sales in ALI less sale of receivables to banks and reclassification of receivables to noncurrent; partially offset by MWC’s decline due to provisions."
AC_2017.txt,AC,2017,"This account is at 12% and 13% of the total assets as of December 31, 2017 and 2016, respectively."
AC_2017.txt,AC,2017,"Other Current Assets – 35% increase from P=33,638 million to P=45,325 million Increase pertains to ALI group’s higher input tax, prepayments and project costs; ACEHI’s and IMI’s higher prepayments and input taxes; BHL’s additional infusion in certain FVPL investments; and reclassification of AC Education’s total assets into other current assets held for sale following the announcement of a potential merger transaction."
AC_2017.txt,AC,2017,"This account is at 4% of the total assets as of December 31, 2017 and 2016."
