filename,sentence
AP_2017.txt,"Distribution utilities are now mandated to create either an independent five-man third party bids and awards committee (TPBAC) that will manage their CSP supply procurements, or have a third party auctioneer (TPA)."
AP_2017.txt,The TPBAC and the TPA shall be accountable to its decision in the conduct of the CSP.
AP_2017.txt,"If a TPBAC is established, it shall be comprised of five (5) members, three (3) of whom shall be officers and/or employees of the distribution utility, and two (2) members shall be captive customers that are not directly or indirectly connected/affiliated with the distribution utility."
AP_2017.txt,"If the relevant distribution utility opts to have a TPA to undertake CSP in its procurement of power supply, the TPA shall be composed of a team of private individuals or a private corporation duly recognized in the Philippines with expertise on competitive bidding and with sufficient knowledge of the electric power industry."
AP_2017.txt,The TPA should not be connected/affiliated either directly or indirectly with the relevant distribution utility.
AP_2017.txt,The accreditation of potential TPAs is handled by the ERC.
AP_2017.txt,"On December 30, 2017, the DOE issued Department Circular No."
AP_2017.txt,"DC2017-12-0015, or the “Renewable Portfolio Standards (RPS) On-Grid Rules”."
AP_2017.txt,"The new policy mandates distribution utilities, RES, generation companies supplying directly connected customers, and other mandated energy sector participants (each, a “Mandated Participant”) to source or produce a certain percentage share of their energy mix from eligible renewable energy (RE) facilities."
AP_2017.txt,"Under the new policy, eligible RE facilities include the following technologies: biomass, waste-to-energy technology, wind, solar, hydro, ocean, geothermal, and such other RE technologies that may be later identified by the DOE."
AP_2017.txt,The new policy mandates identified energy sector participants to comply with minimum annual RPS requirement in order to meet an “aspirational target” of 35% renewable energy supply in the generation mix by the year 2030.
AP_2017.txt,"The RPS guidelines will implement a Minimum Annual Increment RE Percentage to be sold to mandated participants, initially set at 1% of the net electricity sales of the mandated participant for the previous year."
AP_2017.txt,"Furthermore, this Minimum Annual Increment RE Percentage will be used to determine the current year’s requirement for RE Certificates (RECs) of the Mandated Participant."
AP_2017.txt,"RE sourcing shall be enforced on the third year from the issuance of the DOE Circular in the year 2020, with the period 2018-2019 considered as the transition phases to project developments."
AP_2017.txt,"The RPS On-Grid Rules, which shall be implemented nationwide, also envisions the creation of an RE market where mandated participants comply with the Minimum Annual RPS Requirement through the allocation, generation, purchase or acquisition, or generation from net-metering arrangements, of RE Certificates."
AP_2017.txt,The RE Certificates will represent 1 MWh of generation produced from an eligible RE facility.
AP_2017.txt,"Furthermore, all Mandated Participants must undertake a CSP in sourcing RE generation supply for its customers."
AP_2017.txt,"In February 2018, the ERC issued Resolution No."
AP_2017.txt,"20, Series of 2017 (ERC Resolution No."
AP_2017.txt,20-2017) entitled “A Resolution Adopting the ERC Rules for Setting the Distribution System Loss Cap and Establishing Performance Incentive Scheme for Distribution Efficiency”.
AP_2017.txt,"This set of rules provide for the new Distribution System Loss (DSL) cap that can be recovered and charged by distribution utilities to its customers, beginning in the May 2018 billing period."
AP_2017.txt,"Private distribution utilities shall charge a 6.50% DSL cap for 2018, which shall be reduced gradually on an annual basis until a DSL cap level of 5.50% is achieved by the year 2021."
AP_2017.txt,The aforementioned caps are exclusive of sub-transmission and substation losses.
AP_2017.txt,"Thereafter, the Private Electric Power Operators Association (PEPOA) wrote a letter to the ERC seeking for a one year delay of the effectivity of the recoverable rate under the new DSL cap, to the May 2019 billing period."
AP_2017.txt,"With the additional year, the member distribution utilities could make the appropriate upgrades to their distribution systems for cost-effective system loss reduction measures, and ultimately, achieve efficient operation of their utilities."
AP_2017.txt,"These capital expenditure projects such as upgrading transformers or primary and secondary voltage distribution lines, require careful planning, implementation, and ERC approval."
AP_2017.txt,These material and physical changes to distribution systems cannot be achieved in two months.
AP_2017.txt,"AboitizPower is considering the filing of individualized system loss applications to the ERC, where justifiable for a particular Distribution Utility."
AP_2017.txt,The foregoing ERC Resolution 20-2017 provides that a distribution utility may elect to use an alternative method in determining its applicable individualized DSL cap.
AP_2017.txt,The Company believes that costs and benefits must be analyzed from the viewpoint of the customer determining the reasonable level of individualized DSL cap.
AP_2017.txt,"In February 2018, the Philippine Senate passed a bill setting the recoverable system loss rate for the private distribution utilities at 5%."
AP_2017.txt,"Meanwhile, the Philippine House of Representatives is conducting technical working group meetings to gather inputs from industry stakeholders."
AP_2017.txt,DOE Circular No.
AP_2017.txt,"2015-06-0010 and ERC Resolutions 5, 10 and 11, Series of 2016, are all subject of a Petition for Declaratory Relief filed by Meralco with the Regional Trial Court of Pasig (the “Pasig RTC”) in June 2016 (the “Petition”)."
AP_2017.txt,"On July 13, 2016, the Pasig RTC has issued a writ of preliminary injunction enjoining the DOE and ERC from implementing the aforementioned Circular and Resolutions, insofar as relating to the prohibition on distribution utilities from engaging in the supply business, and the imposition of restrictions, contract term limits, mandatory contestability, and market caps."
AP_2017.txt,"On September 21, 2016, the DOE filed a Petition for Certiorari and Prohibition to the Supreme Court praying, among others, for the nullification of all Orders and Decisions issued by the Pasig RTC."
AP_2017.txt,"The Supreme Court issued a Resolution on October 10, 2016 granting a Temporary Restraining Order enjoining the Pasig RTC from enforcing its decisions, orders, and resolutions related to the Petition until its final resolution."
AP_2017.txt,"On November 15, 2016, the ERC issued Resolution No."
AP_2017.txt,"28, Series of 2016, revising the timeframe of mandatory contestability from December 26, 2016 to February 26, 2017."
AP_2017.txt,"On February 21, 2017, the Supreme Court issued a TRO in relation to the petition to stop the implementation of the new regulations imposing mandatory contestability filed by Philippine Chamber of Commerce and Industry San Beda College Alabang Inc., Ateneo de Manila University, and Riverbanks Development Corporation before the Supreme Court in December 2016."
AP_2017.txt,The TRO enjoined the ERC and the DOE from implementing ERC Resolutions No.
AP_2017.txt,"5, 10, 11, and 28, Series of 2016, and DOE Circular No."
AP_2017.txt,2015-06-0010.
AP_2017.txt,"On May 4, 2017, the DOE issued DC 2017-05-0009 entitled “Declaring the Launch of WESM in Mindanao and Providing Transition Guidelines”."
AP_2017.txt,"This DOE Circular took effect on June 7, 2017, with the following pertinent provisions: 1."
AP_2017.txt,"Establishment of Mindanao WESM Transition Committee, which will be one of the committees under the Philippine Electricity Market Corporation (PEMC) Board; 2."
AP_2017.txt,"Launch of WESM in Mindanao on June 26, 2017, with the commencement of full commercial operations dependent on various conditions precedent, including installation of metering facilities, approval of the Price Determination Methodology by the ERC, and trial operations of the WESM, among others; 3."
AP_2017.txt,Conduct of the Trial Operation Program for the WESM; 4.
AP_2017.txt,Automatic termination of IMEM; and 5.
AP_2017.txt,"Implementation of an Interim Protocol to govern the dispatch and scheduling of power generation plants, while the WESM is still not operational."
AP_2017.txt,"On December 2, 2013, the DOE issued Department Circular No."
AP_2017.txt,"DC2013-12-0027 entitled: “Declaring the Commercial Launch for the Trading of Ancillary Service in Luzon and Visayas under the Philippine Wholesale Electricity Spot Market""."
AP_2017.txt,"This DOE Circular sets the responsibility of the PEMC, National Grid Corporation of the Philippines (NGCP), National Electrification Administration, and all WESM members in relation to the operation of the Reserve Market (market that basically provides back-up power that could be tapped by the NGCP)."
AP_2017.txt,"As of this writing, no date has been set for the launch of the Reserve Market."
AP_2017.txt,"Pending the ERC’s approval of the Price Determination Methodology of the Reserve Market, the DOE and PEMC implemented the Central Dispatch and Scheduling of Energy and Reserves in the WESM starting January 2016."
AP_2017.txt,"The protocol follows that of the Reserve Market, with participants being only those contracted with NGCP, and that no settlement amount will come from the WESM."
AP_2017.txt,"On May 2017, the DOE approved the new FIT-All rate for 2016 at ₱0.1830/kWh."
AP_2017.txt,The new FIT-All rate for 2016 took effect in the immediately succeeding billing period following the receipt by National Transmission Corporation of the aforementioned decision.
AP_2017.txt,"In March 2017, the ERC issued Resolution No."
AP_2017.txt,"01, Series of 2017, entitled “Resolution Setting the Degressed Feed-In Tariff Rates for Run-of-River Hydro and Biomass, as provided in Section 2.11 of the Feed-In Tariff Rules (FIT Rules)”."
AP_2017.txt,The degressed rates will be applied for run-of-river hydro and biomass plants which commenced commercial operations in the period January to December 2017.
AP_2017.txt,"The degressed rate for hydro is ₱5.8705/kWh, and ₱6.5969/kWh for biomass."
AP_2017.txt,"The DOE, through the National Renewable Energy Board (NREB), aims to release the final rules for the Green Energy Option (GEOP) in 2018."
AP_2017.txt,The NREB has conducted several public consultations nationwide as part of the requirements for the approval of the policy.
AP_2017.txt,"Under the GEOP, electricity end-customers will be allowed to access renewable energy resources through their distribution utility, electric cooperatives, or electricity suppliers."
AP_2017.txt,The NREB is expected to submit its output on the policy to the DOE for the latter’s review and eventual promulgation.
AP_2017.txt,"boitizPower is allotting ₱62 bn for capital expenditure in 2018, of which 82% is for new thermal projects, 3% for new renewable projects, and 15% for exploratory and operating activities."
