filename,sentence
AP_2017.txt,"Share in net earnings in associates and joint ventures grew by 29% in 2017, as contributions from SN Aboitiz Power-Magat and SN Aboitiz Power-Benguet increased."
AP_2017.txt,The improved hydrology experienced by both companies during the first half of 2017 led to higher revenues.
AP_2017.txt,"The primary driver of the 25% growth in EBITDA during 2017 was the full year EBITDA contributions of GNPower Mariveles, which was acquired by the Company at the close of 2016."
AP_2017.txt,"Supported by increased cash flows from operations and inflows from new loans, the Company continued to infuse capital to its Subsidiaries in 2017 to complete various projects, made timely payments on its obligations, and distributed dividends to its shareholders."
AP_2017.txt,"During 2017, net outflows relating to financing and investing activities outpaced cash inflow from operations, which led to the ₱11.34 bn decrease in cash and cash equivalents as of year-end 2017."
AP_2017.txt,"Current ratio at the end of 2017 was 1.38x, down from end-2016’s 2.25x."
AP_2017.txt,"This was driven by the 8% decrease in current assets mainly due to the decrease in cash and cash equivalents, coupled with a 50% increase in current liabilities as certain long-term debt are expected to fall due in 2018."
AP_2017.txt,"Debt-to-equity ratio as of December 31, 2017 was at 1.92:1, down from end-2016’s 2.18:1, as long-term debts were paid down in 2017."
AP_2017.txt,"The Company’s net income for 2017 increased to ₱20.42 bn from ₱20.00 bn in 2016, a 2% year-on-year (YoY) increase."
AP_2017.txt,This translated to earnings per share of ₱2.77 for 2017.
AP_2017.txt,"During 2017, the Company recognized non- recurring losses of ₱2.90 bn (versus 2016’s non-recurring loss of ₱611 mn), primarily due to asset impairment costs related to Aseagas and debt prepayment costs on an existing loan of GNPower Mariveles, which were partially offset by a one-off recognition of lower interest expense from an acquired loan."
AP_2017.txt,"Without these one-off adjustments, the Company’s core net income grew to ₱23.35 bn in 2017 from ₱20.61 bn in 2016, or an increase of 13% YoY."
AP_2017.txt,"On a full year basis, the power generation group recorded a consolidated EBITDA share of ₱38.79 bn in 2017, up 27% YoY, and accounted for 83% of the EBITDA contributions from the Company’s business segments."
AP_2017.txt,"This was driven by the full-year fresh contribution from GNPower Mariveles, and the higher EBITDA of the hydro group as power generation increased during 2017 due to higher water inflows."
AP_2017.txt,"At the core net income level, the power generation group grew 18% YoY, from ₱17.16 bn in 2016 to ₱20.20 bn in 2017."
AP_2017.txt,"Non-recurring charges relating to impairment costs, prepayment charges on GNPower Mariveles’ loan upon refinancing, and the one-off recognition of lower interest expense from the foregoing acquired loan, brought the power generation group’s net income contribution in 2017 to ₱17.07 bn."
AP_2017.txt,"The Company’s capacity sold increased by 41% YoY, from 2,223 MW in 2016 to 3,124 MW in 2017."
AP_2017.txt,"This was mainly driven by the additional capacities from GNPower Mariveles, increased generation by its HEPPs, and additional capacities contracted."
AP_2017.txt,"The distribution group’s EBITDA increased by 14% YoY, to ₱7.76 bn in 2017."
AP_2017.txt,Net income contribution in 2017 increased by 16% YoY to ₱4.27 bn.
AP_2017.txt,"The distribution group’s gross margin on a per kWh basis increased by 9% YoY, to ₱1.73 in 2017 from ₱1.59 in 2016."
AP_2017.txt,"The improved margins were driven by more adequate power supply, better supply mix, and recoveries on purchased power costs."
AP_2017.txt,"The distribution group’s attributable sales for 2017 was 5,288 GWh, registering a 4% YoY increase from 2016."
AP_2017.txt,"Revenues of the power distribution group decreased by 2% YoY, while the power generation group saw a 61% YoY increase from ₱35.69 bn in 2016 to ₱57.42 bn in 2017."
AP_2017.txt,The full year consolidation of the operating revenues of GNPower Mariveles accounted for 96% of the increase in the power generation group’s revenue.
AP_2017.txt,The balance of this increase was attributed to higher operating revenues at the small HEPPs (increase of 14% YoY) due to better hydrology in 2017 and the full commercial operations of TSI two units during 2017.
AP_2017.txt,The higher operating revenues were partly offset by lower operating revenues at TMI during 2017 as a result of expiring contracts.
AP_2017.txt,"In anticipation of the commercial operations of PEC and TVI in 2018, the RES companies progressively entered into contracts throughout 2017, resulting in a ₱9.59 bn increase in operating revenues."
AP_2017.txt,Cost of purchased power increased by ₱6.48 bn during 2017 as RES companies incur higher costs to serve their new contracts.
AP_2017.txt,Cost of generated power increased during 2017 as the costs at GNPower Mariveles were consolidated during the year.
AP_2017.txt,This accounted for ₱7.35 bn of the ₱11.24 bn increase in this account for 2017.
AP_2017.txt,"The balance came from higher cost of steam at APRI, as well as higher fuel costs at the thermal companies due to the price increases on coal and oil during 2017."
AP_2017.txt,"All other operating expenses relating to general and administrative expenses, operations and maintenance, and depreciation and amortization increased during 2017 as a result of the full year consolidation of GNPower Mariveles’ expenses."
AP_2017.txt,"The decrease in interest income in 2017 was mainly due to lower average cash balances carried at the Parent Company and at its intermediate holding companies, ARI and TPI, during most of the year."
AP_2017.txt,"Higher interest expense incurred on TPI’s bridge loan, full year recognition of GNPower Mariveles’ interest expenses, and interest payments made on the Company’s corporate retail bonds led to the 46% YoY increase during 2017 in this account as compared to 2016."
AP_2017.txt,"This increase was net of lower debt service costs from the Company’s other Subsidiaries, as timely principal payments were made during 2017 on project debts."
AP_2017.txt,"The higher volumes sold and ancillary revenues at SN Aboitiz Power-Magat and SN Aboitiz Power-Benguet led to an increase in contributions in 2017 as compared to 2016, as these companies experienced better hydrology in 2017 as compared to very low hydrology during 2016."
AP_2017.txt,"The shift from an Other Income position in 2016 to an Other Expense position in 2017 was primarily due to an impairment loss on Property, Plant and Equipment (PPE) at Aseagas (₱ 3.13 bn) during 2017, as compared to a non-recurring gain in 2016 relating to supplier settlements."
AP_2017.txt,The increase was due to the full year consolidation of tax provisions taken by GNPower Mariveles.
AP_2017.txt,The increase in this account during 2017 was mainly from the take-up of the minority shareholders’ participation in the income of GNPower Mariveles in 2017.
AP_2017.txt,"The movements in cumulative translation adjustments, the share of an associate's unrealized mark-to-market gains on its available-for-sale (AFS) investments, and the recognition of losses and gains on defined benefit plans led to higher comprehensive income recognized for 2017."
AP_2017.txt,Total consolidated comprehensive income attributable to equity holders of the Parent was ₱20.62 bn for 2017.
AP_2017.txt,"Total assets (as of December 31, 2017 vs. December 31, 2016 as restated) increased by ₱4.47 bn or by 1%."
AP_2017.txt,"The major movements of the accounts leading to the increase were as follows: (a) Cash and cash equivalents decreased by 24%, or by ₱11.40 bn, during 2017."
AP_2017.txt,Cash generated from operations continue to provide significant liquidity for the Company.
AP_2017.txt,"Long-term debt payments were made during 2017, including approximately ₱16 bn on TPI’s bridge financing obtained in 2016 to fund the acquisitions of GNPower Mariveles and GNPower Dinginin; and ₱2.43 bn as prepayment of Aseagas’ project debt."
AP_2017.txt,"During 2017, the Company also made timely payments on its other obligations as they became due, and also paid dividends to its shareholders."
AP_2017.txt,"(b) Trade and other receivables increased by 12% (from ₱15.47 bn in 2016 to ₱17.36 bn in 2017), due to the increase in receivables as new contracts were signed by the Company’s RES-licensed companies, AESI and AdventEnergy, as well as higher trade receivable balances of the Company’s distribution utilities."
AP_2017.txt,"The increases noted in the RES companies and distribution utilities constituted 80% of the increase, with the balance mainly coming from higher trade receivables at TLI and TSI."
AP_2017.txt,(c) Inventories increased by 27% (from ₱4.45 bn in 2016 to ₱5.64 bn in 2017) as higher inventory balances as of year-end 2017 were noted at the Company’s thermal plants.
AP_2017.txt,"(d) Other current assets increased by ₱40% during 2017, driven mainly by higher prepaid insurance and prepaid taxes of the Company’s Subsidiaries."
AP_2017.txt,"(e) At the end of 2017, PPE increased by 6% [from ₱192.98 bn at end-2016 (as restated) to ₱204.03 bn at end- 2017], as various projects entered the final stages of their construction activities, in particular, Hedcor Bukidnon’s hydro project, and TVI and PEC’s coal plants."
AP_2017.txt,(f) The increase in derivative assets (both current and non-current) of the Group by ₱50.08 mn as of end-2017 was driven by fair value changes during the course of 2017.
AP_2017.txt,"(g) Net pension assets went up by ₱11 mn, or 24% during 2017, due to the increase in the fair value of plan assets as contributions made during the year."
AP_2017.txt,"(h) Due to the refinancing of GNPower Mariveles’ outstanding loan in 2017, previously recognized deferred tax assets relating to the loan were written down, resulting in a 22% decrease in the deferred income tax asset account as of end-2017."
AP_2017.txt,"(i) Other non-current assets decreased by 7% as of end-2017, mainly from the Group’s acquisition of Sacasun loan payable during 2017, which offset the Group’s receivables from Sacasun."
AP_2017.txt,"Consolidated liabilities decreased by 3%, from ₱244.80 bn as of December 31, 2016 to ₱237.50 bn as of December 31, 2017."
AP_2017.txt,"(a) Short term loans increased by 14% or ₱562 mn, mainly from an increase in the number of short-term debts incurred by the distribution utilities to meet working capital requirements."
AP_2017.txt,"(b) Trade and other payables increased by 14% or ₱2.45 bn, as payables to suppliers and contractors increased as construction of various power plants continued."
AP_2017.txt,(c) Long-term debt (current and non-current) decreased by ₱7.32 bn (from ₱159.37 bn in 2016 to ₱152.05 bn in 2017).
AP_2017.txt,"The decrease was mainly due to the ₱15.93 bn prepayment of TPI’s bridge loan obtained in 2016 to fund the acquisition of GNPower Mariveles and GNPower Dinginin, and the ₱2.43 bn prepayment of Aseagas’ project debt."
AP_2017.txt,The decrease was net of drawdowns on various project loans and the issuance of the first tranche of corporate retail bonds amounting to ₱3 bn during 2017.
AP_2017.txt,"(d) Finance lease obligations (current and non-current) decreased by 6% (from ₱52.34 bn in 2016 to ₱49.22 bn in 2017), as TLI continues to make timely payments to the PSALM on its obligations as IPPA."
AP_2017.txt,(e) Asset retirement obligation account increased as a result of the revaluation of the future obligation on APRI’s asset retirement obligations.
AP_2017.txt,The account increased by 62% (from ₱1.82 bn in 2016 to ₱2.96 bn in 2017).
AP_2017.txt,"(f) Long term obligation on power distribution system (PDS) decreased by 6%, as regular annual payments were made in 2017."
AP_2017.txt,"(g) Derivative liabilities (current and non-current) decreased by 87% (from ₱361 mn as of December 31, 2016 to ₱ 48 mn as of December 31, 2017) due to the de-recognition of the derivative liability related to the loan prepayment of GNPower Mariveles during 2017."
AP_2017.txt,"(h) Customers’ deposits decreased by 11% (from ₱6.83 bn in 2016 to ₱6.09 bn in 2017), as special deposits were refunded by distribution utilities to its customers during 2017."
AP_2017.txt,"(i) Other non-current liabilities increased by 20%, driven by an increase of retention payables to suppliers during 2017."
AP_2017.txt,"(j) Pension liability increased by 46% (from ₱247 mn in 2016 to ₱361 mn in 2017) on account of additional retirement costs, net of retirement contributions, made by certain Subsidiaries during 2017."
AP_2017.txt,"(k) Deferred income tax liabilities (DTL) decreased by 13% (from ₱1.04 bn in 2016 to ₱912 mn in 2017), mainly due to lower deferred tax provisions on unrealized foreign exchange gains and valuation changes recognized during 2017."
AP_2017.txt,"Equity attributable to equity shareholders of the Parent increased by 10% (from ₱105.11 bn at year-end 2016 to ₱115.40 bn at year-end 2017) driven mainly by the recognition of income totalling to ₱20.42 bn in 2017, net of dividends declared and paid to the Company’s shareholders."
AP_2017.txt,"Cash generated from operations during 2017 were consistent with previous cash flows from operations, bringing in ₱30.24 bn in 2017 as compared to ₱29.89 bn in 2016."
AP_2017.txt,"During 2017, the Group's net cash used for investing activities of ₱9.45 bn was used primarily to continue the construction of various power projects."
AP_2017.txt,"The Group received cash dividends from Associates amounting to ₱5.07 bn during 2017, which provided inflows from investing activities."
AP_2017.txt,"In 2017, cash outflows from the payment of long-term debt exceeded cash inflows from availment of long term debt, driven primarily by the Group’s prepayment of ₱2.43 bn for the Aseagas project debt, and approximately ₱16 bn payment on TPI’s bridge loan."
AP_2017.txt,"During 2017, the Company also raised ₱3.0 bn in corporate retail bonds."
AP_2017.txt,"Various Subsidiaries also drew down on their project loans, as necessary to bring their respective on-going projects to completion."
AP_2017.txt,Net cash outflows for financing activities is ₱32.12 bn during 2017.
AP_2017.txt,"As of December 31, 2017, the Group’s cash and cash equivalents decreased by 24%, or from ₱47.09 bn as of year- end 2016 to ₱35.70 bn as of year-end 2017."
AP_2017.txt,"Current assets decreased by 8% in 2017 as compared to 2016, accompanied by corresponding increase in current liabilities of 50%."
AP_2017.txt,"The current ratio as of year-end of 2017 was 1.38x, compared to 2.25x at year-end 2016."
AP_2017.txt,"Consolidated debt to equity ratio at year-end 2017 was at 1.92:1, as compared to 2.18:1 as of year-end 2016, owing to the Company’s growth in equity and substantial debt paid down during 2017."
AP_2017.txt,AboitizPower believes that it is well-positioned to take advantage of opportunities arising from developments in the power industry.
AP_2017.txt,Its sound financial condition will give it the agility to create or acquire additional generating capacity over the next few years.
AP_2017.txt,"Despite increased competition in the power generation market, AboitizPower believes it has built the foundation to sustain growth over the long term."
AP_2017.txt,"In line with its growth target of reaching 4,000 MW in net attributable capacity by 2020 from its capacity of 2,999 MW as of December 31, 2017."
AP_2017.txt,"AboitizPower expects to expand its portfolio of generation assets by implementing the projects described below:  AboitizPower, together with its Subsidiaries and Associates, is in various stages of construction or completion of the following Greenfield and Brownfield projects."
AP_2017.txt,1.
AP_2017.txt,"8.5-MW Maris Canal Hydropower Plant Project in Ramon, Isabela."
AP_2017.txt,"This project, undertaken by SN Aboitiz Power-Magat, was inaugurated in January 2018."
AP_2017.txt,2.
AP_2017.txt,"420-MW Pulverized Coal-Fired Expansion Unit 3 in Pagbilao, Quezon."
AP_2017.txt,"This project is undertaken by PEC, a partnership between TPI, a wholly-owned Subsidiary of AboitizPower, and TPEC Holdings Corporation."
AP_2017.txt,PEC started commercial operations in March 2018.
AP_2017.txt,3.
AP_2017.txt,"340-MW CFB Coal-Fired Project in Toledo City, Cebu."
AP_2017.txt,"This project is undertaken by TVI, a partnership between AboitizPower and the Vivant Group."
AP_2017.txt,The project involves the construction of a 2x170-MW coal- fired power plant.
AP_2017.txt,TVI is targeting commercial operations in May 2018 for Unit 1 and in August 2018 for Unit 2.
AP_2017.txt,4.
AP_2017.txt,"68.8-MW Manolo Fortich Hydropower Plant in Manolo Fortich, Bukidnon."
AP_2017.txt,The project is undertaken by Hedcor Bukidnon.
AP_2017.txt,"The completion of Unit 1 (43.4-MW) and Unit 2 (25.4-MW) is expected in April 2018 and in July 2018, respectively."
AP_2017.txt,5.
AP_2017.txt,"19-MW La Trinidad Hydropower Plant in La Trinidad, Benguet."
AP_2017.txt,This project is undertaken by Hedcor.
AP_2017.txt,It is currently under construction and targeted commercial operation date is in the second half of 2019.
AP_2017.txt,6.
AP_2017.txt,"2x668-MW Dinginin Supercritical Coal-Fired Power Plant in Mariveles, Bataan."
AP_2017.txt,"This project is undertaken by GNPower Mariveles, a partnership composed of TPI, AC Energy Holdings, Inc., a wholly- owned subsidiary of Ayala Corporation, and Power Partners Ltd. Co."
AP_2017.txt,"Both Unit 1 and Unit 2, each of 668- MW, are under construction, with targeted commercial operations expected in June 2019 and July 2020, respectively."
AP_2017.txt,"This project, undertaken by SN Aboitiz Power-Ifugao, involves the construction of the 120-MW Alimit hydropower plant, the 250-MW Alimit pumped storage facility, and the 20-MW Olilicon hydropower plant in the municipalities of Aguinaldo, Lagawe, Lamut, and Mayoyao in Ifugao."
AP_2017.txt,SN AboitizPower-Ifugao is currently completing the feasibility study phase of the project.
AP_2017.txt,"The company is also progressing in the permitting process, and is expected to continue working with the government, indigenous peoples' representatives, and industry partners."
AP_2017.txt,An important component of the feasibility review for this project is the Free Prior and Informed Consent from the indigenous peoples.
AP_2017.txt,"Senator Sergio R. Osmeña III filed a petition for certiorari with the Supreme Court to nullify the right-to-top granted by PSALM to SPC in relation to the 153.1 MW NPPC bidding, and to enjoin the award on the ground that SPC’s right- to-top is against public policy."
AP_2017.txt,"On February 14, 2017, TPVI, thru counsel, received a copy of the Entry of Judgment from the Supreme Court dated January 9, 2017, stating that its September 28, 2015 Decision declaring the right-to-top as null and void and October 5, 2016 Resolution reinstating the Notice of Award in favor of TPVI, have become final and executory and have been recorded in the Book of Entries of Judgment."
AP_2017.txt,"With regard to the Motion for Leave to File and Admit the attached Motion for Reconsideration dated December 9, 2016, and the Supplemental Motion/Petition for Referral to the En Banc dated January 16, 2017 filed by SPC, these were denied by the Supreme Court in a Resolution dated April 26, 2017."
AP_2017.txt,"The 660-MW CFB coal-fired power plant located in Redondo Peninsula, Subic, Zambales, is a project undertaken by RP Energy, a joint venture among MPGC, TPI, and TCIC."
AP_2017.txt,"On April 20, 2016, RP Energy entered into a PSA with Meralco for a contracted capacity of 225MW within a 20-year term."
AP_2017.txt,"This PSA was filed for approval with the ERC on April 29, 2016."
AP_2017.txt,"Public hearings were subsequently held, and were concluded on January 6, 2017."
AP_2017.txt,"To date, RP Energy is still awaiting the ERC’s PSA approval."
AP_2017.txt,"AboitizPower is focused on addressing the needs of its markets, including reliable supply, reasonable cost, and minimal impact on the environment and communities."
AP_2017.txt,The Company recognizes that there is no single technology that can address the country’s energy requirements.
AP_2017.txt,"Thus, AboitizPower believes that a mix of power generation technologies is necessary to address the country’s needs."
AP_2017.txt,"The Company will continue to pursue both renewable projects and thermal technologies, where and when it makes sense."
AP_2017.txt,AboitizPower expects that its existing Distribution Utilities will continue to realize modest growth.
AP_2017.txt,It continuously seeks efficiency and improvements in its Distribution Utilities’ operations in order to maintain healthy margins.
AP_2017.txt,"Performance-Based Rate-setting Regulation (PBR) replaced the Return on Rate Base (RORB) mechanism, that had historically determined the distribution charges paid by customers."
AP_2017.txt,"Under PBR, distribution utilities can collect rates from customers over a four-year regulatory period."
AP_2017.txt,The ERC has implemented a Performance Incentive Scheme (PIS) whereby annual rate adjustments under PBR are made.
AP_2017.txt,"The annual rate adjustments take into consideration the ability of a distribution utility to meet or exceed service performance targets set by the ERC, such as: (i) the average duration of power outages; (ii) the average time of restoration to customers; and (iii) the average time to respond to customer calls."
AP_2017.txt,"The distribution utilities are either rewarded or penalized, depending on their ability to meet these performance targets."
AP_2017.txt,"In April 2016, the ERC posted on its website the following documents: (1) Draft Rules for Setting Distribution Wheeling Rates or ""RDWR"" for Privately Owned Distribution Utilities Operating under Performance Based Regulation, First Entry Group, Fourth Regulatory Period; (2) Draft Position Paper: Regulatory Reset for the July 1, 2015 to June 30, 2019, Fourth Regulatory Period for the First Entry Group of Privately-Owned Distribution Utilities Subject to Performance Based Regulation; and (3) Draft Commission Resolution on the Issues on the Implementation of PBR for Privately Owned DUs under the RDWR."
AP_2017.txt,"Comments on the said draft documents were submitted to the ERC on May 13, 2016."
AP_2017.txt,Through ERC Resolution No.
AP_2017.txt,"25, Series of 2016, dated July 12, 2016, the ERC adopted the “Resolution Modifying the Rules for Setting Distribution Wheeling Rates (RDWR) for Privately Owned Distribution Utilities Entering Performance Based Regulation (PBR)”."
AP_2017.txt,"Based on this Resolution, the Fourth Regulatory Period shall be as follows: (ii) Cotabato Light: April 1, 2017 to March 31, 2021 (iii) DavaoLightandVECO:July1,2018toJune30,2022 (iv) SEZandSFELAPCO:October1,2019toSeptember30,2023 On November 21, 2016, the ERC posted the draft “Regulatory Asset Base (RAB) Roll Forward Handbook for Privately Owned Electricity Distribution Utilities” for comments."
AP_2017.txt,"Public consultations were conducted on January 6 and 9, 2017 in Cebu City and Metro Manila, respectively."
AP_2017.txt,"In December 2015, a Petition was filed by Matuwid na Singil sa Kuryente Consumer Alliance, Inc. (MSK) with the ERC wherein MSK proposed a modified RORB methodology or even a modified PBR methodology, in which the distribution utilities’ capital expenditures and rate recovery thereon are approved in advance but the charges to the customers will only start after the investments have actually been made and validated by ERC auditors."
AP_2017.txt,"Public consultations were set by the ERC on March 17 and April 10, 2017 in its main office, and on March 22 and 24, 2017, in its field offices in Cebu City and Davao City, respectively."
AP_2017.txt,"The reset process for the Fourth Regulatory Period has not started for all private distribution utilities as the above- mentioned ERC rules have not been published, which is a condition for their effectivity."
AP_2017.txt,"Due to the rules change on PBR, all Distribution Utilities of AboitizPower have not undergone the Third Regulatory Period."
AP_2017.txt,"In 2015, the DOE issued Department Circular No."
AP_2017.txt,"DC2015-06-0008, entitled “Mandating all Distribution Utilities to Undergo Competitive Selection Process (CSP) in securing Power Supply Agreements (PSA).” The DOE recognizes that CSP in the procurement of PSAs by the distribution utilities ensures long term security and certainty of electricity prices of electric power to end-users."
AP_2017.txt,"On November 4, 2015, the ERC issued Resolution No."
AP_2017.txt,"13, Series of 2015, entitled ""A Resolution Directing All Distribution Utilities to Conduct a Competitive Selection Process in the Procurement of their Supply in the Captive Market""."
AP_2017.txt,The adoption and implementation of the CSP is expected to increase transparency and competition in power supply contracting.
AP_2017.txt,"The impact of CSP is prospective and, as such, its effectivity will not affect AboitizPower’s existing contracts."
AP_2017.txt,"On February 9, 2018, the DOE issued Department Circular No."
AP_2017.txt,"DC2018-02-0003, essentially modifying the existing policy on CSP of power supply contracting, applicable to both electric cooperatives and private distribution utilities."
