Filename,Ticker,Year,Sentence
ICT_2019.txt,ICT,2019,"Interest and financing charges on borrowings increased by 6.8 percent to US$108.2 million for the year ended December 31, 2019 from US$101.3 million for the same period in 2018 primarily due to higher average outstanding loan balance during the period arising from term loans obtained and refinancing of senior guaranteed perpetual securities redeemed in 2019, tapered by interest reduction from pre- termination of the Project Finance Facility at CMSA in May 2018."
ICT_2019.txt,ICT,2019,"Interest expense on lease liabilities decreased by 1.0 percent to US$102.4 million for the year ended December 31, 2019 from US$103.5 million for the same period in 2018 mainly due to favorable translation impact of BRL-based interest expense at TSSA."
ICT_2019.txt,ICT,2019,"Interest on concession rights payable increased by 8.0 percent to US$40.5 million for the year ended December 31, 2019 from US$37.5 million for the same period in 2018 mainly due to the concession right liabilities recognized at SPICTL and MITL in the second quarter of 2018."
ICT_2019.txt,ICT,2019,"Equity in net loss of joint ventures and an associate decreased by 11.1 percent to US$19.7 million for the year ended December 31, 2019 from US$22.2 million for the same period in 2018 mainly due to the decrease in the Company’s share in net loss at SPIA driven by volume growth and higher EBITDA."
ICT_2019.txt,ICT,2019,Equity in net loss of joint ventures and an associate in 2019 includes the Group’s share in net income of MNHPI and net loss of FAMI.
ICT_2019.txt,ICT,2019,"Foreign exchange loss and others increased to US$179.7 million for the year ended December 31, 2019 from US$32.2 million for the same period in 2018 mainly due to the non-recurring impairment charge on the concession rights of Tecplata amounting to US$156.0 million as a result of the lower projected cash flows on its updated business plan caused by the prevailing and challenging economic conditions in Argentina; the non-recurring acceleration of debt issue costs incurred associated with the availment of the Euro-denominated term loan which was partially prepaid in July 2019, partially tapered by the absence of the impairment charge on the goodwill of DIPSSCOR in 2018; write-off of debt issue cost from pre-termination of project finance facility at CMSA in 2018; and decrease in foreign exchange loss arising from favorable translation impact of certain currencies against US dollar."
ICT_2019.txt,ICT,2019,Foreign exchange loss mainly results from the translation or restatement as well as from the settlement of foreign currency-denominated monetary assets and liabilities.
ICT_2019.txt,ICT,2019,"Consolidated EBITDA increased by 9.9 percent to US$830.1 million for the year ended December 31, 2019 from US$755.4 million for the same period in 2018 mainly due to strong revenues; and positive contribution of new terminal, ICTSI Rio."
ICT_2019.txt,ICT,2019,"Excluding the contribution of ICTSI Rio, consolidated EBITDA would have increased by 9.8 percent in 2019."
ICT_2019.txt,ICT,2019,EBITDA margin increased to 56.0 percent in 2019 from 54.5 percent in 2018.
ICT_2019.txt,ICT,2019,"Meanwhile, consolidated EBIT increased by 12.4 percent to US$595.2 million for the year ended December 31, 2019 from US$529.4 million for the same period in 2018 mainly due to stronger EBITDA, tapered by higher depreciation."
ICT_2019.txt,ICT,2019,"Excluding contribution of ICTSI Rio, consolidated EBIT would have increased by 12.3 percent in 2019."
ICT_2019.txt,ICT,2019,EBIT margin increased to 40.2 percent in 2019 from 38.2 percent in 2018.
ICT_2019.txt,ICT,2019,"Consolidated income before income tax decreased by 33.0 percent to US$193.4 million for the year ended December 31, 2019 from US$288.6 million for the same period in 2018 mainly as a result of the non- recurring impairment charge on the concession rights at Tecplata; and higher depreciation, tapered by strong operating income; and decrease in equity in net loss at SPIA."
ICT_2019.txt,ICT,2019,"Excluding contribution of ICTSI Rio and the non-recurring items, consolidated income before income tax would have increased by 21.3 percent in 2019."
ICT_2019.txt,ICT,2019,"The ratio of income before income tax to consolidated gross revenues stood at 20.8 percent and 13.1 percent in 2018 and 2019, respectively."
ICT_2019.txt,ICT,2019,"Consolidated provision for current and deferred income taxes increased by 15.1 percent to US$60.8 million for the year ended December 31, 2019 from US$52.8 million for the same period in 2018 mainly due to higher taxable income at most of the terminals."
ICT_2019.txt,ICT,2019,"Effective income tax rate in 2018 and 2019 stood at 18.3 percent and 31.4 percent, respectively."
ICT_2019.txt,ICT,2019,"Consolidated net income decreased by 43.7 percent to US$132.7 million for the year ended December 31, 2019 from US$235.8 million for the same period in 2018."
ICT_2019.txt,ICT,2019,"Excluding contribution of ICTSI Rio and the non-recurring items, consolidated net income would have increased by 22.1 percent in 2019."
ICT_2019.txt,ICT,2019,"The ratio of consolidated net income to gross revenues stood at 17.0 percent and 9.0 percent in 2018 and 2019, respectively."
ICT_2019.txt,ICT,2019,"Consolidated net income attributable to equity holders decreased to US$100.4 million for the year ended December 31, 2019 from US$207.5 million for the same period in 2018."
ICT_2019.txt,ICT,2019,"Excluding contribution of ICTSI Rio and the non-recurring items, net income attributable to equity holders would have increased by 23.2 percent in 2019."
ICT_2019.txt,ICT,2019,Basic and diluted earnings per share decreased to US$0.020 in 2019 from US$0.071 in 2018.
ICT_2019.txt,ICT,2019,"The Group’s consolidated volume increased by 6.4 percent to 9,736,621 TEUs for the year ended December 31, 2018 from 9,153,458 TEUs handled for the same period in 2017 mainly due to improvement in trade activities; new contracts with shipping lines and services; and contribution of new terminals, VICT, SPICTL and MITL."
ICT_2019.txt,ICT,2019,"Excluding new terminals, consolidated volume would have increased by 2.6 percent in 2018."
ICT_2019.txt,ICT,2019,"Volume from the Asia segment, consisting of terminals in the Philippines, China, Indonesia, Pakistan, Australia and Papua New Guinea grew by 8.8 percent to 5,237,452 TEUs for the year ended December 31, 2018 from 4,815,905 TEUs for the same period in 2017 mainly due to improvement in trade activities at most of the Philippine terminals; new services at YICT; and contribution of new terminals, VICT, SPICTL and MITL, tapered by decreased vessel calls at PICT."
ICT_2019.txt,ICT,2019,"Excluding new terminals, volume from Asia operations would have increased by 1.5 percent in 2018."
ICT_2019.txt,ICT,2019,"The Asia operations accounted for 52.6 percent and 53.8 percent of the consolidated volume for the years ended December 31, 2017 and 2018, respectively."
ICT_2019.txt,ICT,2019,"Volume from the Americas segment, consisting of terminals in Brazil, Ecuador, Honduras and Mexico increased by 2.8 percent to 2,935,281 TEUs for the year ended December 31, 2018 from 2,855,580 TEUs for the same period in 2017 mainly due to new contracts with shipping lines and services and increased transshipments at CMSA; and higher trade volumes at OPC, slightly tapered by reduced transshipments at CGSA."
ICT_2019.txt,ICT,2019,"The Americas operations accounted for 31.2 percent and 30.1 percent of the consolidated volume for the years ended December 31, 2017 and 2018, respectively."
ICT_2019.txt,ICT,2019,"Volume from the EMEA segment, consisting of terminals in Iraq, DR Congo, Poland, Georgia, Madagascar and Croatia, increased by 5.5 percent to 1,563,888 TEUs for the year ended December 31, 2018 from 1,481,973 TEUs for the same period in 2017 mainly due to new shipping lines and services at BCT; and increased trade volumes at AGCT, BICTL and IDRC, slightly tapered by market decline in Iraq resulting to decrease in trade volumes at ICTSI Iraq."
ICT_2019.txt,ICT,2019,"The EMEA operations accounted for 16.2 percent and 16.1 percent of the Group’s consolidated volume for the years ended December 31, 2017 and 2018, respectively."
ICT_2019.txt,ICT,2019,"For the year ended December 31, 2018, net revenues stood at 95.6 percent of the total consolidated income while interest income, foreign exchange gain and other income accounted for 1.9 percent, 0.3 percent and 2.2 percent, respectively."
ICT_2019.txt,ICT,2019,"For the same period in 2017, net revenues stood at 95.5 percent of the total consolidated income while interest income, foreign exchange gain and other income accounted for 1.9 percent, 0.5 percent and 2.1 percent, respectively."
ICT_2019.txt,ICT,2019,"The Group’s consolidated gross revenues from port operations increased by 11.4 percent to US$1,385.8 million for the year ended December 31, 2018 from US$1,244.4 million for the same period in 2017 mainly due to volume growth; new contracts with shipping lines and services; increase in revenues from non-containerized cargoes, storage and ancillary services; tariff adjustments; and contribution of new terminals, VICT, SPICTL and MITL."
ICT_2019.txt,ICT,2019,"Excluding new terminals, consolidated gross revenues would have increased by 6.6 percent in 2018."
ICT_2019.txt,ICT,2019,"Gross revenues from the Asia segment reported a growth of 17.4 percent to US$694.3 million for the year ended December 31, 2018 from US$591.2 million for the same period in 2017 mainly due to volume growth at most of the Philippine terminals and YICT; and contribution of new terminals, VICT, SPICTL and MITL, partially tapered by lower trade volumes at PICT; and unfavorable translation impact of the depreciation of PHP-based revenues at Philippine terminals."
ICT_2019.txt,ICT,2019,"Excluding new terminals, gross revenues from Asia operations would have increased by 7.5 percent in 2018."
ICT_2019.txt,ICT,2019,"The Asia operations captured 47.5 percent and 50.1 percent of the consolidated gross revenues for the years ended December 31, 2017 and 2018, respectively."
ICT_2019.txt,ICT,2019,"Gross revenues from the Americas segment increased by 1.4 percent to US$407.1 million for the year ended December 31, 2018 from US$401.4 million for the same period in 2017 mainly due to volume growth, higher storage revenues at CMSA; and higher storage and ancillary revenues combined with tariff adjustments at OPC, tapered by lower transshipments at CGSA; and unfavorable translation impact of the depreciation of BRL-based revenues at TSSA."
ICT_2019.txt,ICT,2019,"The Americas operations accounted for 32.3 percent and 29.4 percent of the consolidated gross revenues for the years ended December 31, 2017 and 2018, respectively."
ICT_2019.txt,ICT,2019,"Gross revenues from the EMEA segment increased by 12.9 percent to US$284.4 million for the year ended December 31, 2018 from US$251.8 million for the same period in 2017 primarily due to volume growth at AGCT, BICTL and IDRC; increase in general cargoes and storage revenues at ICTSI Iraq; new shipping lines and services combined with increase in revenues from general cargoes at BCT; and favorable translation impact of the appreciation of EUR-based revenues at MICTSL and AGCT."
ICT_2019.txt,ICT,2019,"The EMEA operations stood at 20.2 percent and 20.5 percent of the consolidated gross revenues for the years ended December 31, 2017 and 2018, respectively."
ICT_2019.txt,ICT,2019,"Port authorities’ share in gross revenues, which represents the variable fees paid to Port Authorities by certain terminals, increased by 5.3 percent to US$178.2 million for the year ended December 31, 2018 from US$169.2 million for the same period in 2017 as a result of volume growth and stronger revenues at these terminals."
ICT_2019.txt,ICT,2019,"Consolidated interest income increased by 10.2 percent to US$24.1 million for the year ended December 31, 2018 from US$21.9 million for the same period in 2017 mainly due to higher interest income earned from advances to SPIA, a joint venture associate."
ICT_2019.txt,ICT,2019,"Foreign exchange gain decreased by 29.1 percent to US$3.6 million for the year ended December 31, 2018 from US$5.0 million for the same period in 2017 mainly due to the unfavorable translation impact of certain currencies against US dollar."
ICT_2019.txt,ICT,2019,Foreign exchange gain mainly arises from the settlement and translation or restatement adjustments of foreign currency-denominated monetary assets and liabilities.
ICT_2019.txt,ICT,2019,"Other income increased by 19.8 percent to US$28.3 million for the year ended December 31, 2018 from US$23.6 million for the same period in 2017 mainly due to a non-recurring gain from pre-termination of interest rate swap; and reversal of accrued taxes and provisions at CMSA in 2018, tapered by the absence of the non-recurring gain from reimbursement of costs incurred in relation to the termination of the sub- concession agreement at LICTSLE in 2017; and recognition of income tax credit at OPC in 2017."
ICT_2019.txt,ICT,2019,"Other income includes the Group’s rental, dividend income, and other sundry income accounts."
ICT_2019.txt,ICT,2019,"Total cash operating expenses of the Group increased by 9.8 percent to US$452.2 million for the year ended December 31, 2018 from US$411.8 million for the same period in 2017 mainly due to start-up costs at new terminals, VICT, SPICTL and MITL; increase in prices of fuel; higher fuel and power consumption driven by volume growth, and equipment rentals at certain terminals, partially tapered by continuous monitoring of cost optimization measures; and favorable translation impact of PHP-based expenses at Philippine terminals and BRL-based expenses at TSSA."
ICT_2019.txt,ICT,2019,"Excluding new terminals, consolidated cash operating expenses would have increased by 3.7 percent in 2018."
ICT_2019.txt,ICT,2019,"Manpower costs increased by 4.6 percent to US$217.2 million for the year ended December 31, 2018 from US$207.6 million for the same period in 2017 primarily due to cost contribution of new terminals, VICT, SPICTL and MITL; and government-mandated and contracted salary rate adjustments at certain terminals, partially tapered by continuous monitoring of cost optimization measures."
ICT_2019.txt,ICT,2019,"Excluding new terminals, consolidated manpower costs would have decreased by 1.3 percent in 2018."
ICT_2019.txt,ICT,2019,"Manpower costs accounted for 50.4 percent and 48.0 percent of consolidated cash operating expenses for the years ended December 31, 2017 and 2018, respectively."
ICT_2019.txt,ICT,2019,"Equipment and facilities-related expenses consist mainly of repairs and maintenance costs of port equipment and facilities, power and light, tools expenses, equipment rentals, and fuel, oil and lubricants."
ICT_2019.txt,ICT,2019,"Equipment and facilities-related expenses increased by 19.0 percent to US$110.7 million for the year ended December 31, 2018 from US$93.1 million for the same period in 2017 mainly due to cost contribution of new terminals, VICT, SPICTL and MITL; increase in prices of fuel; and higher fuel and power consumption driven by volume growth, and equipment rentals at certain terminals."
ICT_2019.txt,ICT,2019,"Excluding new terminals, consolidated equipment and facilities-related expenses would have increased by 12.5 percent in 2018."
ICT_2019.txt,ICT,2019,"Equipment and facilities-related expenses represented 22.6 percent and 24.5 percent of consolidated cash operating expenses for the years ended December 31, 2017 and 2018, respectively."
ICT_2019.txt,ICT,2019,"Administrative and other operating expenses increased by 11.9 percent to US$124.3 million for the year ended December 31, 2018 from US$111.1 million for the same period in 2017 mainly due to cost contribution of new terminals, VICT, SPICTL and MITL; increase in information technology-related costs; and increase in legal fees, partially tapered by continuous monitoring of cost optimizations measures."
ICT_2019.txt,ICT,2019,"Excluding new terminals, consolidated administrative and other operating expenses would have increased by 5.4 percent in 2018."
ICT_2019.txt,ICT,2019,"Administrative and other operating expenses stood at 27.0 percent and 27.5 percent of consolidated cash operating expenses for the years ended December 31, 2017 and 2018, respectively."
ICT_2019.txt,ICT,2019,"Depreciation and amortization expense increased by 15.1 percent to US$226.0 million for the year ended December 31, 2018 from US$196.4 million for the same period in 2017 mainly due to contribution of new terminals, VICT, SPICTL and MITL; and higher depreciation arising from expansion projects at ICTSI Iraq, CMSA and OPC."
ICT_2019.txt,ICT,2019,"Interest expense on lease liabilities increased by 18.8 percent to US$103.5 million for the year ended December 31, 2018 from US$87.1 million for the same period in 2017 mainly due to higher lease liability at VICT."
ICT_2019.txt,ICT,2019,"Interest and financing charges on borrowings increased marginally by 0.9 percent to US$101.3 million for the year ended December 31, 2018 from US$100.4 million for the same period in 2017 primarily due to lower capitalized borrowing costs on qualifying assets; and new loans, partially tapered by interest reduction from pre-termination of the Project Finance Facility at CMSA."
ICT_2019.txt,ICT,2019,Capitalized borrowing costs on qualifying assets amounted to US$10.4 million in 2017 at a capitalization rate ranging from 2.4 percent to 6.7 percent and US$4.3 million in 2018 at a capitalized rate ranging from 3.5 percent to 7.0 percent.
ICT_2019.txt,ICT,2019,"Interest on concession rights payable increased by 13.4 percent to US$37.5 million for the year ended December 31, 2018 from US$33.1 million for the same period in 2017 mainly due to the concession right liabilities recognized at new terminals, SPICTL and MITL."
ICT_2019.txt,ICT,2019,"Equity in net loss of joint ventures and an associate decreased by 38.8 percent to US$22.2 million for the year ended December 31, 2018 from US$36.3 million for the same period in 2017 mainly due to the decrease in the Company’s share in net loss at SPIA driven by volume growth and positive EBITDA."
ICT_2019.txt,ICT,2019,"Equity in net loss of joint ventures and an associate in 2018 is net of the Group’s share in net income of MNHPI, a 34.83%-owned associate."
ICT_2019.txt,ICT,2019,"Foreign exchange loss and others decreased to US$32.2 million for the year ended December 31, 2018 from US$46.8 million for the same period in 2017 mainly due to lower restructuring and separation costs at certain terminals; and decrease in foreign exchange loss arising from favorable translation impact of certain currencies against US dollar, partially tapered by non-recurring impairment charge on the goodwill of DIPSSCOR in 2018; and write-off of debt issue cost from pre-termination of project finance facility at CMSA in 2018."
ICT_2019.txt,ICT,2019,Foreign exchange loss mainly results from the translation or restatement as well as from the settlement of foreign currency-denominated monetary assets and liabilities.
ICT_2019.txt,ICT,2019,"Consolidated EBITDA increased by 13.9 percent to US$755.4 million for the year ended December 31, 2018 from US$663.4 million for the same period in 2017 mainly due to strong revenues combined with positive contribution of new terminals, SPICTL and MITL."
ICT_2019.txt,ICT,2019,"Excluding the new terminals, consolidated EBITDA would have increased by 8.6 percent in 2018."
ICT_2019.txt,ICT,2019,EBITDA margin increased to 54.5 percent in 2018 from 53.3 percent in 2017.
ICT_2019.txt,ICT,2019,"Meanwhile, consolidated EBIT increased by 13.4 percent to US$529.4 million for the year ended December 31, 2018 from US$467.0 million for the same period in 2017 mainly due to stronger EBITDA, tapered by higher depreciation charges."
ICT_2019.txt,ICT,2019,"Excluding the new terminals, consolidated EBIT would have increased by 10.3 percent in 2017."
ICT_2019.txt,ICT,2019,EBIT margin increased to 38.2 percent in 2018 from 37.5 percent in 2017.
ICT_2019.txt,ICT,2019,"Consolidated income before income tax increased by 35.0 percent to US$288.6 million for the year ended December 31, 2018 from US$213.8 million for the same period in 2017 as a result of strong operating income; decrease in equity in net loss at SPIA; and lower restructuring and separation costs, tapered by increase in depreciation charges; and the impact of the non-recurring items."
ICT_2019.txt,ICT,2019,"Excluding new terminals and the non-recurring items, consolidated income before income tax would have increased by 30.6 percent in 2018."
ICT_2019.txt,ICT,2019,"The ratio of income before income tax to consolidated gross revenues stood at 17.2 percent and 20.8 percent in 2017 and 2018, respectively."
ICT_2019.txt,ICT,2019,"Consolidated provision for current and deferred income taxes increased to US$52.8 million for the year ended December 31, 2018 from US$29.8 million for the same period in 2017 mainly due to higher taxable income at most of the terminals."
ICT_2019.txt,ICT,2019,"Effective income tax rate in 2017 and 2018 stood at 14.0 percent and 18.3 percent, respectively."
ICT_2019.txt,ICT,2019,"Consolidated net income increased by 28.2 percent to US$235.8 million for the year ended December 31, 2018 from US$183.9 million for the same period in 2017."
ICT_2019.txt,ICT,2019,"Excluding new terminals and the non-recurring items, consolidated net income would have increased by 27.8 percent in 2018."
ICT_2019.txt,ICT,2019,"The ratio of consolidated net income to gross revenues stood at 14.8 percent and 17.0 percent in 2017 and 2018, respectively."
ICT_2019.txt,ICT,2019,"Consolidated net income attributable to equity holders grew by 31.0 percent to US$207.5 million for the year ended December 31, 2018 from US$158.4 million for the same period in 2017."
ICT_2019.txt,ICT,2019,"Excluding new terminals and the non-recurring items, net income attributable to equity holders would have increased by 29.9 percent in 2018."
ICT_2019.txt,ICT,2019,"Basic and diluted earnings per share increased to US$0.071 in 2018 from US$0.058 in 2017 and to US$0.071 in 2018 from US$0.057 in 2017, respectively, mainly due to higher net income, partially tapered by increase in distributions to holders of perpetual capital securities from issuance of senior guaranteed perpetual capital securities in January 2018."
ICT_2019.txt,ICT,2019,"The Group is exposed to a number of trends, events or uncertainties which can affect its recurring revenues and profits."
ICT_2019.txt,ICT,2019,"These include levels of general economic activity and containerized trade volume in countries where it operates, as well as certain cost items, such as labor, fuel and power."
ICT_2019.txt,ICT,2019,"In addition, the Group operates in a number of jurisdictions other than the Philippines and collects revenues in various currencies."
ICT_2019.txt,ICT,2019,"Continued appreciation of the US dollar relative to other major currencies, particularly the Philippine peso, Brazilian Reais, Mexican peso, Australian Dollars and the Euro, may have a negative impact on the Group’s reported levels of revenues and profits."
ICT_2019.txt,ICT,2019,"Total assets increased by 5.5 percent to US$5.8 billion as of December 31, 2019 from US$5.5 billion as of December 31, 2018 mainly due to payment of upfront fee related to the concession contract at AGT; additional investment at MNHPI; investments in capital expenditures, which include the expansion projects at ICTSI Iraq, CMSA and MICT; and port equipment acquisitions; and acquisition of new terminal, ICTSI Rio."
ICT_2019.txt,ICT,2019,These investments were funded mainly by cash generated from the Group’s operations and debt financing.
ICT_2019.txt,ICT,2019,"Non-current assets stood at 87.7 percent and 91.9 percent of the total consolidated assets as of December 31, 2018 and December 31, 2019, respectively."
ICT_2019.txt,ICT,2019,"Current assets decreased by 30.4 percent to US$468.4 million as of December 31, 2019 from US$673.4 million as of December 31, 2018 mainly due to payment of upfront fee related to the concession contract at AGT; acquisition of new terminal, ICTSI Rio; and deployment of cash to fund capital expenditures, tapered by strong cash inflows generated from operations."
ICT_2019.txt,ICT,2019,"Current assets accounted for 12.4 percent and 8.1 percent of the total consolidated assets of the Group as of December 31, 2018 and December 31, 2019, respectively."
ICT_2019.txt,ICT,2019,"Current ratio stood at 1.51 and 0.72 as of December 31, 2018 and December 31, 2019, respectively."
ICT_2019.txt,ICT,2019,"Current ratio as of December 31, 2019 decreased mainly due to the reclassification of the maturing senior notes at the Parent Company to current liability, increasing current liabilities by US$179.3 million."
ICT_2019.txt,ICT,2019,"Total equity decreased by 16.1 percent to US$1.6 billion as of December 31, 2019 primarily due to the redemption of the US$139.7 million senior guaranteed perpetual capital securities in May 2019; payment of dividends; and distribution to holders of perpetual capital securities, tapered by net income generated for the period."
ICT_2019.txt,ICT,2019,"Total liabilities increased by 17.4 percent to US$4.1 billion as of December 31, 2019 mainly due to the net availments of US$381.6 million term loan facility at ICTSI Global Finance B.V. (IGFBV) and US$42.5 million (EUR38.0 million) term loan facility at ICTSI Middle East DMCC."
ICT_2019.txt,ICT,2019,"Financial leverage, the ratio of total interest-bearing debt to total assets, stood at 24.0 percent and 28.9 percent as of December 31, 2018 and December 31, 2019, respectively."
