Filename,Ticker,Year,Sentence
ICT_2019.txt,ICT,2019,"Meanwhile, current liabilities increased to US$655.1 million as of December 31, 2019 from US$445.7 million as of December 31, 2018 mainly due to the reclassification of the US$179.3 million senior notes scheduled for repayment in the next twelve-months at the Parent Company; and higher accounts payable, tapered by full repayment of loans at OPC and BCT.  1."
ICT_2019.txt,ICT,2019,"Intangible assets increased by 10.4 percent to US$2.2 billion as of December 31, 2019 mainly due to consolidation of new terminal, ICTSI Rio; expansion projects at MICT and ICTSI Iraq; and recognition of concession rights on the extension of concession contract at CGSA, tapered by the nonrecurring impairment charge on the concession rights at Tecplata. 2."
ICT_2019.txt,ICT,2019,"Investment in and advances to joint ventures and associates increased by 16.3 percent to US$443.2 million as of December 31, 2019 mainly due to acquisition of the additional 15.17 % stake in MNHPI."
ICT_2019.txt,ICT,2019,3.
ICT_2019.txt,ICT,2019,"Other noncurrent assets increased to US$345.3 million as of December 31, 2019 mainly due to payment of upfront fee related to the concession contract at AGT. 4."
ICT_2019.txt,ICT,2019,"Cash and cash equivalents decreased by 47.5 percent to US$234.8 million as of December 31, 2019 due to payment of upfront fee related to the concession contract at AGT; acquisition of new terminal, ICTSI Rio; and deployment of cash to fund capital expenditures, tapered by strong cash inflows generated from operations."
ICT_2019.txt,ICT,2019,5.
ICT_2019.txt,ICT,2019,"Spare parts and supplies increased by 8.9 percent to US$37.1 million as of December 31, 2019 primarily due to consolidation of new terminal, ICTSI Rio; and acquisition of port equipment spare parts at ICTSI Iraq."
ICT_2019.txt,ICT,2019,6.
ICT_2019.txt,ICT,2019,"Derivative assets decreased to US$21 thousand as of December 31, 2019 mainly due to loss on mark- to-market valuation from interest rate swap at CGSA."
ICT_2019.txt,ICT,2019,7.
ICT_2019.txt,ICT,2019,"Treasury shares increased to US$83.0 million as of December 31, 2019 mainly as a result of acquisition of 13,034,730 treasury shares in 2019, partially tapered by stock awards vested and issued in 2019."
ICT_2019.txt,ICT,2019,8.
ICT_2019.txt,ICT,2019,"Retained earnings decreased by 34.6 percent to US$301.0 million as of December 31, 2019 mainly due to dividends declared and paid during the period; and distribution to holders of perpetual capital securities, partially tapered by net income attributable to equity holders of the parent for the year."
ICT_2019.txt,ICT,2019,9.
ICT_2019.txt,ICT,2019,"Perpetual capital securities decreased by 11.7 percent to US$1.0 billion as of December 31, 2019 due to the redemption of the US$139.7 million senior guaranteed perpetual securities in May 2019."
ICT_2019.txt,ICT,2019,10.
ICT_2019.txt,ICT,2019,"Noncurrent portion of long-term debt increased by 17.0 percent to US$1.4 billion as of December 31, 2019 mainly due to net availments of term loan facilities at IGFBV amounting to US$381.6 million and ICTSI Middle East DMCC amounting to US$42.5 million (EUR38.0 million); refinancing of maturing bridge loans at SPICTL and MITL, partially tapered by reclassification of the maturing senior notes at the Parent Company to current portion of long-term debt amounting to US$179.3 million. 11."
ICT_2019.txt,ICT,2019,"Noncurrent portion of concession rights payable increased by 22.8 percent to US$651.7 million as of December 31, 2019 mainly due to recognition of concession rights payables at ICTSI Rio and CGSA."
ICT_2019.txt,ICT,2019,12.
ICT_2019.txt,ICT,2019,"Deferred tax liabilities increased by 11.3 percent to US$164.2 million as of December 31, 2019 mainly due to income tax effect of the consolidation of ICTSI Rio; excess of fair value over book value of net assets of certain terminals; and difference in depreciation and amortization periods of port infrastructure classified as concession rights at certain terminals."
ICT_2019.txt,ICT,2019,13.
ICT_2019.txt,ICT,2019,"Other noncurrent liabilities increased to US$48.1 million as of December 31, 2019 arising mainly from unrealized loss on mark-to-market valuation from interest rate swap at IGFBV and VICT."
ICT_2019.txt,ICT,2019,14.
ICT_2019.txt,ICT,2019,"Loans payable decreased to nil as of December 31, 2019 due to refinancing of maturing bridge loans at SPICTL and MITL; and full repayment of loan at BCT. 15."
ICT_2019.txt,ICT,2019,"Accounts payable and other current liabilities increased by 12.9 percent to US$347.6 million as of December 31, 2019 mainly due to the consolidation of new terminal, ICTSI Rio; the liability on the increased stake in MNHPI; and port equipment payables at MICT."
ICT_2019.txt,ICT,2019,16.
ICT_2019.txt,ICT,2019,"Current portion of long-term debt increased to US$235.1 million as of December 31, 2019 primarily due to the reclassification of the senior notes scheduled for repayment in the next twelve months at the Parent Company to current liabilities, partially tapered by full repayment of loan at OPC."
ICT_2019.txt,ICT,2019,17.
ICT_2019.txt,ICT,2019,"Current portion of concession rights payable decreased by 14.3 percent to US$9.1 million as of December 31, 2019 mainly arising from lower concession fees scheduled for payment in the next twelve months at CGSA."
ICT_2019.txt,ICT,2019,18.
ICT_2019.txt,ICT,2019,"Current portion of lease liabilities increased to US$19.5 million as of December 31, 2019 mainly arising from higher lease scheduled for payment at CMSA and TSSA in the next twelve months."
ICT_2019.txt,ICT,2019,19.
ICT_2019.txt,ICT,2019,"Income tax payable increased by 24.3 percent to US$39.3 million as of December 31, 2019 mainly due to higher taxable income at ICTSI Iraq."
ICT_2019.txt,ICT,2019,20.
ICT_2019.txt,ICT,2019,"Current portion of derivative liabilities increased to US$4.5 million as of December 31, 2019 due to unrealized loss on mark-to-market valuation from interest rate swap at IGFBV and VICT."
ICT_2019.txt,ICT,2019,"Consolidated cash and cash equivalents decreased by 47.5 percent to US$234.8 million as of December 31, 2019 from US$447.1 million as of December 31, 2018 mainly due to payment of upfront fee related to the concession contract at AGT; acquisition of new terminal, ICTSI Rio; continuous deployment of cash to fund capital expenditures; and repayment of loans, tapered by strong cash inflows generated from operations."
ICT_2019.txt,ICT,2019,"Net cash provided by operating activities increased by 9.1 percent to US$758.8 million for the year ended December 31, 2019 from US$695.8 million for the same period in 2018 mainly due to strong results of operations."
ICT_2019.txt,ICT,2019,"Net cash used in investing activities for the year ended December 31, 2019 amounted to US$659.6 million which consists mainly of payment of upfront fee related to the concession contract at AGT; acquisition of new terminal, ICTSI Rio; additional investment at MNHPI; and capital expenditures of US$240.8 million, excluding capitalized borrowing costs."
ICT_2019.txt,ICT,2019,"The Group finances these requirements through existing cash, cash generated from operations, external borrowings and/or equity issuances, as necessary."
ICT_2019.txt,ICT,2019,"Net cash used by financing activities for the year ended December 31, 2019 amounted to US$305.2 million which consists mainly of the US$390.0 million and US$42.4 million (EUR37.4 million) net proceeds from a loan availments at IGFBV and ICTSI Middle East, respectively, tapered by the repayment of loans; redemption of the perpetual capital securities amounting to US$139.7 million; payment of dividends and debt servicing costs; and acquisition of non-controlling interest at BIPI."
ICT_2019.txt,ICT,2019,"Meanwhile, the net cash used in financing activities for the same period in 2018 includes the US$392.3 million net proceeds from the issuance of senior guaranteed perpetual capital securities in January 2018."
ICT_2019.txt,ICT,2019,"The Group’s total debt and equity capital increased by 1.3 percent as of December 31, 2019 primarily due to increase in debt financing activities to fund acquisitions, expansion projects, capital expenditures and other general corporate requirements, tapered by redemption senior guaranteed perpetual securities in May 2019."
ICT_2019.txt,ICT,2019,"As at December 31, 2019, carrying value of notes under the MTN Programme amounted to US$762.6 million."
ICT_2019.txt,ICT,2019,"As at December 31, 2019, the carrying value of the 2020 Notes amounted to US$179.3 million."
ICT_2019.txt,ICT,2019,"As at December 31, 2019, the term facilities were fully drawn and the carrying value of the loans amounted to US$230.7 million (AUD328.5 million)."
ICT_2019.txt,ICT,2019,"On January 8, 2020, VICT prepaid US$25.8 million (AUD38.5 million) of the loans."
ICT_2019.txt,ICT,2019,"As at December 31, 2019, the outstanding balance of the loans aggregated to US$9.6 million."
ICT_2019.txt,ICT,2019,"As at December 31, 2019, the outstanding balance of the loan amounted to US$4.3 million (RMB30.0 million)."
ICT_2019.txt,ICT,2019,The loan was fully paid in the fourth quarter 2019.
ICT_2019.txt,ICT,2019,"As of December 31, 2019, the market valuation loss on the outstanding interest rate swap amounted to nil."
ICT_2019.txt,ICT,2019,"The loan was fully paid on May 31, 2019."
ICT_2019.txt,ICT,2019,"The loan was fully paid on October 20, 2019 ahead of its maturity date."
ICT_2019.txt,ICT,2019,"The loans availed by SPICTL and MITL in April 2018 and May 2018, respectively, were both extended further and matured on December 2, 2019."
ICT_2019.txt,ICT,2019,"As at December 31, 2019, SPICTL and MITL has availed US$17.8 million (PGK60.2 million) and US$13.8 million (PGK46.7 million), respectively, from the term loan facility to refinance the maturing bridge loans."
ICT_2019.txt,ICT,2019,"As at December 31, 2019, the outstanding balance of the loan aggregated to US$20.2 million."
ICT_2019.txt,ICT,2019,"On January 9, 2019, ICTSI Middle East DMCC, as borrower, and ICTSI, as guarantor, signed a term loan facility agreement with Citigroup Global Markets Asia Limited and Standard Chartered Bank, the original mandated lead arrangers and bookrunners, for the principal amount of US$297.6million (EUR260.0 million) with interest rate based on EURIBOR plus an agreed margin and maturing on December 20, 2022."
ICT_2019.txt,ICT,2019,"The term facility agreement was entered into pursuant to the Loan Facility Programme Agreement dated July 24, 2014 between ICTSI Global Finance B.V. as the borrower, ICTSI as the guarantor, and The Bank of New York Mellon, Singapore Branch as the trustee (“Loan Programme”)."
ICT_2019.txt,ICT,2019,ICTSI Middle East DMCC acceded to the Loan Programme as an additional borrower and an additional obligor thereunder.
ICT_2019.txt,ICT,2019,"On January 10, 2019, ICTSI Middle East DMCC has fully drawn the EUR260.0 million from the facility."
ICT_2019.txt,ICT,2019,"On June 12, 2019, ICTSI Middle East DMCC, as borrower, and ICTSI, as guarantor, signed an amendment and syndication agreement with various international and local banks for the term loan facility."
ICT_2019.txt,ICT,2019,"On July 15, 2019 and December 17, 2019, partial pre-payment of US$219.1 million (EUR195.2 million) and US$30.0 million (EUR26.8 million), respectively, was made on the EUR260 term loan facility."
ICT_2019.txt,ICT,2019,"As at December 31, 2019, the outstanding balance of the loan amounted to US$42.4 million (EUR37.9 million)."
ICT_2019.txt,ICT,2019,"On March 21, 2019, IGFBV, as borrower, Metropolitan Bank and Trust Company, as lender, and ICTSI, as surety, signed a term loan facility amounting to US$300.0 million with interest based on three-month LIBOR plus an agreed margin and a tenor of 7 years."
ICT_2019.txt,ICT,2019,"On April 29, 2019, IGFBV has fully availed the term loan facility."
ICT_2019.txt,ICT,2019,"As at December 31, 2019, the outstanding balance of the term loan facility amounted to US$292.0 million."
ICT_2019.txt,ICT,2019,"In April 2019, ICTSI entered into an interest rate swap transaction to hedge the interest rate exposures of the ICTSI Global Finance B.V.’s floating rate US$-denominated floating rate loan maturing in 2026."
ICT_2019.txt,ICT,2019,A total notional amount of US$300.0 million floating rate loan was swapped to fixed rate.
ICT_2019.txt,ICT,2019,"Under the interest rate swap arrangements, ICTSI pays annual fixed interest of 3.6981 percent and receives floating rate of three-month LIBOR plus 130 basis points on the notional amount."
ICT_2019.txt,ICT,2019,"As at December 31, 2019, the market valuation loss on the outstanding interest rate swaps amounted to US$10.8 million."
ICT_2019.txt,ICT,2019,"On November 26, 2019 and December 5, 2019, IGFBV availed of 18-month loan from MUFG Bank Ltd. with interest based on three-month LIBOR plus an agreed margin, amounting to US$45.0 million each."
ICT_2019.txt,ICT,2019,"Both loans are outstanding as at December 31, 2019."
ICT_2019.txt,ICT,2019,"On January 6, 2020, IGFBV availed another US$20.0 million loan."
ICT_2019.txt,ICT,2019,"The loans from local and foreign banks impose certain restrictions with respect to corporate reorganization, disposition of all or a substantial portion of ICTSI’s and subsidiaries’ assets, acquisitions of futures or stocks, and extending loans to others, except in the ordinary course of business."
ICT_2019.txt,ICT,2019,ICTSI is also required to comply with a specified financial ratio relating to their debt to EBITDA up to 4 times when incurring additional debt.
ICT_2019.txt,ICT,2019,There was no material change in the covenants related to the Group’s long-term debts.
ICT_2019.txt,ICT,2019,"As at December 31, 2019, ICTSI and subsidiaries were in compliance with their loan covenants except for VICT whose Debt Service Coverage Ratio requirement was not met but having been irrevocably waived by the creditors on December 20, 2019, no event of default has occurred."
ICT_2019.txt,ICT,2019,"On March 14, 2019, RCBV (the “Issuer”) and ICTSI (the “Guarantor”) sent a notice to The Hong Kong and Shanghai Banking Corporation Limited (HSBC, as “Trustee” and “Agent”) for the redemption of the remaining US$139.7 million of the US$300-million Senior Guaranteed Perpetual Capital Securities (“Securities”) and payment of accrued distributions on May 5, 2019."
ICT_2019.txt,ICT,2019,"The securities were redeemed on May 2, 2019."
ICT_2019.txt,ICT,2019,"The Group’s non-US dollar currency-linked revenues was 50.9 percent and 51.0 percent of gross revenues for the periods ended December 31, 2018 and 2019, respectively."
ICT_2019.txt,ICT,2019,Foreign currency-linked revenues include the following: (1) arrastre charges of MICT; and (2) non-US dollar revenues of international subsidiaries.
ICT_2019.txt,ICT,2019,ICTSI incurs expenses in foreign currency for the operating and start up requirements of its international subsidiaries.
ICT_2019.txt,ICT,2019,Concession fees payable to port authorities in certain countries are either denominated in or linked to the US dollar.
ICT_2019.txt,ICT,2019,The Group’s exposure to market risk for changes in interest rates (cash flow interest rate risk) relates primarily to the Group’s bank loans and is addressed by a periodic review of the Group’s debt mix with the objective of reducing interest cost and maximizing available loan terms.
ICT_2019.txt,ICT,2019,The Group also enters into interest rate swap agreements in order to manage its exposure to interest rate fluctuations.
ICT_2019.txt,ICT,2019,The Group manages its liquidity profile to be able to finance its working capital and capital expenditure requirements through internally generated cash and proceeds from debt and/or equity.
ICT_2019.txt,ICT,2019,"As part of the liquidity risk management, the Group maintains strict control of its cash and makes sure that excess cash held by subsidiaries are up streamed timely to the Parent Company."
ICT_2019.txt,ICT,2019,The Group also monitors the receivables and payables turnover to ensure that these are at optimal levels.
ICT_2019.txt,ICT,2019,"In addition, it regularly evaluates its projected and actual cash flow information and continually assesses the conditions in the financial market to pursue fund raising initiatives."
ICT_2019.txt,ICT,2019,"These initiatives may include accessing bank loans, project finance facilities and the debt capital markets."
ICT_2019.txt,ICT,2019,"ICTSI monitors and maintains a level of cash and cash equivalents and bank credit facilities deemed adequate to finance the Group’s operations, ensure continuity of funding and to mitigate the effects of fluctuations in cash flows."
ICT_2019.txt,ICT,2019,"There are no other known trends, demands, commitments, events or uncertainties that will materially affect the company’s liquidity."
