sentence,positive,neutral,negative
"total resources expanded 13% reaching p3.0 trillion as gross loans jumped 15% year- on-year funded mainly by a 14% increase in deposits. cash and other cash items rose 19% to p53.7 billion following deposit growth. due from other banks increased 7% to p55.3 billion from higher placements and working balances with correspondent banks. investment securities expanded 16% to p385.2 billion coming from a 38% and 24% increase in financial assets at fair value through profit and loss (fvtpl) and held-to- collect (htc) securities, respectively. net loans and other receivables climbed 16% to p2.1 trillion propelled by the growth in customer loans as well as a 31%, 21% and 6% increase in interbank loans, securities purchased under reverse repurchase agreements (spurra) and other receivables, respectively.
bank premises went up 15% to p33.7 billion from branch expansion and improvements in the bank’s distribution network. investment properties rose 10% to p19.8 billion on additional foreclosures and dacion payments. deferred tax assets grew 12% to p8.3 billion resulting from the bank’s retirement obligation.
deposit liabilities climbed 14% year-on-year to p2.4 trillion fueled by a 33%, 7% and 27% expansion in demand, savings and time deposits. bills payable rose 10% to p143.6 billion primarily owing to the $150 million green bond in february 2018. insurance contract liabilities went up 10% to p28.5 billion attributable to higher bdo life business volumes. other liabilities grew 12% to p92.0 billion primarily due to higher levels of accounts payable, accrued expenses, bills purchased contra-account and retirement benefit obligation.
total equity hiked 10% to p328.1 billion from continued profitable operations.

total contingent accounts went up 8% to p1.9 trillion owing to the following:
trust department accounts expanded 11% to p1.2 trillion on account of higher levels of managed funds.
export l/cs confirmed grew 163% to p6.2 billion with increased volume of trade transactions.
bills for collection as well as late deposits and payments received rose 109% and 86% to p10.7 billion and p2.7 billion, respectively, owing to higher volume of outstanding transactions as of year-end 2018.
other contingent accounts climbed 13% to p361.2 billion on higher committed credit lines.
increased treasury trading activities resulted in growth in spot exchange bought, forward exchange sold and interest rate swap receivables and payables. meantime, spot exchange sold, forward exchange bought as well as interest rate futures sold dropped year-on-year.
outstanding guarantees issued went down 92% to p1.7 billion as of the cut-off date.

the bank registered a net income attributable to equity holders of the parent company of p32.7 billion in 2018, a 17% improvement from the p28.1 billion the previous year. net interest income jumped 20% to p98.3 billion resulting from an expansion in margins and growth in interest-earning assets. the bank maintained its conservative impairment provisioning allocating p6.3 billion for loans, securities, ropa and other assets.
other income was up 5% to p49.7 billion as service charges, trust fees, fx gain, insurance premiums and miscellaneous income improved 7%, 2%, 11%, 20% and 11%, respectively, reflecting business growth across the bank’s varied business lines. on the other hand, the bank recorded a trading loss of p1.6 billion mainly from unrealized losses on bdo life’s portfolio.

operating expenses rose 16% to p98.0 attributable to the following:
employee benefits rose 11% owing to salary increases and an increasing manpower count from business expansion.
occupancy costs grew 13% due to an enhanced distribution network.
taxes and licenses hiked 41% resulting from grt on higher income as well as higher dst costs on a larger time deposit volume, due to the effectivity of the tax reform for acceleration and inclusion (train) law.
insurance expenses increased 16% following continued deposit expansion.
advertising expenses climbed 25% on increased spending on marketing, promotional and advertising activities.
litigation/assets acquired expenses grew 15% on costs relating to litigation and maintenance of acquired assets.
policy reserves dropped 10% owing to the effect of unfavorable market conditions on bdo life’s asset portfolio.
insurance benefits and claims went up 39% following higher bdo life business volumes.
security, clerical and janitorial expenses as well as other operating expenses rose 14% and 16%, respectively, due to an expanded distribution network as well as increased business volumes.

from a net income of p32.6 billion, the bank recorded a total comprehensive income of p27.9 billion for 2018. this is inclusive of a p5.1 billion drop in unrealized gains on fvoci securities partially offset by a re-measurement on life insurance reserves of p3.7 billion, translation adjustment related to foreign operations of p34 million, an actuarial loss on retirement benefit asset of p2.1 billion, a p1.2 billion decline in unrealized gains on equity investments at fvoci, as well as a negative p9 million share in other comprehensive income (oci) of affiliates. the total comprehensive income represents a 6% improvement from the p26.2 billion in 2017.

return on average common equity, return on average equity and basic earnings per share went up to 10.7%, 10.6% and 7.40, respectively, owing to higher net income.
return on average assets was steady at 1.1%
net interest margin improved to 3.64% following the increase in market rates and growth in higher-yielding earning assets.
capital to risk assets went down to 13.8% due to the increase in risk weighted assets. liquidity ratio went down to 30.4% as the bank continued its focus on loan expansion.
solvency ratio and asset-to-equity ratio rose to 821.0% and 921.0%, respectively, as the bank leveraged capital with its deposit expansion.
interest rate coverage ratio declined to 241.9% owing to an increasing interest rate environment.
profit margin went down to 18.3% as cost growth outpaced revenue growth.


the bank posted a record net income attributable to equity holders of the parent company of p32.7 billion in 2018 from p28.1 billion in 2017, representing 17% growth and beating the bank’s p31 billion full-year guidance on strong recurring earnings from its core businesses. the bank likewise capped another milestone as the first philippine bank to breach the p3 trillion mark in total assets.
leading the bank’s performance was the solid growth in its core lending and deposit- taking businesses. gross customer loans rose by 15% to p2.0 trillion on healthy increases across all market segments, while total deposits went up by 14% to p2.4 trillion, with low- cost casa ratio at 70%. this resulted in the 20% expansion in net interest income to p98.3 billion on better net interest margins, which improved to 3.64% from 3.48% in 2017.
meanwhile, non-interest income settled at p49.7 billion, with fee-based income contributing p30.7 billion and insurance premiums up 20%. overall, gross operating income grew by 15% to p148.0 billion.
operating expenses amounted to p98.0 billion, up 16%, in line with the bank’s sustained investments in branch network and strategic initiatives. excluding taxes and licenses, which grew by 41% as a result of higher business volumes and increased documentary stamp taxes (dst) under train, operating expenses would have grown by 13%.
the bank remained prudent and set aside p6.3 billion in provisions even as npl ratio further improved to 1.0% from 1.2% in 2017. npl cover was higher at 183% compared to 146% in 2017.
the bank’s capital base stood at p328.1 billion, with capital adequacy ratio (car) and common equity tier 1 (cet1) ratio at 13.8% and 12.1%, respectively, both above regulatory levels.
bdo is well-positioned to take advantage of market opportunities and strengthen its leadership position in the industry by leveraging on its strong business franchise and extensive distribution network.

philippine economic pace is seen to continue moderating in 2019, in line with modest global growth prospects. the country's growth will be supported by the rebound in consumer demand on easing inflation trends and added boost from election-related spending for the mid-term elections in may, supplemented by the government's continued roll out of infrastructure projects, particularly in regions outside metro-manila.
inflation is seen falling within the bsp's 2%-4%, allowing the bsp to keep interest rates on hold and possibly even cut reserve requirements. the more stable market environment should benefit the banking sector, including bdo, in terms of sustained, albeit more tempered loan growth while asset quality is generally expected to remain benign.",0.9572483897209167,0.022630592808127403,0.020120983943343163
