sentence,positive,neutral,negative
"rlc derives its revenues from real estate operations and hotel operations. revenues from real estate operations account for approximately 92% of the company’s total revenues and are derived from the lease of commercial spaces in the various robinsons malls, the lease and sale of space from rlc’s office buildings, and the sale of residential units from the company’s various housing projects. approximately 8% of total revenues are derived from hotel operations.

rlc generated total gross revenues of p=22.52 billion for calendar year 2017, a slight decrease of 1.3% from p=22.81 billion total gross revenues for calendar year 2016. ebit grew 3.5% to p=8.56 billion while ebitda posted a 3.6% growth to p=12.48 billion. net income stood at p=5.89 billion, up by 2.2% compared to last year.
the commercial centers division accounted for p=10.79 billion of the real estate revenues for the year versus p=10.14 billion last year or a 6.4% increase. rental revenues increased due to opening of new malls in iligan, naga and north tacloban and expansion of robinsons place antique and robinsons butuan this year. also, the full year impact of robinsons place general trias, robinsons place tagum, robinsons place jaro and the expansion of robinsons ilocos norte last year, contributed to the growth, despite renovation of robinsons galleria, one of our largest revenue contributors. cinema revenues increased due to more blockbuster films released this year than last year and the operation of new cinemas in new malls. the division’s ebit and ebitda grew by 3.3% and 3.4%, respectively.
revenues of office buildings division grew by 8.8% to p=3.27 billion from p=3.00 billion over the same period last year. revenue growth was mainly attributable to sustained occupancy rates, and escalation of rents in existing offices and contribution from the new offices namely cyber sigma, galleria cebu office, robinsons lusitia office and cybergate delta. the division’s ebit and ebitda showed positive variances of 10.3% and 7.9%, respectively.
the residential division realized revenues is at p=6.57 billion this year versus p=7.86 billion last year, a decrease of 16.5%, due to lower level of buyers meeting the equity requirement in recognizing sales based on percentage of construction completion. both ebit and ebitda decreased by 5.4% and 3.8%, respectively.
the hotels division, a major contributor to the company’s recurring revenues, registered gross revenues of p=1.89 billion as against last year’s p=1.81 billion. the 4.8% increase in hotel revenues principally came from the new hotels go hotels davao and summit galleria cebu. the hotel average occupancy rate is 66% in 2017. hotels division ebit and ebitda grew by 9.0% and 7.5%, respectively.
interest income increased to p=36.8 million from p=19.3 million last year due to higher average balance of cash and cash equivalents during the calendar year 2017.
real estate costs went down by 4.5% to p=9.28 billion from p=9.72 billion last year. the lower level of realized sales of residential units brought cost of real estate sales to decrease by p=1.01 billion or 24.3%. furthermore, cinema expense rose by 9.3% or p=69.6 million as a result of increase in cinema revenues.
gain from insurance is lower this year by 86% to p=28.4 million from p=208.7 million last year, which basically included insurance proceeds from typhoon yolanda. finance charge amounting to p=147.0 million last year pertain to pretermination of loans. gain or loss from foreign exchange mainly pertains to foreign currency denominated transactions of rlc’s foreign subsidiary.
total assets of the company stood at p=148.13 billion, a growth of 19.0% from p=124.43 billion in 2016.
investment properties and property and equipment increased by 27.9% to p=94.38 billion and 25.2% to p=6.69 billion, respectively. increase in investment properties is due to acquisition of several land properties both for residential and commercial development. moreover, the completion of construction of robinsons malls in naga, iligan, tagum, north tacloban, redevelopment of robinsons galleria, expansion of malls in antique and butuan and installation of solar power facility in various malls, as well as the on-going construction of robinsons malls in san pedro, bridgetowne, pavia-iloilo, tuguegarao, ormoc and cabanatuan, and ongoing expansion of starmills-pampanga and magnolia malls contributed to the increase in investment properties. on the other hand, the increase in property and equipment is due to expansion projects from all three hotel segments namely go hotels, summit hotels, and international.
accounts payable and accrued expenses went up by 48.6% to p=13.88 billion due to higher level of operating expenses this year.
loans payable (current and noncurrent) increased by 30.4% to p=51.35 billion due to availment of additional long term loans to fund the company’s property constructions and developments. deposits (current and noncurrent) and other liabilities went up by 29.9% to p=12.11 billion primarily due to payable to jg summit holdings for the purchase of an investment property.
equity attributable to equity of the parent company as of december 31, 2017 stood at p=67.09 billion, up by 7.2% from p=62.58 billion last year due to the earnings during the year of p=5.88 billion net of payment of dividends of p=1.47 billion.

capital additions for the calendar year ended december 31, 2017 amounted to p=28.86 billion. funding for the capital additions was sourced from proceeds of short-term and long-term loans and internally generated funds.",0.7171486020088196,0.043665796518325806,0.23918557167053223
