sentence,positive,neutral,negative
"sm investments corporation and subsidiaries (the “group”) reported p37.1 billion net income attributable to owners of the parent, 12.6% higher than 2017, and p449.8 billion revenue, 13.0% higher than 2017.
income from operations increased by 14.2% to p86.6 billion from p75.8 billion in 2017. operating margin and net margin is at 19.3% and 13.0%, respectively.
merchandise sales, which grew by 12.2% to p323.7 billion from p288.5 billion in 2017, accounts for 72.0% of total revenues in 2018. the increase is attributable to the opening of 4 sm stores, 4 sm supermarkets, 15 savemore stores, 6 sm hypermarkets, 7 waltermart stores, 178 alfamart stores, and 121 specialty stores.
the sales contribution of non-food and food group is 48:52 in 2018 and 49:51 in 2017.
as of december 31, 2018, sm retail had 2,328 stores nationwide, namely: 63 sm stores, 56 sm supermarkets, 195 savemore stores, 53 sm hypermarkets, 52 waltermart stores, 526 alfamart stores, and 1,383 specialty stores.
real estate sales increased by 21.6% to p36.0 billion from p29.6 billion in 2017 due primarily to higher construction accomplishments of projects launched from 2015 to 2017 namely, shore 2, shore 3, coast, and s residences in pasay, fame residences in mandaluyong, and spring residences in parañaque and continued increase in sales take-up of various projects due to strong demand fueled by international buyers, overseas filipino workers’ remittances, and rising disposable income of the emerging middle class. actual construction of projects usually starts within twelve to eighteen months from launch date and revenues are recognized based on percentage of completion.
rent revenue, derived mainly from the mall operations of sm prime holdings, inc. (“sm prime”), increased by 13.0% to p47.6 billion from p42.1 billion in 2017. the increase in rent revenue is primarily due to the new malls which opened in 2017 and 2018, namely, sm cdo downtown premier, sm city puerto princesa, sm center tuguegarao downtown, sm city urdaneta central, sm city telabastagan, sm city legazpi, sm center ormoc, and s maison at the conrad manila. excluding the new malls and expansions, same-store rental growth is at 8%. rentals from commercial operations also increased due to the opening of threee-com center and sm southmall south tower in 2018.
as of december 31, 2018, sm prime had 72 malls in the philippines with total gfa of 8.3 million square meters and 7 malls in china with total gfa of 1.3 million square meters.
equity in net earnings of associate companies and joint ventures increased by 15.2% to p19.2 billion from p16.6 billion in 2017 due mainly to the increase in net income of bank, retail, and property associates.
management and service fees, which is computed based on percentage of sales, increased by 9.6% to p6.4 billion from p5.8 billion in 2017.
gain on sale of financial assets - net decreased by 98.8% to p1.3 million from p110.2 million in 2017 resulting primarily from the disposal of certain investments in 2017.
dividend income decreased by 14.9% to p421.9 million from p495.6 in 2017 million due to lower dividends received from investees in 2018.
other revenues, which comprise mainly of income from promotional activities highlighting products, commission from bills payment, prepaid cards and show tickets, advertising income and sponsorship revenues, food and beverage income of the hotel group, increased by 14.0% to p9.3 billion from p8.1 billion in 2017.
operating expenses increased by 15.2% to p106.4 billion from p92.3 billion in 2017 due mainly to additional operating expenses associated with new or renovated retail stores and malls and new real estate projects.
other charges - net increased by 18.2% to p12.4 billion from p10.5 billion in 2017. interest expense increased by 6.4% to p16.6 billion from p15.6 billion in 2017 due mainly to new debt availments for working capital and capital expenditure requirements. interest income decreased by 6.2% to p3.8 billion from p4.0 billion in 2017 due mainly to lower balance of time deposits in 2018. gain on fair value changes on derivatives - net increased by 53.5% to p454.9 million from p296.3 million in 2017 resulting mainly from the mark-to-market valuation of outstanding forward swap transactions in 2018. foreign exchange gain (loss) - net decreased by 126.1% to a loss of p182.5 million from a gain of p698.7 million in 2017. this is due mainly to the unfavorable php to usd foreign exchange rate, that is, from php49.93 : usd1.00 in 2017 to php52.58 : usd1.00 in 2018.
provision for income tax increased by 13.1% to p15.6 billion from p13.8 billion in 2017 due mainly to increase in taxable income. the effective income tax rate is 21.0% in 2018 and 21.1% in 2017.
non-controlling interests increased by 15.5% to p21.5 billion from p18.6 billion in 2017 due to the increase in net income of partly-owned subsidiaries.

total assets increased by 10.5% to p1,060.6 billion from p960.1 billion in 2017. likewise, total liabilities increased by 12.3% to p568.3 billion from p506.3 billion in 2017.

current assets increased by 13.7% to p241.7 billion from p212.5 billion in 2017.
cash and cash equivalents increased by 6.7% to p79.3 billion from p74.3 billion in 2017 due mainly to net proceeds from loans partially offset by investments and capital expenditures.
financial assets decreased by 52.6% to p0.6 billion from p1.3 billion in 2017 due mainly to maturity of certain investments in bonds in 2018.
merchandise inventories increased by 14.6% to p31.8 billion from p27.8 billion in 2017. bulk of the increase came from the specialty group.
other current assets increased by 10.8% to p70.3 billion from p63.5 billion in 2017 due mainly to the increase in current portion of land and development arising from development costs on ongoing projects and higher prepaid taxes and other prepayments and receivable from banks.

noncurrent assets increased by 9.5% to p818.9 billion from p747.6 billion in 2017.
investments in associate companies and joint ventures increased by 7.3% to p259.8 billion from p242.1 billion in 2017. the increase mainly represents equity in net earnings of associates in 2018 and investments in new associates, partly offset by dividends received in 2018.
time deposits decreased by 91.0% to p2.4 billion from p26.7 billion in 2017 due mainly to reclassification of maturing time deposits to current. on the other hand, the current portion of time deposits increased by 95.2% to p25.8 billion from p13.2 billion in 2017 due mainly to reclassification from non-current and new investments in time deposits coming from proceeds from matured investments in bonds, partly offset by matured time deposits that were used to pay off loans.

property and equipment increased by 8.7% to p23.2 billion from p21.3 billion due mainly to new stores in 2018.
investment properties increased by 7.0% to p309.3 billion from p289.0 billion in 2017 due mainly to ongoing new mall projects and commercial building construction, including the foure-com center as well as the redevelopment of sm mall of asia and other existing malls. the increase is also attributable to landbanking initiatives.
land and development increased by 34.2% to p53.9 billion from p40.2 billion in 2017 due mainly to landbanking and construction accomplishments during the period.
other noncurrent assets increased by 54.8% to p115.4 billion from p74.6 billion in 2017. the increase mainly represents higher receivable from real estate buyers and bonds and deposits.

current liabilities increased by 20.9% to p212.7 billion from p175.9 billion in 2017.
bank loans decreased by 21.9% to p18.9 billion from p24.2 billion in 2017 due to net payments during the period, partly offset by new loan availments.
accounts payable and other current liabilities increased by 17.1% to p124.8 billion from p106.6 billion in 2017 mainly from higher business volume.
income tax payable increased by 93.3% to p3.6 billion from p1.9 billion in 2017 due mainly to higher income tax due.
current portion of long-term debt increased by 52.6% to p61.5 billion from p40.3 billion in 2017 due mainly to reclassification of maturing loans.
dividends payable increased by 32.9% to p3.9 billion from p2.9 billion in 2017. this represents dividends due to minority stockholders of certain subsidiaries.

noncurrent liabilities increased by 7.6% to p355.6 billion from p330.4 billion in 2017.
long-term debt - net of current portion increased by 4.4% to p305.6 billion from p292.6 billion in 2017 due mainly to new debt availments, partly offset by payments.
tenants’ deposits and others increased by 38.4% to p41.3 billion from p29.8 billion in 2017 due mainly to new malls and office buildings and increase in customers’ deposits from residential buyers.

total equity increased by 8.5% to p492.3 billion from p453.8 billion in 2017.
equity attributable to owners of the parent increased by 7.7% to p353.4 billion from p328.1 billion in 2017. this increase resulted mainly from the (a) p30.1 billion net increase in retained earnings due to the p37.1 billion net income attributable to owners of the parent, p2.9 billion effect from the adoption of pfrs 9, financial instruments, less p9.9 billion dividend declaration during the year, and (b) cumulative translation adjustment (“cta”) which increased by 48.1% to p2.1 billion from p1.4 billion in 2017. this is related mainly to the translation of the financial accounts of sm china malls from china yuan renminbi to philippine peso and includes the group’s share in the cta of associates. these were partially offset by (a) net unrealized gain on financial assets at fair value which decreased by 23.3% to p11.7 billion from p15.3 billion in 2017 due mainly to the depreciation in market value of certain investments of the group, and (b) re-measurement loss on defined benefit asset/obligation which increased by 194.2% to p2.1 billion from p0.7 billion as a result of the valuation of the group’s retirement plan.
non-controlling interests increased by 10.5% to p138.9 billion from p125.7 billion in 2017 due mainly to the increase in net assets of subsidiaries that are not wholly owned.

the group has no known direct or contingent financial obligation that is material to the group operations, including any default or acceleration of an obligation. the group has no off-balance sheet transactions, arrangements, obligations during the reporting year and as of the balance sheet date.
there are no known trends, events, material changes, seasonal aspects or uncertainties that are expected to affect the group’s continuing operations.

current ratio decreased to 1.1 from 1.2 in 2017 due mainly to the higher increase in current liabilities of 20.9% compared to only 13.7% of current assets.
asset to equity ratio increased to 2.2 from 2.1 in 2017 due mainly to the higher increase in total assets of 10.5% compared to only 8.5% of total equity.
gross debt-equity ratio remained at 52:48 in 2018 and 2017 but net debt-equity ratio slid to 44:56 from 43:57 in 2017 due mainly to higher increase in net debt of 14.9% from p243.7 billion to p280.1 billion in 2018.
revenue growth increased to 13.0% from 9.0% in 2017 and net income growth increased to 12.6% from 5.5% in 2017 due mainly to higher growth in sales and in equity in net earnings of associate companies and joint ventures.

return on equity increased to 10.9% from 10.4% in 2017 due mainly to the higher net income growth in 2018.
ebitda increased by 13.2% to p101.8 billion from p89.9 billion in 2017 due mainly to the 14.2% increase in income from operations.
interest cover increased to 6.1x from 5.8x in 2017 due to the 13.2% increase in ebitda with only 6.4% increase in interest expense.

in 2019, sm prime is slated to open four new malls in the philippines. by the end of 2019, there will be 83 malls, 76 in the philippines and 7 in china with an estimated combined gross floor area of almost 10.0 million square meters.
in the residential segment, 15,000 to 18,000 residential condominium units that include high- rise, mid-rise and single-detached housing and lot projects will be launched. these new projects will be located in metro manila and other key cities in the provinces.
in the commercial segment, sm prime is set to launch the campus-office building named nu tower and the foure-com center which are both located in the mall of asia complex in pasay city in 2019 and 2020, respectively.
in the hotels and convention centers segment, park inn by radisson - iloilo and park inn by radisson - north edsa will be launched in 2019.
sm prime’s land banking initiatives will continue in 2019.

in 2019, the retail group plans to open 4 sm stores, 3 sm supermarkets, 14 savemore stores, 1 sm hypermarket and 98 specialty stores.
the above expenditures will be funded through internally generated sources and other capital raising initiatives such as bond issuances and loan availments.
",0.90144282579422,0.08379712700843811,0.014759999699890614
