sentence,positive,neutral,negative
"Ayala Corporation’s net income in 2018 grew five percent to ₱31.8 billion from the previous year, boosted by strong earnings contribution from its real estate, telecommunications, and power businesses.",0.9562603235244751,0.02511751279234886,0.018622132018208504
Sale of goods and services expanded 13 percent to ₱274.9 billion of which 3% was a result of the adoption of PFRS 15 (new accounting standard in 2018 pertaining to Revenues from Contracts with Customers).,0.9330452084541321,0.05750507116317749,0.009449794888496399
"Revenue growth was driven by Ayala Land which posted higher sales across all its business segments, supported by higher sales from IMI’s Europe, China, Philippines, and Mexico units as well as contribution of VIA Optronics and Manila Water’s new business units.",0.9598463773727417,0.023984691128134727,0.01616889424622059
"Ayala Land sustained its growth momentum during the year with net income expanding 16 percent to ₱29.2 billion, primarily driven by the strong performance of its property development and commercial leasing businesses.",0.9559721946716309,0.02598949894309044,0.018038250505924225
"Property development revenues jumped 18 percent to ₱120.3 billion on strong sales across its residential, office-for-sale, and commercial lot segments.",0.9574865698814392,0.023454423993825912,0.019058935344219208
"Residential revenues jumped 20 percent to ₱101.1 billion, while reservation sales grew 16 percent to ₱141.9 billion, bolstered by strong demand from local and overseas Filipinos, which accounted for 82 percent of total sales during the year.",0.9549717903137207,0.025423016399145126,0.019605210050940514
"Fresh bookings from One Vertis Plaza in Vertis North, Quezon City, The Stiles East Enterprise Plaza in Circuit Makati, and completion of Park Triangle Corporate Plaza in Bonifacio Global City lifted the sale of office spaces, with revenues reaching ₱11.4 billion, 14% higher year-on-year.",0.9549741744995117,0.027053458616137505,0.01797236129641533
"In addition, revenues from the sale of commercial and industrial lots grew 10 percent to ₱7.7 billion, lifted by sales from its estates in the Visayas and Mindanao region, Evo City in Cavite, Alviera in Pampanga, and Cavite Technopark.",0.9561209082603455,0.02634863555431366,0.01753043383359909
"Meanwhile, the opening of new malls and office spaces as well as the launch of new hotel and resort rooms drove the 17 percent expansion in commercial leasing revenues to ₱34.9 billion from its year- ago level.",0.9530985355377197,0.024105988442897797,0.022795436903834343
"In 2018, Ayala Land added 142,000 square meters of mall space with the opening of three new malls: the Circuit Mall in Makati, the Capitol Central Mall in Bacolod, One Bonifacio High Street in Taguig, bringing its total mall gross leasable area to 1.9 million square meters.",0.8592536449432373,0.13359305262565613,0.007153297308832407
"Moreover, the completion of Bacolod Capitol Corporate Center, Vertis North Corporate Center 3, and Ayala North Exchange pushed up Ayala Land’s total office GLA to 1.1 million square meters.",0.945219099521637,0.039948202669620514,0.014832708053290844
"Ayala Land’s commercial leasing business was further boosted by its hotels and resorts portfolio, which continues to benefit from the growth of the country’s tourism sector.",0.9525449275970459,0.034686505794525146,0.01276856567710638
"In 2018, it added 390 rooms across its portfolio of branded hotels and its own Seda brand as well as bed and breakfast rooms in its Lio and Sicogon eco-tourism estates, bringing the total to 2,973 rooms.",0.8310432434082031,0.16107897460460663,0.007877783849835396
"The sustained strong performance of its leasing segment has supported the continued buildup of Ayala Land’s recurring income business, which increased at a compounded annual rate of 26 percent since 2013.",0.9553033709526062,0.0262368842959404,0.018459659069776535
"Meanwhile, its development income, which comprises residential, office, and lot sales, grew at a compounded annual rate of 18 percent.",0.9531275629997253,0.026294730603694916,0.02057771012187004
"Manila Water recorded a net income of ₱6.5 billion, 6 percent higher from the previous year, largely driven by the Manila Concession, boosted by the contribution of its newly acquired platforms in Thailand and Indonesia.",0.9555911421775818,0.028343958780169487,0.01606486178934574
"The Manila Concession posted steady growth, with a three percent increase in billed volume to 503 million cubic meters.",0.9544757008552551,0.02831542305648327,0.017208890989422798
This was supported by the 28 percent positive tariff adjustment granted by the Metropolitan Waterworks and Sewerage System to be implemented on a staggered basis over a five- year period from 2018 to 2022.,0.8782643675804138,0.1120276227593422,0.009707954712212086
"Outside the Manila Concession, revenues from Manila Water Philippine Ventures rose six percent to ₱3.3 billion.",0.956348717212677,0.025449100881814957,0.018202153965830803
"Lowered billed volume across its domestic subsidiaries as well as operational and regulatory challenges, including the closure of Boracay island, weighed down MWPV’s performance during the year.",0.011123714037239552,0.017324505373835564,0.9715517163276672
Manila Water Asia Pacific’s overseas investments continues to bear fruit.,0.9444055557250977,0.04117899388074875,0.014415434561669827
It booked a 53 percent surge in equity share in net income of associates to ₱699 million.,0.9495617747306824,0.030138643458485603,0.02029961161315441
"This was mainly driven by the two platforms it acquired during the year, East Water in Thailand, and PT Sarana Tirta Ungaran in Indonesia, which contributed ₱262.7 million and ₱1.4 million in equity earnings, respectively.",0.40229418873786926,0.5864540934562683,0.011251670308411121
"To support its diversification strategy, Manila Water continues to ramp up its domestic and international business development initiatives, securing 13 new businesses in 2018.",0.9431781768798828,0.04351408779621124,0.013307769782841206
"These include the full concession projects in Calbayog in Samar, San Jose in Nueva Ecija, and in Iloilo, Isabela, Pangasinan, Batangas, Bulacan, and Laguna as well as the acquisition of a 19 percent stake in East Water and a 20 percent stake in PT Sarana Tirta Ungaran.",0.09247036278247833,0.8982875347137451,0.00924213882535696
"AC Energy’s net earnings expanded 16 percent to ₱4.1 billion in 2018, largely driven by its domestic thermal and renewable assets as well as higher contribution from its Indonesia investments.",0.9541927576065063,0.030283909291028976,0.015523344278335571
"The strong performance and higher equity stake in GNPower Mariveles, strong wind regime, and fresh contribution of its greenfield offshore project, the 75-megawatt Sidrap wind farm in Indonesia, as well as the full-year recognition of SD Geothermal boosted AC Energy’s performance during the year.",0.9508273005485535,0.03867179527878761,0.010500967502593994
"Equity earnings from AC Energy’s investee companies reached ₱3.6 billion, 37 percent higher from the previous year.",0.9523432850837708,0.0278156865388155,0.01984105072915554
Recovery of the costs incurred due to adjustments in the construction schedule of GNPower Kauswagan also lifted AC Energy’s net earnings during the period.,0.951475203037262,0.017318537458777428,0.031206179410219193
"During the year, AC Energy generated 2,800 gigawatt hours of attributable energy, of which 48 percent was from renewable sources.",0.06471177190542221,0.9223927855491638,0.012895447202026844
"To support its strategy to scale up its renewable portfolio, AC Energy raised US$410 million in green bond in January 2019, the first publicly syndicated US dollar green bond in Southeast Asia to be certified by the Climate Bonds Initiative.",0.847204864025116,0.14605586230754852,0.006739310920238495
"AC Energy has identified the Philippines, Vietnam, Indonesia, and Australia as key markets in its expansion strategy.",0.8600994348526001,0.1329101324081421,0.006990471389144659
"The 330-MWp Ninh Thuan solar farm in Vietnam, a joint venture between AC Energy and the BIM Group, is expected to commence early in the second quarter of 2019.",0.13868016004562378,0.852456271648407,0.008863584138453007
"Once completed, it will be one of the largest solar farms in Southeast Asia, benefiting Ninh Thuan province with income generation and job creation.",0.9241347908973694,0.06665411591529846,0.009211167693138123
"AC Energy also broke ground on the 80-MWp solar farms located in the provinces of Khanh Hoa and Dak Lak, in partnership with AMI Renewables Energy.",0.7417534589767456,0.2504267394542694,0.007819746620953083
"In addition, AC Energy signed a memorandum of understanding with Quang Binh Province to jointly develop a wind power project with AMI Renewables.",0.9285503029823303,0.059402283281087875,0.012047337368130684
"AC Energy has also entered the Australian renewables market through a joint venture with international
50% ownership in UPC's Australian business.",0.21716977655887604,0.7760514616966248,0.00677876640111208
"the 1,000 MW Robbins Island and Jims Plain projects in North West Tasmania and the 700 MW New England Solar Farm located near Uralla in New South Wales.",0.04854615405201912,0.934411346912384,0.0170424897223711
"It also has a further development portfolio of another 3,000 megawatts located in NSW, Tasmania and Victoria.",0.18603578209877014,0.8069510459899902,0.007013221736997366
"AC Industrials’ net income dropped 53 percent year-on-year to ₱578 million, largely due to the weaker performance of its automotive businesses and startup losses from newly acquired businesses.",0.006672221701592207,0.01730429008603096,0.9760234355926514
This decline was partially offset by a one-time gain in its electronics manufacturing services arm.,0.5385512709617615,0.03676803410053253,0.4246807098388672
"RE developer UPC Renewables, investing US$30M for a
The platform is developing
In September, AC Energy announced the partial sell-down of its thermal platform to Aboitiz Power, which includes the GNPower Mariveles and GNPower Dinginin assets in Bataan.",0.02554910257458687,0.8667310476303101,0.1077198013663292
"The sale, valued at US$ 579.2 million, represents approximately 35% of AC Energy’s attributable thermal capacity and is part of the company’s strategy to actively recycle capital and will enable the expansion of AC Energy’s domestic and offshore renewable energy businesses.",0.6598788499832153,0.33237209916114807,0.007749089505523443
"In late February, AC Energy received approval on the transaction from the Philippine Competition Commission.",0.7486050128936768,0.24196316301822662,0.00943188089877367
"IMI’s revenues expanded 24 percent to ₱70.8 billion on the back of a 16 percent growth in revenues from traditional businesses and a 61 percent growth in recently acquired companies, VIA and STI.",0.9562573432922363,0.02598484605550766,0.017757724970579147
"It likewise benefited from new programs in the industrial and automotive segments which grew 41 percent and 21 percent, respectively.",0.9505385160446167,0.036338258534669876,0.01312319841235876
"IMI reported a net income of ₱2.4 billion, up 34 percent from a year ago, boosted by non-operating items such as net gains from the sale of a China entity and reversal of contingent consideration related to the STI acquisition, partially offset by impairment provisions on some offshore investments.",0.95596843957901,0.02118038944900036,0.0228511244058609
The effect of the RMB and EUR depreciation and higher interest rates also added downward pressure to IMI’s performance during the year.,0.01174953579902649,0.017399467527866364,0.9708508849143982
"Excluding the impact of the one-time net gain, IMI’s net income went down 49 percent year-on-year.",0.00747897382825613,0.016373464837670326,0.9761475324630737
"AC Motors registered a 76 percent decline in net earnings to ₱164 million owing to significantly lower earnings of the group’s Honda and Isuzu dealerships, both hit by weaker sales amid an industry-wide slowdown.",0.009694729931652546,0.014679286628961563,0.9756259918212891
This was aggravated by lower contributions from AC Industrials’ investments in the Philippine distribution companies of Isuzu and Honda.,0.014196354895830154,0.02308051288127899,0.9627231359481812
Meanwhile Volkswagen’s sales volume was affected by the delay in delivery of its China-sourced vehicles.,0.007765067741274834,0.021859219297766685,0.9703757166862488
"AC Industrials continues to ramp up its automotive retail portfolio and in 2018, it partnered with Kia Motors and China’s SAIC Motor for the distribution of Kia and Maxus vehicles in the Philippines, respectively.",0.9060660004615784,0.0866493284702301,0.007284750230610371
"Share of profits of associates and joint ventures grew 11 percent to ₱20.5 billion, lifted by Globe’s higher data-driven revenues plus the growth in BPI’s core businesses.",0.9577730298042297,0.023909835144877434,0.018317129462957382
The adoption of the new accounting standards PFRS 9 (Financial Instruments) and PFRS 15 has minimal effect in the net income of BPI and Globe in 2018.,0.03078530728816986,0.9404258728027344,0.028788894414901733
"Higher equity in net earnings from AC Energy’s investee companies, namely GN Power Mariveles, SD Geothermal, and Sidrap, as well as contribution of Manila Water’s new overseas investments also drove the increase.",0.9552472829818726,0.027814675122499466,0.016938015818595886
"However, this was partially offset by Ayala Land’s consolidation of MCT, previously reported as an associate, as well as AC Ventures’ share in net losses of Zalora and Mynt.",0.6309410333633423,0.29576951265335083,0.07328947633504868
"Bank of the Philippine Islands reported a net income of ₱23.1 billion, up 3 percent from the previous year, boosted by the robust growth of its core banking business but tempered by higher provisions and operational spending.",0.9553675055503845,0.022840576246380806,0.021791944280266762
"The bank’s total revenues grew 11 percent to ₱78.5 billion on the back of a 16 percent growth in net interest income, which reached ₱55.8 billion.",0.955072820186615,0.026087164878845215,0.01884002983570099
The increase in net interest income was a result of a 9 percent improvement in average asset base and a 21-basis point expansion in net interest margin.,0.9521562457084656,0.031249459832906723,0.01659436523914337
"Total loans stood at ₱1.35 trillion, reflecting a 13 percent growth year-on-year, boosted by strong performance of its corporate loans and credit card loans, which increased 13 percent and 24 percent, respectively.",0.9564042091369629,0.02484852448105812,0.018747225403785706
"Total deposits reached ₱1.59 trillion, up 1.5 percent, with current and savings accounts registering faster growth at 2.4 percent.",0.9522139430046082,0.029037533327937126,0.01874849945306778
The bank’s current account and savings account ratio stood at 71.9 percent while the loan-to-deposit ratio was at 85.4 percent.,0.044368524104356766,0.9245321154594421,0.031099380925297737
"The bank recorded higher fee income from its transaction-based service charges, credit card, and rental businesses.",0.9539926648139954,0.022512711584568024,0.023494673892855644
"However, lower trust, investment management, and corporate finance fees, and securities trading income during the year, tempered BPI’s non-interest income, which slid 1 percent to ₱22.7 billion.",0.012110024690628052,0.013823937624692917,0.9740660190582275
"Operating expenses totaled ₱43.6 billion for 2018, an increase of 13.2 percent year-on-year on accelerated spending to support the bank’s digitalization strategy and investments in its microfinance network.",0.9553115367889404,0.02484787441790104,0.01984054408967495
"In 2018, BPI Direct Banko, its microfinance arm, doubled its branch network to 200.",0.9343394637107849,0.055492594838142395,0.010167947970330715
These initiatives resulted in cost-to-income ratio of 55.5 percent in 2018 from 54.3 percent a year ago.,0.9478092193603516,0.024352503940463066,0.027838366106152534
"At the end of 2018, the bank’s total assets stood at ₱2.1 trillion, up 9.5 percent from the previous year, with return on assets at 1.2 percent.",0.9520924687385559,0.02897798642516136,0.01892951689660549
"With the success of its capital raising exercises - the ₱50 billion stock rights offering, the US$600 million in senior unsecured bonds, and the ₱25 billion in peso fixed rate bonds - BPI’s total capital reached ₱248.52 billion, up by 38 percent from its year-ago level.",0.9531450867652893,0.027313753962516785,0.019541162997484207
Capital adequacy ratio was at 16.09 percent and Common equity tier 1 ratio was at 15.19 percent.,0.0263933427631855,0.9379651546478271,0.035641446709632874
"Data-driven demand across its business segments bolstered Globe’s net profits, which reached ₱18.6 billion during the year.",0.9545288681983948,0.026111984625458717,0.01935911364853382
"On a post-PFRS basis, service revenues reached ₱132.9 billion.",0.48548516631126404,0.4979896545410156,0.016525140032172203
"Mobile revenues grew nine percent to ₱106.9 billion driven by mobile data services, which accounted for 51 percent of the segment from 44 percent a year ago.",0.9534721374511719,0.026998352259397507,0.019529560580849648
"This was supported by the sustained higher prepaid top-ups, indicating greater consumer spending on mobile data.",0.9551775455474854,0.019584599882364273,0.025237856432795525
"This in turn, drove the mobile data traffic growth to 956 petabytes from 600 petabytes a year ago.",0.9501201510429382,0.03012165054678917,0.019758164882659912
"Globe’s home broadband business jumped 19 percent to ₱18.5 billion on continued subscriber expansion in fixed wireless solutions, specifically the Home Prepaid Wi-Fi product.",0.9572953581809998,0.024729231372475624,0.017975419759750366
"Similarly, its corporate data business expanded 15 percent to ₱11.8 billion amid increasing demand for fast, reliable, and secure internet connectivity and modern business solutions.",0.9535639882087708,0.031097576022148132,0.01533845067024231
"With a consistent strong revenue and well managed costs throughout the year, Globe’s EBITDA improved 22 percent to ₱64.9 billion, with EBITDA margin at 46 percent from its year-ago level of 42 percent.",0.95445317029953,0.021712347865104675,0.023834479972720146
"It spent ₱43.3 billion in capital expenditures in 2018, equivalent to 32 percent of its service revenues.",0.21144849061965942,0.7648500800132751,0.023701470345258713
"Consolidated cost of sales and rendering services rose 12 percent to ₱196.6 billion, tracking the revenue growth.",0.9567822217941284,0.02415485307574272,0.019062921404838562
"General and administrative expenses expanded 18 percent to ₱29.8 billion, primarily driven by the combined increments in the group’s expenses, particularly Ayala Land’s taxes, contracted services, depreciation; Manila Water’s management fees, manpower-related and selling expenses, and Ayala parent’s higher business development and manpower costs.",0.9342995882034302,0.023204591125249863,0.04249584302306175
"Moreover, the consolidation of our new subsidiaries namely MCT of Ayala Land, MT Technologies and Merlin Solar of AC Industirals, and VIA Optronics and STI of IMI drove the higher GAE during the period.",0.9443443417549133,0.04157081991434097,0.014084865339100361
This was further lifted by IMI‘s restructuring costs from its employee relocation in China prior to the property sale.,0.804214596748352,0.022125545889139175,0.17365993559360504
"Without the effect of these newly consolidated subsidiaries, GAE grew nine percent year-on-year.",0.8829488158226013,0.10424152761697769,0.012809600681066513
"At the end of 2018, Ayala’s total assets stood at ₱1.2 trillion.",0.027033451944589615,0.9465353488922119,0.026431191712617874
"Investments in associates and joint ventures expanded 19 percent to ₱240.1 billion owing to Ayala parent’s subscription to BPI’s stock rights offering as well as new investments of Manila Water in East Water in Thailand and PT Sarana in Indonesia, and AC Energy in renewable platforms in Australia and Vietnam.",0.9430679082870483,0.043194156140089035,0.013737897388637066
"Furthermore, the growth was lifted by additional investments of AC Infrastructure in the LRT 1 project and higher share of net earnings in BPI and Globe and investee companies of Ayala Land, Manila Water, and AC Energy.",0.9576444029808044,0.025586022064089775,0.01676960475742817
"This was partly offset by Ayala Land’s consolidation of MCT, which was previously reported as associate as well AC Ventures‘ equity losses in Zalora and Mynt.",0.47147437930107117,0.24757951498031616,0.2809460759162903
"Investments in properties jumped 12 percent to ₱227.6 billion driven by Ayala Land’s expansion projects in its malls, office properties, land development initiatives, and the impact of the consolidation of MCT.",0.9555764198303223,0.024102255702018738,0.020321320742368698
"At the end of the year, total debt at the consolidated level stood at ₱412 billion, 18 percent higher from the end-2017 level.",0.948975682258606,0.03202114999294281,0.019003143534064293
"This was driven by higher borrowings of the parent as well as higher loan balances of Ayala Land, Manila Water, and AC Energy.",0.9473633766174316,0.03664757311344147,0.0159890279173851
Ayala’s balance sheet remained healthy with enough capacity to undertake investments and cover its dividend and debt obligations.,0.9462389349937439,0.039145927876234055,0.014615102671086788
"As of end-2018, parent level cash stood at ₱8.5 billion, while net debt stood at ₱96 billion.",0.030817562714219093,0.9414654970169067,0.027716977521777153
"Loan-to-value ratio, the ratio of its parent net debt to the total value of its assets, stood at 11 percent.",0.05487566068768501,0.9220412969589233,0.023083116859197617
The conglomerate’s peso-dollar debt split ended at 64:36 for 2018.,0.03169536218047142,0.8122909069061279,0.15601365268230438
Ayala’s dollar denominated debts are fully covered by foreign currency assets.,0.04986913874745369,0.9356155395507812,0.014515376649796963
"As the US economy showed strength, the Federal Reserve continued to raise policy rate that prompted ASEAN central banks to increase interest rates to temper currency depreciation.",0.7299183011054993,0.12726639211177826,0.1428152620792389
"In addition, household consumption declined as global oil prices surged, while exports struggled amid the growth slowdown in China.",0.008345868438482285,0.0197847131639719,0.9718694090843201
"Moving forward, risk-aversion is expected as many awaits the development on key global geopolitical and economic issues, including the US-China trade war and the Brexit.",0.4364388585090637,0.3861704468727112,0.17739064991474152
"On the domestic front, inflation challenges marked the Philippine economy in 2018 as average inflation accelerated to a nine-year high, largely fueled by higher global oil prices, local food supply problems, and the weaker peso.",0.12022732198238373,0.015134193003177643,0.8646384477615356
"At the start of 2019, inflation has softened, falling to its lowest level in 10 months.",0.009814959019422531,0.018807439133524895,0.9713776111602783
"Looking ahead, with inflation now in a downtrend, the Philippine economy has the opportunity to return to a low-inflation and high growth environment, especially as election spending boosts overall demand.",0.9493880867958069,0.03079230897128582,0.019819609820842743
"Against the backdrop of these developments, the Ayala group will continue to execute on its five-year growth strategy for 2020 as it closely monitors key trends and potential risks in the global and domestic economies as well as in the industries where it operates.",0.7788195610046387,0.21274544298648834,0.008434983901679516
"A robust risk management system allows the company to maximize opportunities for reinvention, and navigate the challenges faced by its business units.",0.8271908760070801,0.16517607867717743,0.007632985711097717
"For the year 2018, a total of P=217.4 billion was spent at the group level in support of the parent’s own investment program as well as the expansion initiatives of its real estate, telecom, water, and energy units, and the ramp-up of its industrial technologies, education, infrastructure, and healthcare businesses.",0.6443580985069275,0.34770137071609497,0.007940624840557575
Ayala parent has set aside P=51.8 billion in capital spending for the year.,0.10295537114143372,0.8788573145866394,0.018187249079346657
"In 2018, 84% or P=43.7 billion of this budget has been deployed largely to support the stock rights offering of BPI and IMI as well as to fund the expansion of our emerging businesses: AC Energy, AC Industrials, AC Infra, AC Health and AC Education.",0.38545674085617065,0.6061528921127319,0.008390319533646107
"ALI spent P=110.1 billion in capital expenditures to support the aggressive completion of new projects, 41% of which was spent on residential projects; 23% on commercial projects; 15%, land acquisition; 12%, development of estates; and 9%, on investments.",0.148696169257164,0.8388888239860535,0.012414975091814995
"MWC ended 2018 with total capital expenditures of P=10.0 billion, 23% lower than the previous year.",0.00900788139551878,0.015474947169423103,0.975517213344574
The Manila Concession spent a total of P=8.0 billion (inclusive of concession fee payments) for capital expenditures in 2018.,0.1178942620754242,0.8697856068611145,0.01232012826949358
