sentence,positive,neutral,negative
"There were also capital redemptions amounting to =P47.50 million in NorthWind, P=830.98 million ($16.31 million) in UAC Energy Holdings Pty (“UACH”) and P=19.51 billion ($400.00 million) in ACEC.",0.04361697658896446,0.9267189502716064,0.029664084315299988
"The Group also acquired the non-controlling interest in MSPDC and NorthWind with carrying amount of P=18.77 million and P=294.8 million, respectively.",0.05585497245192528,0.9311899542808533,0.012955080717802048
Current ratio & acid test ratio increased due to higher liquid assets such as receivables at period end alongside the decrease in current liabilities primarily from short-term loans repayment.,0.9456276297569275,0.016082314774394035,0.03829006850719452
Significant increase in D/E ratio was driven by additional liabilities with the issuance of bonds despite the increase in equity accounts.,0.9513218998908997,0.02732200361788273,0.021356182172894478
Asset-to-equity ratio also increased as the increase in total assets outpaced the increase in total equity.,0.9596371054649353,0.02196733094751835,0.018395625054836273
The increase in total debt and increase in cash and cash equivalents combined with lower capital accounts and retained earnings at year-end resulted to a lift in the ratio.,0.9314004778862,0.016005782410502434,0.05259374901652336
"Return on equity partially decreased despite higher net income year-on-year, while return on assets registered an increase due to higher generation capacities combined with the increase in the Group’s total assets, as compared in the same period last year.",0.28285637497901917,0.021946905180811882,0.6951967477798462
"Asset turnover’s increase mainly attributable to the Group’s efficiency in generating revenue from its assets, alongside the inclusion of international operations to ACEN.",0.9533392190933228,0.032927751541137695,0.013733072206377983
"There were no material off-balance sheet transactions, arrangements, obligations, and other relationships of the Parent Company with unconsolidated entities or other persons created during the reporting period.",0.015897927805781364,0.8864797353744507,0.09762229025363922
"ACEN has material commitments to invest in capital expenditure projects mainly in the following: 288MW solar project in Buguey and Lal-lo, Cagayan and the proposed 275MW expansion of Gigasol Palauig solar project in Zambales.",0.5740355849266052,0.4170111417770386,0.008953239768743515
"120MWdc solar power project in Alaminos, Laguna through Solarace1; 150MW diesel plant in Pililla, Rizal through Ingrid, a joint venture of ACEN, ACE Endevor and APHPC o 60MWdc solar power project in Palauig, Zambales through Gigasol3; 50MWac (72MWdc) solar power project in Arayat and Mexico, Pampanga through Greencore 3, a joint venture of ACEN, ACE Endevor and Citicore; 500MW solar power project in San Marcelino, Zambales through Santa Cruz Solar; 2x20 MW Alaminos Battery Energy Storage System (BESS) Project through Giga Ace 4; 160MW wind farm in Balaoi, Pagudpud, Ilocos Norte through BWPC, in partnership with UPC Renewables; Investment into 4MW renewable energy laboratory in Bataan through BSEI; 521MWdc New England Solar Farm (NESF) and adjacent 50MW battery energy storage system located near Uralla in New South Wales through UPC-ACE Australia, a joint venture of ACEN and UPC Renewables Australia.",0.12863770127296448,0.8614208102226257,0.009941479191184044
Various Vietnam wind farms: 252MW wind farm in Quang Binh through AMI Renewables Energy Joint Stock Company 88MW wind farm in Ninh Thuan through BIM Energy Joint Stock Co.(“BIME”) 40MW second phase of the Mui Ne Wind Farm in Binh Thuan through the partnership with the Blue Circle.,0.0871504694223404,0.9035308361053467,0.009318724274635315
60MW Lac Hoa & Hoa Dong wind farm in Soc Trang through a joint venture with UPC Funding of up to U.S.$100 million for new technology investments in the Philippines.,0.798219621181488,0.19472412765026093,0.007056211121380329
"Any known trends, events or uncertainties that have had or that were reasonably expected to have material favorable or unfavorable impact on net revenues/income from continuing operations The results of operations of ACEN and its subsidiaries depend to a significant extent, on the performance of the Philippine economy.",0.04550303891301155,0.8955447673797607,0.05895218253135681
"The current highly competitive environment, operation of priority-dispatch variable renewable energy, and community quarantines resulted in lower demand for electricity and have driven market prices of electricity downward.",0.014301656745374203,0.025100918486714363,0.9605973958969116
Movements in the WESM prices could have a significant favorable or unfavorable impact on the Group’s financial results.,0.02734675630927086,0.05148349329829216,0.9211698174476624
"Any known trends or any known demands, commitments, events or uncertainties that will result in or that are reasonably likely to result in the registrant’s liquidity increasing or decreasing in any material way - The Group is developing a line-up of renewable energy projects as part of its growth aspiration.",0.16897046566009521,0.776053786277771,0.05497576668858528
"Several capital raising activities were executed in 2021: the 2.27 billion shares sold through SRO, the subscription by Arran to 4 billion primary shares pursuant to a private placement, and the issuance of 1.58 billion primary shares for FOO.",0.08776050060987473,0.9025465846061707,0.009692944586277008
The wind regime is high during the northeast monsoon (“amihan”) season in the first and fourth quarter when wind turbines generate more power to be supplied to the grid.,0.17691296339035034,0.7948972582817078,0.028189729899168015
The generation drops in the second and third quarter due to low wind regime brought about by the southwest monsoon (“habagat”).,0.007215858902782202,0.022835034877061844,0.9699491262435913
