filename,ticker,year,sentence,positive,neutral,negative
CNVRG_2020.csv,CNVRG,2020,"As of December 31, 2020, we have entered into agreements with various suppliers for the construction, delivery and installation of property and equipment amounting to ₱5.3 billion (2019 - ₱7.7 billion).",0.8651575446128845,0.12245659530162811,0.01238587312400341
CNVRG_2020.csv,CNVRG,2020,"We have and are continuing to deploy capital expenditures to extend and augment our proprietary end-to-end fiber network, comprising of our domestic backbone, distribution and last-mile networks, and our international connectivity networks.",0.834147036075592,0.15867915749549866,0.007173840422183275
CNVRG_2020.csv,CNVRG,2020,"We had aggregate capital expenditures of approximately ₱35.2 billion (U.S.$732.7 million) from 2016 through December 31, 2020.",0.05225124582648277,0.9325425028800964,0.015206237323582172
CNVRG_2020.csv,CNVRG,2020,"Our capital expenditures were ₱1.2 billion in 2016, ₱2.1 billion in 2017, ₱6.3 billion in 2018, ₱10.0 billion in 2019 and ₱15.6 billion in 2020.",0.045873068273067474,0.8998986482620239,0.05422825366258621
CNVRG_2020.csv,CNVRG,2020,"In 2021, we currently expect to incur capital expenditures in the aggregate amount of approximately ₱20 billion (U.S.$416.5 million) toward, among other things, further expanding our domestic network (comprising of our domestic backbone, distribution and last mile networks), and securing additional access to international connectivity (including the purchase of 5Tbps of international bandwidth capacity from Telstra in August 2020).",0.8982278108596802,0.09228166192770004,0.009490573778748512
CNVRG_2020.csv,CNVRG,2020,"Beyond 2021, we expect to incur significant capital expenditures toward our long-term goal of expanding our fiber network to cover 55% of all Philippine households (of 27.5 million households, according to MPA) with our network by 2025.",0.9230748414993286,0.06251542270183563,0.014409728348255157
CNVRG_2020.csv,CNVRG,2020,"We categorize our capital expenditures as follows: Domestic backbone, which, when completed, will connect the three major Philippine islands of Luzon, Visayas and Mindanao in a single continuous loop, with the primary Luzon segment already operational as of December 31, 2020, and the primary Visayas and Mindanao segments expected to be operational by 2021.",0.1361607313156128,0.8553389310836792,0.008500336669385433
CNVRG_2020.csv,CNVRG,2020,"The domestic backbone comprises of both outside plant equipment, or passive or not electrically powered network equipment (e.g. fiber), and inside plant equipment, or active or electrically powered network equipment (e.g. routers).",0.027194326743483543,0.9519960284233093,0.020809680223464966
CNVRG_2020.csv,CNVRG,2020,"We estimate our domestic backbone capital expenditures on a per kilometer basis according to the length of the network that we are planning to develop; Distribution network, which connects the domestic backbone with the network access points (“NAPs”), and the ports mounted on the NAPs.",0.05622287467122078,0.9311937689781189,0.01258335541933775
CNVRG_2020.csv,CNVRG,2020,"When entering into a new area, rollout capital expenditure is approximately U.S.$150 per port with subsequent augmentation of additional ports costing approximately U.S.$30 per port.",0.08230294287204742,0.9063794612884521,0.011317605152726173
CNVRG_2020.csv,CNVRG,2020,We were able to deploy 1.5 million ports in 2020.,0.8875380754470825,0.10466883331537247,0.007793073542416096
CNVRG_2020.csv,CNVRG,2020,"We construct poles to support our distribution network, particularly where NAPs are hoisted.",0.1006515696644783,0.8890073895454407,0.010341019369661808
CNVRG_2020.csv,CNVRG,2020,"Until 2025, the majority of our distribution network rollout will be focused on deepening our penetration in Luzon.",0.7892026901245117,0.20418961346149445,0.006607733201235533
CNVRG_2020.csv,CNVRG,2020,"We also estimate the number of additional poles that our distribution network will require and the expected capital expenditure per pole; Customer premise equipment (“CPE”), which are the modems and routers provided to residential subscribers.",0.1168535128235817,0.8738957047462463,0.009250754490494728
CNVRG_2020.csv,CNVRG,2020,"The cost for each CPE for a FTTH subscriber is approximately U.S.$70, and it is depreciated over three years.",0.02134638838469982,0.9137328863143921,0.06492071598768234
CNVRG_2020.csv,CNVRG,2020,"The annual CPE cost that we incur is directly correlated to the volume of gross residential subscriber additions in a given year; International connectivity, which connects our domestic network with key international networks.",0.21331778168678284,0.7729648947715759,0.013717243447899818
CNVRG_2020.csv,CNVRG,2020,"For example, in August 2020, we entered into an agreement with Telstra International Limited to purchase 5Tbps of international bandwidth capacity, providing a 15-year IRU on two major intra-Asia networks for an attractive cost.",0.9342588186264038,0.055138591676950455,0.010602624155580997
CNVRG_2020.csv,CNVRG,2020,"This 5Tbps of bandwidth capacity is equivalent to approximately seven times our current leased bandwidth capacity, and has been priced at an aggregate unit cost that is meaningfully lower compared to our average contracted lease costs at present.",0.8096084594726562,0.1088518276810646,0.08153974264860153
CNVRG_2020.csv,CNVRG,2020,"Going forward, Converge intends to continue to secure proprietary access to international bandwidth capacity through similar agreements with other international carriers, which can provide us with significant cost savings; and Other property, plant and equipment and intangible assets, such as IT systems and software.",0.8852452635765076,0.10743527859449387,0.007319453172385693
CNVRG_2020.csv,CNVRG,2020,"In 2020, our capital expenditures were allocated as follows: 60% to our Outside Plant Equipment, or passive or not electrically powered network equipment, related to the construction of our proprietary end-to-end fiber network.",0.08730725198984146,0.903233528137207,0.009459213353693485
CNVRG_2020.csv,CNVRG,2020,"These include investments into fiber-optic cables, the construction of our domestic backbone and distribution networks, including the construction of poles, the installation of network access points and ports.",0.2472386658191681,0.7453438639640808,0.007417444605380297
CNVRG_2020.csv,CNVRG,2020,"18% to our Inside Plant Equipment, or active or electrically powered network equipment, related to the construction of our proprietary end-to-end fiber network.",0.06305375695228577,0.926862895488739,0.010083314031362534
CNVRG_2020.csv,CNVRG,2020,This includes dense wavelength division multiplexing (“DWDM”) equipment and routers for activating the network buildout discussed in the outside plant equipment above.,0.0714050680398941,0.9185374975204468,0.010057411156594753
CNVRG_2020.csv,CNVRG,2020,"12% to our Customer Premises Equipment, which are the modems and routers provided to residential subscribers.",0.05358222872018814,0.9361853003501892,0.010232399217784405
CNVRG_2020.csv,CNVRG,2020,"10% to other Capex, which include Right-of-Use Assets, Intangible Assets, Transportation and Heavy Equipment, Land, Office Equipment and Furniture, Leasehold Improvements and Tools and Facility Equipment  We did not have any other off-balance sheet arrangements or obligations that were likely to have a current or future effect on our financial condition, revenues or expenses, results of operations, liquidity, capital expenditures or capital resources that is material to investors.",0.02037774585187435,0.8761394619941711,0.10348275303840637
CNVRG_2020.csv,CNVRG,2020,"The most important types of risk the Company manages are credit risk, market risk and liquidity risk.",0.028522759675979614,0.9453150033950806,0.02616223320364952
CNVRG_2020.csv,CNVRG,2020,"For a detailed discussion, see Note 22.2 of our consolidated financial statements included in this Report.",0.03080528788268566,0.9471995830535889,0.02199515327811241
