filename,ticker,year,sentence,positive,neutral,negative
GLO_2020.csv,GLO,2020," Full year consolidated service revenues posted a 2% decline from the record level revenues of ₱149.0 billion last year to only ₱146.4 billion in 2020, due mainly to the impact of the pandemic and the extended quarantine restrictions to most business segments except for Home Broadband.",0.010060099884867668,0.014298313297331333,0.975641667842865
GLO_2020.csv,GLO,2020,"The robust performance of Home Broadband was offset by Mobile, Corporate Data and Fixed line Voice, which all registered a decline against last year.",0.056547611951828,0.011352714151144028,0.9320996403694153
GLO_2020.csv,GLO,2020,"The significant growth in data revenue, which accounts for 76% of total service revenues mainly fueled this year’s performance, as millions logged in from home for work, business, education, entertainment, telehealth and other online services.",0.9515494704246521,0.028850728645920753,0.019599877297878265
GLO_2020.csv,GLO,2020,o Mobile business revenues as of end-December of 2020 slid by 7% from nearly ₱111.0 billion last year to ₱103.1 billion this year mainly due to the negative effects of the ECQ/MECQ period.,0.006922220345586538,0.01737685315310955,0.9757009148597717
GLO_2020.csv,GLO,2020,"Mobile revenues improved in the second half of the year with higher prepaid top-up levels and postpaid subscriber acquisitions, as the country reopened business activities, bringing back jobs and increasing the mobility of Filipinos, albeit below full capacities under GCQ/Modified GCQ.",0.9588519930839539,0.018885670229792595,0.022262318059802055
GLO_2020.csv,GLO,2020,"o Buoyed by the robust demand for fast and reliable internet connection, the Home Broadband business enjoyed a banner year with double-digit growth, posting a 23% year-",0.9514740109443665,0.02997332438826561,0.018552666530013084
GLO_2020.csv,GLO,2020,on-year increase from the ₱21.7 billion posted in 2019 to a record ₱26.8 billion as of end- December of 2020.,0.9504544138908386,0.0268689077347517,0.022676708176732063
GLO_2020.csv,GLO,2020,"The outstanding performance of the Home Broadband business was largely driven by the continued subscriber base expansion and increased demand for Home Prepaid Wi-Fi. o Despite the improvement in Corporate Data revenues in the fourth quarter, full year revenues remained lower versus last year at ₱12.5 billion, or 3% year-on-year decline.",0.010210852138698101,0.015360599383711815,0.9744285345077515
GLO_2020.csv,GLO,2020,"Corporate Data’s drop in yearly revenues was attributed to lower domestic and international services, partly cushioned by higher information and communication technology (ICT) revenues.",0.011289536952972412,0.015450728125870228,0.9732598066329956
GLO_2020.csv,GLO,2020,o Fixed line Voice revenues likewise were lower year-on-year by 2%.,0.009193462319672108,0.01583590917289257,0.9749705791473389
GLO_2020.csv,GLO,2020," Non-telco products and services, on the other hand, generated a total of P1.3 billion revenues as of end-December 2020, or up by 99% from last year mostly coming from ECPay and Yondu.",0.9550440311431885,0.029555032029747963,0.015400939621031284
GLO_2020.csv,GLO,2020, Total operating expenses and subsidy as of end-December 2020 amounted to ₱72.9 billion from nearly ₱73.0 billion in 2019.,0.6817283034324646,0.029085753485560417,0.28918594121932983
GLO_2020.csv,GLO,2020,"The increases from trade provisions, subsidy, staff costs, rent, and repairs & maintenance were muted by the decline in interconnection fees, utilities and services.",0.6952781677246094,0.038841523230075836,0.2658803164958954
GLO_2020.csv,GLO,2020," Total depreciation and amortization expenses for the year rose to ₱35.4 billion from ₱34.1 billion reported in 2019, given Globe’s continued massive network investments despite the pandemic.",0.9500294327735901,0.01702539063990116,0.03294520080089569
GLO_2020.csv,GLO,2020," Overall, Globe ended the year with total costs and expenses at ₱108.3 billion or 1% higher from ₱107.1 billion a year ago, due to increases across many expense line items except for interconnect costs, utilities and services.",0.9378836750984192,0.016345517709851265,0.04577082395553589
GLO_2020.csv,GLO,2020,"Higher expenses for the period were mainly to support management strategies, business, and data-network expansion.",0.471456915140152,0.5097963213920593,0.018746785819530487
GLO_2020.csv,GLO,2020," Globe’s consolidated EBITDA, which totaled ₱73.5 billion, was below last year’s level of ₱76.0 billion mainly due to COVID-19 that impacted the topline figures.",0.00897752121090889,0.016087591648101807,0.9749348759651184
GLO_2020.csv,GLO,2020,EBITDA margin likewise declined to 50% from last year’s 51%.,0.008452409878373146,0.016348587349057198,0.9751989841461182
GLO_2020.csv,GLO,2020,"Excluding the one-time additional provisions for doubtful accounts booked in the first half of the year amounting to ₱1.9 billion and the ₱0.7 billion other income, normalized EBITDA would have been ₱74.8 billion or 2% lower versus last year.",0.024936212226748466,0.021555358543992043,0.9535084366798401
GLO_2020.csv,GLO,2020,This would have translated to a 51% normalized EBITDA margin which is at par compared to 2019.,0.9367901086807251,0.04288717359304428,0.02032267302274704
GLO_2020.csv,GLO,2020," Non-operating charges grew year-on-year by 21%, due to the one-time impairment loss amounting to ₱4.2 billion largely from the network change out covering the full sunset of the 3G assets and the existing copper infrastructure, as partly offset by the gain of ₱2.4 billion mostly from the deemed sale of investment in Mynt following a third-party infusion by Bow Wave and loan revaluation.",0.7333685159683228,0.02063113823533058,0.24600042402744293
GLO_2020.csv,GLO,2020," The Globe Group ended year with consolidated net income of ₱18.6 billion, sliding by 16% from the reported net income in 2019.",0.008161528967320919,0.015353959985077381,0.976484477519989
GLO_2020.csv,GLO,2020,"This was mainly attributed to the 3% decline in EBITDA, 4% increase in depreciation expenses and 21% increase in non-operating charges.",0.1978895217180252,0.030923258513212204,0.7711872458457947
GLO_2020.csv,GLO,2020,"Excluding the impact of the extraordinary items booked this year, normalized net income would have been ₱20.4 billion, or 8% lower from a year ago.",0.02275531180202961,0.01852659322321415,0.9587181210517883
GLO_2020.csv,GLO,2020," Globe's core net income, which excludes the impact of non-recurring charges, one-time gain, foreign exchange gains and mark-to-market charges, stood at ₱19.5 billion, down by 13% year- on-year.",0.0067474753595888615,0.017282763496041298,0.9759697318077087
GLO_2020.csv,GLO,2020," Total cash capital expenditures as of end-December 2020 stood at ₱60.3 billion, 18% higher than last year's level of ₱51.0 billion.",0.9442660808563232,0.03347823768854141,0.02225557155907154
GLO_2020.csv,GLO,2020,"About 86% of the total capex for the period was spent on data network with the Company’s continued focus on increasing capacity, cell site upgrades and fast- track fiberization of Filipino homes nationwide for better internet experience.",0.666749119758606,0.3257816731929779,0.007469222415238619
GLO_2020.csv,GLO,2020,"The Globe Group ended the year with total operating revenues of ₱160.5 billion, down by 4% from the ₱166.7 billion recorded last year.",0.006882776506245136,0.016643673181533813,0.9764735698699951
GLO_2020.csv,GLO,2020,This was driven by the 2% year-on-year decline in the topline to reach only ₱146.4 billion in 2020 from ₱149.0 billion in 2019.,0.02362767606973648,0.01015279907733202,0.9662195444107056
GLO_2020.csv,GLO,2020,The COVID-19 pandemic and the extended quarantine restrictions adversely affected most business segments except for Home Broadband.,0.011788780800998211,0.05120307579636574,0.9370080828666687
GLO_2020.csv,GLO,2020,"Mobile service revenues, which accounted for 70% of Globe’s consolidated service revenues for the year just ended, posted a 7% decline at ₱103.1 billion, due to the negative impact of the pandemic.",0.008238067850470543,0.015672454610466957,0.9760894179344177
GLO_2020.csv,GLO,2020,"Globe Group’s Fixed line and Home Broadband full year 2020 revenues stood at close to ₱42.0 billion, 12% higher year-on-year from ₱37.4 billion in 2019, bolstered by the solid contributions of home broadband.",0.9586427211761475,0.020211484283208847,0.021145746111869812
GLO_2020.csv,GLO,2020,Mobile non-service revenues declined year-on-year by 31%.,0.008113818243145943,0.015978282317519188,0.9759079217910767
GLO_2020.csv,GLO,2020,"Fixed Line and Home Broadband non- service revenues, however grew significantly compared to last year’s ₱394 million.",0.9545347690582275,0.015252971090376377,0.03021220490336418
GLO_2020.csv,GLO,2020,"Meanwhile, non- service revenues from non-telco products and services likewise improved from ₱2 million in 2019 vs. ₱91 million in 2020.",0.958998441696167,0.016143707558512688,0.024857889860868454
GLO_2020.csv,GLO,2020,"Mobile data, the biggest contributor to the mobile business, accounted for 70% of total mobile service revenues (vs. 64% in 2019).",0.09979487210512161,0.8867132663726807,0.013491890393197536
GLO_2020.csv,GLO,2020,"As of end-December 2020 mobile data revenues posted close to ₱72.0 billion, a slight improvement of 1% versus a year ago.",0.9534546136856079,0.01616070792078972,0.03038465604186058
GLO_2020.csv,GLO,2020,"Likewise, data traffic rose given consumers more conscientious data usage boosted by Globe’s recalibrated data offers that provided better value and served the changing needs of its customers.",0.9561097025871277,0.025417355820536613,0.01847299002110958
GLO_2020.csv,GLO,2020,"Over the years, Globe has pioneered efforts in introducing product and services that cater to the customer’s digital preferences, enabling Globe to be the preferred brand for Filipinos’ digital lifestyle choices.",0.8683456778526306,0.1246042400598526,0.007050046231597662
GLO_2020.csv,GLO,2020,"The Company partnered with internet giant Google to provide free access to Google Mobile services and to provide its subscribers the ability to charge purchases of applications to their postpaid bill or prepaid load, bypassing the need for credit cards and enhancing the convenience for Globe and TM customers.",0.9038032293319702,0.08776216953992844,0.008434516377747059
GLO_2020.csv,GLO,2020,"Likewise, the Company was able to tailor-make lifestyle packages for all its subscribers to meet their social networking needs and crowd-sourced content (via Facebook and Wattpad), chatting and digital communication (Viber), music (Spotify), sports (NBA) and media.",0.43683215975761414,0.5557220578193665,0.007445792201906443
GLO_2020.csv,GLO,2020,"Moreover, Globe's array of content partners including premium online streaming platforms like Netflix, iflix, HBO GO; social media networks such as YouTube; online shopping sites; and mobile games usher in a whole new entertainment experience, made more relevant at this time when most Filipinos are staying at home.",0.4592876136302948,0.5299332737922668,0.010779187083244324
GLO_2020.csv,GLO,2020,"In order to cater to the changing needs of its customers with the new normal, Globe Prepaid launched “Go promos” in 2020 with the biggest GBs for ALL sites and apps.",0.4309482276439667,0.5619127750396729,0.007139062974601984
GLO_2020.csv,GLO,2020,"Customers you choose from different “Go promos” with the biggest GBs, unlimited texts to all networks, and more.",0.05100158974528313,0.9354673624038696,0.01353108324110508
GLO_2020.csv,GLO,2020,"At the same time, Globe prepaid subscribers can further amplify its internet connectivity with the “GoBooster” add-ons to get more GBs, more app access, or even longer validity.",0.8073023557662964,0.1862998902797699,0.006397674325853586
GLO_2020.csv,GLO,2020,"In addition, Globe further gave its customers more option to level up their connection with Go+ promos.",0.815665066242218,0.1778758317232132,0.0064591215923428535
GLO_2020.csv,GLO,2020,"Customers can have more GBs to use, as each promo comes with extra home-only GBs.",0.21844999492168427,0.7722325921058655,0.009317399002611637
GLO_2020.csv,GLO,2020,"Home-only GBs are the same as their usual mobile data (can be used for all sites and apps) but can only be used in one (1) location -- which is in their nominated address: (1) Go+120 - 3GB for all sites + 8GB home- only data, unli allnet texts, 1GB GoWiFi access, valid for 7 days (2) Go+160 - 3GB for all sites + 12GB home-only data, unli allnet texts, 2GB GoWiFi access, valid for 7 days (3) Go+190 - 3GB for all sites + 15GB home-only data, unli allnet texts, 2GB GoWiFi access, valid for 7 days.",0.020890746265649796,0.955984890460968,0.02312437817454338
GLO_2020.csv,GLO,2020,See also https://www.globe.com.ph/prepaid/go-plus.html for more details.,0.030603963881731033,0.94591224193573,0.023483822122216225
GLO_2020.csv,GLO,2020,"Meanwhile, Globe “Surf4All” is the Philippines’ first-ever data-sharing promo.",0.3278485834598541,0.66302090883255,0.00913050677627325
GLO_2020.csv,GLO,2020,This offers users a high data allowance that’s usable on all sites and can be shared with up to four (4) users for one week.,0.20645315945148468,0.7854279279708862,0.00811892468482256
GLO_2020.csv,GLO,2020,Customers get to enjoy up to 20GB (15GB base data allocation + limited-time 5GB bonus data) of shareable data at an affordable ₱249.,0.24539043009281158,0.7466136813163757,0.007995883002877235
GLO_2020.csv,GLO,2020,"This new Globe data promo allows its customers to share data with Prepaid, Postpaid, Platinum, Globe At Home Prepaid WiFi, MyFi and TM users.",0.22378034889698029,0.769058883190155,0.007160811685025692
GLO_2020.csv,GLO,2020,See also https://www.globe.com.ph/surf4all.html for more details.,0.026130545884370804,0.9451509714126587,0.0287184901535511
GLO_2020.csv,GLO,2020,Globe’s Mobile browsing services also include the consumable mobile internet plan “GoSurf”which gives its subscribers bulk megabytes of mobile data consumable per kilobyte for as low as ₱15 for 2 days.,0.06431584060192108,0.9225780367851257,0.013106138445436954
GLO_2020.csv,GLO,2020,See also https://www.globe.com.ph/prepaid/gosurf.html for more details.,0.027661750093102455,0.9456793665885925,0.02665892243385315
GLO_2020.csv,GLO,2020,"Globe Prepaid customers may also choose to subscribe to “GoSakto” to create their own prepaid combo with mix of calls, text, and surf promos, select a duration, assign their own promo name, which can also be shared with friends (see https://www.globe.com.ph/prepaid/gosakto.html for details).",0.03421134129166603,0.9504931569099426,0.015295449644327164
GLO_2020.csv,GLO,2020,Prepaid customers may also choose to subscribe to “GoUnli” offers to get unlimited calls and texts with Free data for their favorite apps for as low as ₱20 per day (see https://www.globe.com.ph/prepaid/gounli.html for more details).,0.030915046110749245,0.9354942440986633,0.03359067440032959
GLO_2020.csv,GLO,2020,"Meanwhile, TM customers can subscribe to the following EasySurf promos for as low as P10: EasySurf10 give customers 40MB valid for 1 day; EasySurf15 give customers 100MB plus 30MB for Instagram valid for 2 day; EasySurf30 give customers 300MB plus 50MB for Facebook, Viber, or Snapchat valid for 2 day; EasySurf50 give customers 1GB plus 1GB/day for choice of app bundle: Watch & Play, Share & Shop or Listen & Discover, 1 GB GoWiFi access and Unli allnet texts valid for 3 day.",0.05603002384305,0.9287011027336121,0.015268799848854542
GLO_2020.csv,GLO,2020,"30-day validy offers for TM are also available (EasySurf 299 for 2GB, EasySurf599 for 5GB, EasySurf999 for 10GB, EasySurf 1299 for 15GB, EasySurf1999 for 30 GB and EasySurf2499 for 50GB) plus 10GB for choice of app bundle: Watch & Play, Share & Shop or Listen & Discover, and 1 GB GoWifi access.",0.03872988745570183,0.9458818435668945,0.01538832113146782
GLO_2020.csv,GLO,2020,SuperSurf for unlimited mobile internet are likewise available for ₱50 for 1-day unli internet and ₱200 for 5 days unli internet subject to fair use policy.,0.051816195249557495,0.9371283650398254,0.011055435985326767
GLO_2020.csv,GLO,2020,"For more details on TM’s latest offers, check https://www.tmtambayan.ph/promos/a20.html In addition to these, the Company continue to offer ChatPlus, an all-in-one bundle that not only gives customers access to their favorite messaging apps but to a generous amount of IDD minutes to the US Mainland and Canada for as low as ₱25 per day.",0.24201472103595734,0.7480112314224243,0.009974053129553795
GLO_2020.csv,GLO,2020,"Customers can enjoy free access to messaging apps (such as Facebook Messenger, Viber, WhatsApp, Google Messenger, Kakao Talk, WeChat, and LINE) plus 15 IDD minutes for calls from the Philippines to the US Mainland and Canada.",0.06379102915525436,0.9251156449317932,0.01109333336353302
GLO_2020.csv,GLO,2020,"For those opting for a longer subscription and free IDD minutes, there is also the ChatPlus 299, valid for 30 days with 60 IDD minutes.",0.0362052395939827,0.947737991809845,0.016056813299655914
GLO_2020.csv,GLO,2020,"Likewise, the Company continued to offer Globe Prepaid Roam Surf, a flat rate for unlimited data roaming service to its prepaid customers.",0.1793709099292755,0.8113646507263184,0.009264501743018627
GLO_2020.csv,GLO,2020,"This offer allows prepaid customers to access the internet abroad for an entire 24-hour cycle, making their data connectivity experience more seamless and worry-free.",0.7680020332336426,0.22419458627700806,0.007803469896316528
GLO_2020.csv,GLO,2020,"Roam Surf for Globe Prepaid is available in three variants, ₱599 for 24 hours, ₱1,797 for 3 full days and ₱2,995 for 5 full days.",0.03210994973778725,0.9475401639938354,0.020349865779280663
GLO_2020.csv,GLO,2020,"With Globe’s commitment to enrich its lineup of content partners to cater to its customers' evolving digital lifestyle, Filipinos can now catch the Korean wave on Viu, the localized digital platform providing online Asian video content.",0.792770266532898,0.19999833405017853,0.007231507916003466
GLO_2020.csv,GLO,2020,"K-Drama fans with a Globe Postpaid ThePLAN or ThePLAN PLUS subscription can enjoy unlimited downloads, priority viewing as fast as 8 hours after its telecast, full HD resolution up to 1080p, and access to Asian blockbuster movies with Viu Premium!",0.16665631532669067,0.8247543573379517,0.008589355275034904
GLO_2020.csv,GLO,2020,"Simply text VIU99 to 8080, click on the activation link that will be sent to you via text, confirm your Mobile number, and download the Viu app to start enjoying your 30-day subscription to Viu Premium.",0.05070355534553528,0.9338507056236267,0.01544574461877346
GLO_2020.csv,GLO,2020,"For hardcore video creators, there are bigger data promos such as TIKTOK50 with 600MB for 7 days and TIKTOK199 with 1GB for 30 days.",0.03863940015435219,0.936825692653656,0.024534933269023895
GLO_2020.csv,GLO,2020,"Mobile voice revenues, which accounted for 20% of total mobile service revenues, ended the year at ₱20.1 billion, down by 16% from ₱24.0 billion in 2019.",0.007034272886812687,0.01678416132926941,0.9761815071105957
GLO_2020.csv,GLO,2020,"Consistent with global trends, voice revenues declined given the continued migration of voice traffic to alternative internet-based applications.",0.009942987933754921,0.017605554312467575,0.972451388835907
GLO_2020.csv,GLO,2020,"To support the revenue stream, the Company continues to provide attractive and affordable bulk voice offers such: (1) Tawag 2361 for 20-minute consumable calls for only ₱20 - Globe Postpaid and Globe Prepaid subscribers by simply replacing the 0 at the start of the number with 236 (dial 236 + 10-digit Globe number); (2) Super Sakto Calls1- calls to Globe and TM numbers for only ₱0.15 per second by just replacing the zero at the beginning of the Globe or TM number with 232 (dial 232 + 10-digit Globe number) for the special rate to apply; (3) GoCall100 provides Globe Prepaid subscribers 500 minutes of on-net calls to Globe/TM for only ₱100 for 7 days.",0.09108234941959381,0.8966259956359863,0.012291673570871353
GLO_2020.csv,GLO,2020,"Meanwhile, TM subscribers may choose UnliTawag15 which gives its subscribers unlimited calls to all Globe and TM subscribers for as low as ₱15 valid for 1 day.",0.04704054072499275,0.9375228881835938,0.015436520799994469
GLO_2020.csv,GLO,2020,"Through the Extend all-you-can promo, TM subscribers can extend for another 24 hours their favorite TM promo for only ₱5 up to 365 times by simply texting “EXTEND” to 8888 before their current promo expires.",0.04079834744334221,0.9425196647644043,0.01668200083076954
GLO_2020.csv,GLO,2020,"Filipinos who wish to stay connected with their loved ones abroad, Globe continues to offer its pioneering per-second charging for international voice calls, IDD Sakto Calls for both Globe Postpaid and Globe Prepaid subscribers.",0.17785337567329407,0.8145263195037842,0.007620259653776884
GLO_2020.csv,GLO,2020,Globe Prepaid’s GoTipIDD service remains to be the lowest per-minute IDD rates in the market (Go tipIDD30 for as low as Php2.50 per minute valid for three (3) days; Go tipIDD50 valid for seven (7) days; Go tipIDD100 valid for 15 days).,0.03147263824939728,0.16586025059223175,0.8026670813560486
GLO_2020.csv,GLO,2020,"For TM customers, they may opt to subscribe to TM TipIDD30 which offers four (4) minutes of international calls to Saudi, UAE, Kuwait, Bahrain, Italy, UK, Australia and Japan for only P30 a day.",0.02507559023797512,0.9509049654006958,0.024019431322813034
GLO_2020.csv,GLO,2020,Globe also provides unlimited calls to 49 countries for as low as Php99 to select destinations worldwide with Globe’s Unli IDD.,0.1364324986934662,0.8544552326202393,0.009112302213907242
GLO_2020.csv,GLO,2020,Unli IDD99 provides for one day unlimited calls to three (3) unique international numbers for only Php99; Unli IDD499 for unlimited calls to 5 unique international numbers for 7 days and Unli IDD 999 for unlimited calls to 10 unique international numbers for 30 days.,0.030034363269805908,0.9479551911354065,0.02201051265001297
GLO_2020.csv,GLO,2020,"In addition, Globe also provides a bucket IDD service to popular and selected overseas destinations with Go IDD.",0.17118491232395172,0.8217490911483765,0.007065982557833195
GLO_2020.csv,GLO,2020,"Globe Prepaid customers can make IDD calls for as low as ₱1.50 per minute to U.S. Mainland, Canada, China, Hawaii, Hong Kong, Singapore, and Thailand for only P200, valid for 30 day.",0.024744724854826927,0.9114707708358765,0.06378454715013504
GLO_2020.csv,GLO,2020,"Meanwhile, GoCallIDD is an IDD promo with the lowest rates to the Middle East at ₱5 per minute.",0.11592027544975281,0.7219263315200806,0.16215336322784424
GLO_2020.csv,GLO,2020,It also allows customers to call Europe for only ₱5 per minute and North America and Asia Pacific for only ₱2.50 per minute.,0.041010383516550064,0.943279504776001,0.01571018062531948
GLO_2020.csv,GLO,2020,GoCallIDD comes in four variants (see https://www.globe.com.ph/help/international/promos/gocallidd.html for more details).,0.03395533934235573,0.9453273415565491,0.0207173153758049
GLO_2020.csv,GLO,2020,Roam Unli Call & Text is likewise available for Globe Postpaid customers for them to enjoy all-day calls and texts while roaming (see https://www.globe.com.ph/help/international/promos/roam-unli-call-text.html for variants under this promo).,0.07192473113536835,0.9184078574180603,0.009667432866990566
GLO_2020.csv,GLO,2020,"Roam Saver is a pay-per-use promo that lets Globe Postpaid customers enjoy discounted calls and texts while roaming in over 60 international destinations worldwide, for a fixed registration fee of ₱199 (see https://www.globe.com.ph/help/international/promos/roam-saver.html for more details).",0.06734494864940643,0.9220698475837708,0.010585181415081024
GLO_2020.csv,GLO,2020,"In addition, Filipinos or OFWs abroad can likewise spend more talk time with their loved ones in the Philippines with Globe Duo International.",0.14147478342056274,0.8487716317176819,0.009753596968948841
GLO_2020.csv,GLO,2020,"It is a subscription service that assigns a virtual international number to a registered Globe Prepaid, Postpaid or TM Mobile number.",0.025950301438570023,0.9542664289474487,0.019783293828368187
GLO_2020.csv,GLO,2020,"This service allows their friends and family members from abroad to call that virtual number, giving them a ‘local' calling experience, which is more affordable compared to the standard IDD call rates to the Philippines.",0.2974964380264282,0.6932930946350098,0.009210415184497833
GLO_2020.csv,GLO,2020,"This service is currently available in 24 countries including USA, Canada, UK, Japan, Korea, Spain, Malaysia, Australia, Hong Kong, New Zealand, Israel, Norway, Sweden, Denmark, South Africa, Portugal, Finland, Italy, Greece, Netherlands, Switzerland, Austria, Ireland and Belgium.",0.06462450325489044,0.9252554178237915,0.010120055638253689
GLO_2020.csv,GLO,2020,Promo packages from 7-days up to 180-days subscription are available for all Globe Postpaid/Prepaid and TM subscribers in the Philippines.,0.06449678540229797,0.9257374405860901,0.009765741415321827
GLO_2020.csv,GLO,2020,"Filipinos abroad may also avail of the promo by registering the Globe Postpaid/Prepaid or TM Mobile numbers of their family members in the Philippines via website: duo.globe.com.ph. The Company also provides its subscribers with the best possible mix of voice, SMS, and Mobile browsing services through its combo packages.",0.09758911281824112,0.8942170143127441,0.00819386262446642
