filename,ticker,year,sentence,positive,neutral,negative
GLO_2020.csv,GLO,2020,"For Globe Prepaid, subscribers have the choice to avail of Go AllNet or GoUnli promos.",0.045065987855196,0.943230152130127,0.011703834868967533
GLO_2020.csv,GLO,2020,"Go AllNet promos provide unlimited SMS to all networks, plus calls to Globe/TM and calls to all networks and consumable Mobile browsing (see https://www.globe.com.ph/prepaid/goallnet.html for more details).",0.050018057227134705,0.9383226037025452,0.011659340932965279
GLO_2020.csv,GLO,2020,"Meanwhile, GoUnli promos provides for unlimited calls and texts with Free data for your favorite apps for as low as ₱20 per day (see https://www.globe.com.ph/prepaid/gounli.html for more details).",0.054695650935173035,0.9302123188972473,0.015092011541128159
GLO_2020.csv,GLO,2020,"GoAll20 is Globe Prepaid's promo available in selected areas in the Philippines which offers unlimited texts to all networks, 30 minutes of calls to Globe/TM numbers and Free access to Facebook.",0.0823233351111412,0.9081677198410034,0.009508923627436161
GLO_2020.csv,GLO,2020,"Mobile SMS revenues, which accounted for 10% of total mobile service revenues, closed the year at ₱11.0 billion or 29% lower against the ₱15.5 billion reported last year.",0.013668626546859741,0.015777327120304108,0.9705541133880615
GLO_2020.csv,GLO,2020,"Similar to voice, mobile SMS declined, with traffic moving to over-the-top (OTT) messaging apps.",0.0596296563744545,0.4232914447784424,0.5170789361000061
GLO_2020.csv,GLO,2020,Globe continues to provide its prepaid subscribers with all-day unlimited on-net SMS with UnliTxt promos: UnliTxt20 valid for 1 day for ₱20; UnliTxt40 valid for 2 days for P40 and UnliTxt80 valid for 5 days for ₱80.,0.0742260217666626,0.9124205112457275,0.013353425078094006
GLO_2020.csv,GLO,2020,GoUnlitxt49 was also made available in the market which offers its subscribers unlimited on-net texts to Globe/TM for only ₱49 valid for 7 days.,0.06275563687086105,0.9246326684951782,0.012611716985702515
GLO_2020.csv,GLO,2020,"For budget conscious customers, SuliTxt15 provides its subscribers with 100 text messages to Globe/TM for one day.",0.07069811224937439,0.9185132384300232,0.010788661427795887
GLO_2020.csv,GLO,2020,"With the use of the GoSakto, Globe Prepaid subscribers can create a promo exactly how they want it based on their lifestyle and budget.",0.04630272090435028,0.9401401281356812,0.013557196594774723
GLO_2020.csv,GLO,2020,"With TM’s continued dedication of giving its subscribers wonderful and value-for-money offers, TM customers can get to choose from a wide array of promo offers ranging from bucket or unlimited SMS.",0.269978404045105,0.7217090725898743,0.008312450721859932
GLO_2020.csv,GLO,2020,"With SuliTxt5, TM subscribers can send 25 texts to TM/Globe, valid for 1 day for only ₱5. UnliAllNet10 which provides its subscribers with unlimited texts to all networks for ₱10 a day or subscribe to Txt10 for unlimited text to TM/Globe, valid for 2 days.",0.058361418545246124,0.9307633638381958,0.010875220410525799
GLO_2020.csv,GLO,2020,Also available is AstigTxt30 which gives TM subscribers 5 days of unlimited text to TM/Globe for ₱30.,0.04426052048802376,0.9431370496749878,0.012602472677826881
GLO_2020.csv,GLO,2020,Dagdagtxt was likewise introduced to the market which provides additional 100 all-network texts as an add-on to an UnliCall promo for only ₱5 a day.,0.18115215003490448,0.8091722726821899,0.009675531648099422
GLO_2020.csv,GLO,2020,"Moreover, TM subscribers can also enjoy unlimited one day text to TM/Globe as an add-on to their UnliTawag15 subscription for just a minimal price of ₱5. Meanwhile, for Filipinos who wish to send messages to their family and friends abroad, Globe continues to offer iTxtAll30, for 100 SMS to over 40 countries and all networks in the Philippines for only Php30 a day.",0.09873057901859283,0.8919726014137268,0.009296797215938568
GLO_2020.csv,GLO,2020,"Also available is Unli iSMS USA299 for unlimited texts to the US Mainland* valid for 30 days and Unli IDD and iSMS USA599 for unlimited calls and texts to the US Mainland* valid for 30 days (*Excluding Alaska, Guam, Hawaii, American Samoa, Northern Mariana Islands, Puerto Rico and U.S. Virgin Islands).",0.028366219252347946,0.9512473344802856,0.020386410877108574
GLO_2020.csv,GLO,2020,In support of national development by providing access to user-friendly and cost-effective internet connectivity to more Filipinos.,0.7548470497131348,0.23764273524284363,0.007510168943554163
GLO_2020.csv,GLO,2020,"GoWiFi continues its expansion plans nationwide, particularly in high- traffic areas like malls, hospitals, and schools to make high-quality internet connection accessible and affordable to more Filipinos.",0.8925995826721191,0.1006079912185669,0.006792417261749506
GLO_2020.csv,GLO,2020,"GoWiFi is now available in over 2,800 hotspots nationwide, enabling users to get connected with up to 100MBps of high-speed internet within the coverage of a GoWiFi site, regardless of network provider. GoWiFi services are available in 2 modes: regular (free) GoWiFi and premium (paid) GoWiFi",0.05059355869889259,0.937507688999176,0.011898697353899479
GLO_2020.csv,GLO,2020,"Both are open to all users with WiFi-enabled devices, regardless of network service provider (local or while roaming in the Philippines).",0.06305575370788574,0.9272106289863586,0.009733648039400578
GLO_2020.csv,GLO,2020,"To connect to free GoWiFi, just open the Wi-Fi-enabled device’s WiFi settings and connect to the “@FreeGoWiFi” hotspot, register, choose from the different WiFi package and start surfing.",0.03449908271431923,0.9456700682640076,0.01983080990612507
GLO_2020.csv,GLO,2020,"To connect to premium wifi, connect to “@<site>_FreeGoWiFi SSID, register, then select a WiFi offer.",0.034679703414440155,0.9489976763725281,0.01632261648774147
GLO_2020.csv,GLO,2020,"In line with its vision of accelerating the digital transformation of the Philippines, Globe has cemented another key partnership with one of the country’s biggest provinces, Ilocos Norte.",0.9516749382019043,0.0318131260573864,0.0165119431912899
GLO_2020.csv,GLO,2020,"The milestone partnership was formalized through a Memorandum of Agreement signing last February 11, 2020 at the Ilocos Norte Provincial Capital.",0.8720257878303528,0.1191195398569107,0.008854667656123638
GLO_2020.csv,GLO,2020,"GoWiFi services are now available in key areas in Ilocos Norte, such as the Capitol Building, Laoag City Hall, Batac City Hall, San Nicolas IT Park, and Aurora Park in Laoag.",0.1836891621351242,0.8084108829498291,0.00789999682456255
GLO_2020.csv,GLO,2020,"In line with this partnership, Globe will also be holding sessions of its Digital Thumbprint Program (DTP) that aims to educate local government representatives and its community members on responsible online behavior.",0.23616112768650055,0.7557932138442993,0.008045610040426254
GLO_2020.csv,GLO,2020,"This includes being knowledgeable about online safety, cyberbullying, online etiquette, identifying fake news, among many others.",0.04372761771082878,0.9269827604293823,0.029289646074175835
GLO_2020.csv,GLO,2020,"Likewise, Globe sealed another landmark partnership with one of the country’s economic powerhouses, Iloilo City.",0.9439688920974731,0.03828355297446251,0.0177475418895483
GLO_2020.csv,GLO,2020,"KapitWiFi is Globe's most affordable community WiFi service, which allows customers to connect to a hotspot, purchase a promo, and enjoy surfing in a snap.",0.24372656643390656,0.7488083839416504,0.007465038448572159
GLO_2020.csv,GLO,2020,"The new product promises affordability with no monthly fees and device cashouts, and availability to all mobile users regardless of network provider.",0.7858750820159912,0.2074050009250641,0.006719894707202911
GLO_2020.csv,GLO,2020,"For as low as P50, customers can enjoy up to 3GB of data allocation for three days.",0.10166367888450623,0.8860031962394714,0.012333144433796406
GLO_2020.csv,GLO,2020,"Lanit. GoWiFi, the most pervasive public WiFi service in the country, is also now available in key locations including the City Hall of Iloilo, Sunburst Park, Freedom Grandstand, Iloilo International Airport, and Iloilo River Plains Integrated School in Brgy.",0.39206695556640625,0.5996831059455872,0.008249999955296516
GLO_2020.csv,GLO,2020,"Apart from providing free WiFi access in its campus premises, GoWiFi also powered up the integrated school’s computer lab with unlimited internet access to aid students in their digital learning experience.",0.2776283621788025,0.7143535614013672,0.008018054999411106
GLO_2020.csv,GLO,2020,"Among other provinces and municipalities that was recently powered by GoWifi are Mangaldan, Pangasinan and San Jose Del Monte, Bulacan.",0.07883913069963455,0.9103741645812988,0.010786696337163448
GLO_2020.csv,GLO,2020,"In the third quarter of 2020, GoWiFi delivered free internet connectivity in key Davao and Cebu locations such as hospitals, government offices, airports in the province and others.",0.33747464418411255,0.6532256603240967,0.009299618192017078
GLO_2020.csv,GLO,2020,"Residents can enjoy up to 100MBps of high-speed internet powered by GoWiFi in the following sites: ● Hospitals - Davao Doctors Hospital, Davao Limso Hospital, Southern Philippines Medical Center Davao Medical School Foundation, Inc., San Pedro Hospital of Davao City, Inc., Cebu City Medical Center, Cebu Community Hospital, Cebu Doctors Hospital, and Chong Hua Hospital Mandaue ● Government offices - PhilHealth Office (Davao), Land Transportation Office - Davao, Land Transportation Office - Tagum, Tagum City Hall ● Airports - Davao International Airport, Mactan-Cebu International Airport ● Supermarkets - Shopwise Cebu Basak and Shopwise Express Cebu Basak ● Bus Terminal - Bogo Bus Terminal in Cebu In the last quarter of the year, Globe and the local government of Pasig City embarked on a new partnership to provide high-speed and affordable internet access through GoWiFi and KonekTayo WiFi.",0.7964997291564941,0.1962634027004242,0.007236846722662449
GLO_2020.csv,GLO,2020,"High-quality connectivity is now made accessible to Pasig City residents, helping them become more digitally- empowered, especially as more resources and services shift to digital in the new normal.",0.8366036415100098,0.15528036653995514,0.008115974254906178
GLO_2020.csv,GLO,2020,"Formerly known as KapitWiFi, KonekTayo WiFi is a fast and secure community WiFi service that aims to provide households with affordable internet.",0.2079397439956665,0.785053014755249,0.007007194217294455
GLO_2020.csv,GLO,2020,"With KonekTayo WiFi, customers simply need to connect to a KonekTayo WiFi hotspot, purchase a promo and surf all day.",0.028962284326553345,0.945965588092804,0.025072185322642326
GLO_2020.csv,GLO,2020,"KonekTayo WiFi will deploy buses converted into mobile WiFi hubs, equipped with special antennas that broadcast WiFi signal in select areas in the city, as students and workers rely on reliable home internet for learning and working.",0.18163660168647766,0.8094871044158936,0.008876336738467216
GLO_2020.csv,GLO,2020,"KonekTayo WiFi via these buses will be available from 7:00 a.m. to 7:00 p.m. from Monday to Sunday at the Ilaya Covered Court, Santolan Big Ampitheatre and Kapitolyo San Joaquin Elementary School.",0.03761132434010506,0.9482694864273071,0.014119165018200874
GLO_2020.csv,GLO,2020,"Likewise, key locations such as the Pasig City Hall will be powered with GoWiFi so that Pasigueños have easy and reliable access to the internet.",0.2639249265193939,0.7282584309577942,0.007816626690328121
GLO_2020.csv,GLO,2020,"More GoWiFi locations such as the Pasig Mega Market, Rave Park, Plaza Bonifacio, among others, are lined up for implementation in 2021.",0.4669947922229767,0.5231544375419617,0.009850754402577877
GLO_2020.csv,GLO,2020,"GoWiFi likewise extends free internet connection in key public areas in Negros Occidental such as gas stations, supermarkets, hospitals and transport terminals and ticketing offices.",0.4435862898826599,0.5463842153549194,0.010029587894678116
GLO_2020.csv,GLO,2020,"Globe closed 2020 with a total Mobile subscriber base of 76.6 million, down by 19% from last year coming mostly from the decline in acquisitions given the extended quarantine imposed in the country, coupled with the increase in prepaid churn, as churn levels continue to normalize from the impact of the 1-year load validity regulation.",0.00792513508349657,0.015661494806408882,0.9764133095741272
GLO_2020.csv,GLO,2020,"Combined, Globe Prepaid and TM gross acquisitions comprised 99% of acquired SIMs during the period.",0.06360690295696259,0.9235142469406128,0.012878838926553726
GLO_2020.csv,GLO,2020,"With the increase in overall churn rates for the year of 5.4% from 3.3% a year ago, net reduction in subscribers totalled 17.6 million this period from the 20.1 million net additions last year.",0.6984360218048096,0.021490072831511497,0.2800739109516144
GLO_2020.csv,GLO,2020,"Globe Postpaid had a total of 2.5 million cumulative subscribers as of the end of December 2020, lower by 7% from 2019.",0.011523568071424961,0.01596708782017231,0.9725093841552734
GLO_2020.csv,GLO,2020,"Globe Postpaid’s gross acquisitions for the period stood at 381,773 or 38% lower than last year due mainly to the impact of the pandemic.",0.009130081161856651,0.01536931935697794,0.9755006432533264
GLO_2020.csv,GLO,2020,"With lower acquisitions and increase in churn rate (from 1.7% a year ago to 1.8% this period) total net reduction in postpaid subscribers stood at 177,030 versus last year’s net addition of 92,406.",0.0790504664182663,0.02190123125910759,0.8990483283996582
GLO_2020.csv,GLO,2020,"Globe Postpaid ARPU registered at ₱850, which was 6% lower from a year ago.",0.020436078310012817,0.01233265083283186,0.967231273651123
GLO_2020.csv,GLO,2020,"Globe’s prepaid segment, which includes the Globe Prepaid1 and TM brands, accounts for 97% of its total Mobile subscriber base.",0.07166775315999985,0.9177989363670349,0.010533349588513374
GLO_2020.csv,GLO,2020,"As end-December 2020, cumulative prepaid subscribers stood at about 74.1 million, 19% lower than the 91.5 million subs reported in 2019.",0.008071539923548698,0.02092611975967884,0.9710023999214172
GLO_2020.csv,GLO,2020,"Based on the National Telecommunications Commission (NTC) Memorandum Circular 03-07-2009, the first expiry periods ranges from 3 days for P10 or below to 120 days for reloads amounting to P300 and above.",0.0177528765052557,0.9295433163642883,0.05270383879542351
GLO_2020.csv,GLO,2020,"Under this policy, subscribers are included in the subscriber count until churned.",0.01687590405344963,0.9128208160400391,0.07030320912599564
GLO_2020.csv,GLO,2020,"Under the new pronouncement based on the National Telecommunications Commission (NTC), Department of Information and Communications Technology (DICT), and Department of Trade and Industry (DTI) Joint Memorandum Circular No. 05-12-2017 all prepaid load will now carry a one-year expiration period regardless of amount.",0.016972433775663376,0.9315776228904724,0.051449961960315704
GLO_2020.csv,GLO,2020,"In compliance to this new regulation, effective January 6, 2018, Globe implemented a one-year expiration period for prepaid load worth 300 pesos and above.",0.09276506304740906,0.8584560751914978,0.04877888783812523
GLO_2020.csv,GLO,2020,"Then on July 5, 2018, Globe expanded the implementation to all Globe prepaid load, including those with denominations below 300 pesos.",0.434556245803833,0.5575068593025208,0.007936940528452396
GLO_2020.csv,GLO,2020,a. Globe Prepaid Globe Prepaid gross acquisitions dropped by 32% year-on-year from 25.1 million subscribers last year.,0.008743730373680592,0.014676742255687714,0.976579487323761
GLO_2020.csv,GLO,2020,"Total cumulative Globe Prepaid subscribers was at 38.1 million as of end-December 2020, or 15% drop from a year ago.",0.01249087043106556,0.012543878518044949,0.9749651551246643
GLO_2020.csv,GLO,2020,Prepaid churn rate for the period jumped to 4.8% from last year’s 3.1% as the churn continue to normalize from the impact of the 1-year load validity regulation.,0.9534400701522827,0.021267535164952278,0.025292357429862022
GLO_2020.csv,GLO,2020,"Globe Prepaid ARPU stood at ₱93, which was 14% lower from a year ago.",0.029034428298473358,0.01763729751110077,0.9533282518386841
GLO_2020.csv,GLO,2020,"b. TM TM’s gross acquisitions declined year-on-year by 27%, from prior year’s 27.4 million subscribers due to the impact of COVID-19 pandemic.",0.008880926296114922,0.014711624942719936,0.9764074087142944
GLO_2020.csv,GLO,2020,"Total cumulative TM subscribers stood at 36.0 million as of end- December of 2020, or 23% decline from the 46.7 million reported last year.",0.02189350500702858,0.008803197182714939,0.9693033695220947
GLO_2020.csv,GLO,2020,TM churn rate for the period jumped to 6.2% from last year’s 3.5% as the churn rates continue to revert to historical levels.,0.9520667791366577,0.020318282768130302,0.027614934369921684
GLO_2020.csv,GLO,2020,TM ARPU posted a 2% decline from ₱61 reported in 2019.,0.028462566435337067,0.009455190040171146,0.9620822668075562
GLO_2020.csv,GLO,2020,"Globe Group’s Fixed line and Home Broadband full year 2020 revenues stood at close to ₱42.0 billion, 12% higher year-on-year from ₱37.4 billion in 2019, bolstered by the solid contributions of home broadband.",0.9586427211761475,0.020211484283208847,0.021145746111869812
GLO_2020.csv,GLO,2020,"Globe Home Broadband maintained its momentum by posting a 23% year-on-year revenue growth to reach a record ₱26.8 billion this period, from ₱21.7 billion last year.",0.9488534927368164,0.025682909414172173,0.025463541969656944
GLO_2020.csv,GLO,2020,"Total home broadband subscriber base now stands at 3.8 million, up 88% from the year earlier, driven mainly by the sustained increase in fixed wireless broadband users, which was up by 122% versus last year.",0.9583267569541931,0.02359367161989212,0.0180794820189476
GLO_2020.csv,GLO,2020,"As of end-December of 2020, Home Prepaid Wi-Fi (HPW) data traffic soared to 545 petabytes from 115 petabytes in 2019.",0.9470565319061279,0.028104545548558235,0.024838870391249657
GLO_2020.csv,GLO,2020,"Corporate Data ended the year with ₱12.5 billion revenues, down by 3% from a year ago, largely coming from domestic and international services as partly mitigated by higher information and communication technology (ICT) revenues.",0.007556336000561714,0.0161829125136137,0.9762608408927917
GLO_2020.csv,GLO,2020,"Globe’s total Fixed line Voice revenues however, declined year-on-year by 2%.",0.00782528705894947,0.01608818955719471,0.9760865569114685
GLO_2020.csv,GLO,2020,"This service generates revenues from both inbound and outbound international call traffic, with pricing based on agreed international termination rates for inbound traffic revenues and NTC-approved ILD rates for outbound traffic revenues.",0.04658665508031845,0.9396817684173584,0.013731568120419979
GLO_2020.csv,GLO,2020,Globe’s ILD voice revenues from the mobile and fixed line businesses declined year-on-year by 33% (from ₱5.1 billion in 2019 to only ₱3.4 billion in 2020).,0.0070950062945485115,0.017581572756171227,0.975323498249054
GLO_2020.csv,GLO,2020,This is attributed to the continued migration of international traffic through other internet-based applications.,0.7883113026618958,0.20260664820671082,0.009082060307264328
GLO_2020.csv,GLO,2020,"Globe ended the year with total costs and expenses at ₱108.3 billion or 1% higher from ₱ 107.1 billion a year ago, due to increases across many expense line items except for interconnect costs, utilities and services.",0.9454235434532166,0.01711403764784336,0.03746248409152031
GLO_2020.csv,GLO,2020,"Higher expenses for the period were mainly to support management strategies, business, and data-network expansion.",0.471456915140152,0.5097963213920593,0.018746785819530487
GLO_2020.csv,GLO,2020,"Globe group’s full year interconnect charges significantly declined by 75%, posting only ₱1.0 billion in 2020 from nearly ₱4.0 billion last year.",0.01817934960126877,0.01269463635981083,0.9691259860992432
GLO_2020.csv,GLO,2020,The decrease in interconnection fees was largely due to this year’s non-imposition of interconnect charges1 on mobile domestic voice and SMS transactions coupled with lower roaming payout.,0.2824191153049469,0.06012468412518501,0.6574562788009644
GLO_2020.csv,GLO,2020,"Marketing and Subsidy expenses grew by 18% year-on-year to reach ₱8.7 billion from ₱7.4 billion reported a year ago mostly coming from subsidy and higher spending for ads & promos, as partly cushioned by lower commissions given the decline in postpaid acquisitions.",0.9586900472640991,0.017725536599755287,0.023584401234984398
GLO_2020.csv,GLO,2020,"Staff costs were up 3% to nearly ₱16.0 billion in 2020 from ₱15.5 billion in 2019 due to the 4% increase in headcount (8,353 in 2020 vs. 8,048 in 2019), translating to higher salaries and employee-related benefits, combined with the increase in retirement fund and hospitalization insurance, as partly offset by lower incentives this year.",0.9551588296890259,0.01742716133594513,0.02741391211748123
GLO_2020.csv,GLO,2020,"Utilities, supplies, and other administrative expenses, which contribute 9% of total operating expenses and subsidy, posted a decline of 4%, totaling to ₱6.3 billion from ₱6.6 billion reported in 2019.",0.0121564120054245,0.01443383190780878,0.9734097719192505
GLO_2020.csv,GLO,2020,These were partially offset by higher fuel consumption for generator sets and supplies such as Covid-19 protective supplies.,0.8692023754119873,0.037530120462179184,0.09326750040054321
GLO_2020.csv,GLO,2020,"Rent expenses for the year 2020 was at ₱6.2 billion, up by 7% from a year ago due to expenses related to international cable facilities, IP Port, and leases for cell sites, partly cushioned by lower leases for service vehicles and local interconnection facilities.",0.9564217925071716,0.01692325808107853,0.0266549214720726
GLO_2020.csv,GLO,2020,This accounts for 9% of total operating expenses and subsidy.,0.040534112602472305,0.9268121123313904,0.032653726637363434
GLO_2020.csv,GLO,2020,"Repairs and maintenance costs for the year stood at ₱9.6 billion, up by 13% from the ₱8.5 billion reported a year ago.",0.9553382396697998,0.021201003342866898,0.023460807278752327
GLO_2020.csv,GLO,2020,"This was largely on higher expenditures for communication equipment, supplies facilities’ preventive repairs and international cable system maintenance.",0.3348422646522522,0.0891864076256752,0.5759713053703308
GLO_2020.csv,GLO,2020,"This account includes provisions related to trade, non-trade and traffic receivables and inventory obsolescence.",0.016793545335531235,0.9175556898117065,0.06565076112747192
GLO_2020.csv,GLO,2020,"Globe group’s provisions significantly grew year-on-year by 38% largely from the additional trade provisions due to the pandemic, as partly countered by lower inventory provisions.",0.9531874060630798,0.016763318330049515,0.03004920855164528
GLO_2020.csv,GLO,2020,"Accounting for 26% of total operating expenses and subsidy, services and expenses decreased by 9% from ₱20.9 billion reported in 2019 driven mostly by lower managed services and customer call center services, counterbalanced by higher professional/advisory fees.",0.00909324549138546,0.015418278984725475,0.9754884839057922
GLO_2020.csv,GLO,2020,"Total depreciation and amortization expenses for the year rose to ₱35.4 billion from ₱34.1 billion reported in 2019, given Globe’s continued massive network investments despite the pandemic.",0.9500294327735901,0.01702539063990116,0.03294520080089569
GLO_2020.csv,GLO,2020,"The Globe Group’s full year 2020 non-operating charges, increased by 21% from the ₱9.1 billion reported last year to nearly ₱11.0 billion this period.",0.9568598866462708,0.02280370518565178,0.02033638209104538
GLO_2020.csv,GLO,2020,"Higher non-operating expenses this period was mainly due to the one-time impairment loss amounting to ₱4.2 billion largely from the network change out covering the full sunset of the 3G assets and the existing copper infrastructure, as partly offset by the gain of ₱2.4 billion, mostly from the deemed sale of investment in Mynt following a third-party infusion by Bow Wave and loan revaluation.",0.09172073751688004,0.030997641384601593,0.8772816061973572
GLO_2020.csv,GLO,2020,Globe’s balance sheet and cash flows remain strong with ample liquidity and gearing comfortably within bank covenants.,0.9325463771820068,0.05585065856575966,0.011602932587265968
GLO_2020.csv,GLO,2020,"Globe Group’s consolidated assets as of 31 December 2020 amounted to ₱339.8 billion compared to ₱304.3 billion as of December 31, 2019.",0.10358353704214096,0.02201356366276741,0.8744028210639954
GLO_2020.csv,GLO,2020,"Consolidated cash, cash equivalents and short-term investments (including investments in assets available for sale and held to maturity investments) was at ₱19.5 billion as of end-December of 2020 compared to ₱8.3 billion as of end-December of 2019.",0.03709067404270172,0.016188066452741623,0.9467211961746216
GLO_2020.csv,GLO,2020,Globe closed 2020 with gross debt to equity ratio on a consolidated basis at 2.02:1 and is still within the 3.0:1 debt to equity limit dictated by Globe’s debt covenants.,0.18181301653385162,0.5793125629425049,0.23887448012828827
GLO_2020.csv,GLO,2020,"Meanwhile, net debt to equity ratio was at 1.79:1 as of end-December 2020 and 1.58:1 as of end December 2019.",0.03519607335329056,0.8887242674827576,0.07607970386743546
