filename,ticker,year,sentence,positive,neutral,negative
GLO_2020.csv,GLO,2020,Globe’s current ratio stood at 0.80:1 as of 31 December 2020 and 0.73:1 as of 31 December 2019 which are at par with industry standards.,0.1204100027680397,0.8538485765457153,0.025741463527083397
GLO_2020.csv,GLO,2020,"While Globe’s average current ratio was below the SEC’s minimum of 1:1, Globe believes it has more than sufficient cash flows from operations to meet its debt maturities, currently and prospectively.",0.9291748404502869,0.039772190153598785,0.031052961945533752
GLO_2020.csv,GLO,2020,The financial tests under Globe’s loan agreements include compliance with the following ratios:  Total debt* to equity not exceeding 3.0:1;  Total debt to EBITDA not exceeding 3.5:1;  Debt service coverage1 exceeding 1.3 times; and  Secured debt ratio2 not exceeding 0.2 times.,0.07814231514930725,0.8964633345603943,0.02539440430700779
GLO_2020.csv,GLO,2020,"As of 31 December 2020, Globe is well within the ratios prescribed under its loan agreements.",0.3816584646701813,0.6076911687850952,0.010650400072336197
GLO_2020.csv,GLO,2020,"On July 23, 2020, Globe Telecom issued a USD 300 million 10-year and USD 300 million 15-year US dollar denominated senior notes with a coupon rate of 2.5% and 3.0%, respectively.",0.059063319116830826,0.92560213804245,0.015334504656493664
GLO_2020.csv,GLO,2020,"The notes are unrated and have been listed on the Singapore Exchange Securities Trading Limited on July 24, 2020.",0.024786153808236122,0.9543988108634949,0.0208150502294302
GLO_2020.csv,GLO,2020,"The net proceeds from the issue of the notes will be used to finance Globe’s capital expenditures, maturing and/or existing obligations, and for general corporate requirements.",0.07104060798883438,0.9167160987854004,0.01224331371486187
GLO_2020.csv,GLO,2020,"Net cash flows provided by operating activities in 2020 was at ₱65.2 billion, down by 12% from the previous year.",0.0072817252948880196,0.01600838080048561,0.9767099022865295
GLO_2020.csv,GLO,2020,"Meanwhile, net cash used in investing activities amounting to ₱61.6 billion, was 12% higher from last year.",0.9569498300552368,0.02074527181684971,0.022304799407720566
GLO_2020.csv,GLO,2020,"Consolidated cash capital expenditures as of end-December 2020 amounted to ₱60.3 billion, or 18% higher from last year’s ₱51.0 billion.",0.9530137181282043,0.023460717871785164,0.023525524884462357
GLO_2020.csv,GLO,2020,Consolidated net cash provided by financing activities amounted to ₱8.5 billion in 2020 versus last year’s net cash used for financing activities of ₱33.3 billion.,0.8935725688934326,0.02782617323100567,0.07860131561756134
GLO_2020.csv,GLO,2020,"This was mainly driven by higher proceeds from borrowings as partly offset by increase in repayment of borrowings, and interest payments, coupled with the lease liability payments this period.",0.9405199885368347,0.042248792946338654,0.017231203615665436
GLO_2020.csv,GLO,2020,"Consolidated total debt, likewise increased by 23% from ₱136.3 billion at the end of December 2019 to ₱167.7 billion at the end of December this year.",0.9557424783706665,0.024337468668818474,0.019920123741030693
GLO_2020.csv,GLO,2020,96% of US$ consolidated loans have been effectively converted to PHP via US$963 million in currency hedges.,0.3384416699409485,0.6501917839050293,0.011366559192538261
GLO_2020.csv,GLO,2020,"After swaps, effectively 1% of total debt is denominated in US$.",0.033896833658218384,0.9436408877372742,0.022462286055088043
GLO_2020.csv,GLO,2020,"The Globe Group has available uncommitted short-term credit facilities of ₱16,224 million and USD 84 million, ₱16,350 million and USD 94 million as of December 31, 2020 and December 31, 2019, respectively.",0.07305938005447388,0.9114890694618225,0.01545155979692936
GLO_2020.csv,GLO,2020,"The Globe Group also has available ₱3,000 million committed short-term credit facilities as of December 31, 2020 and December 31, 2019.",0.0745200589299202,0.9127091765403748,0.012770744040608406
GLO_2020.csv,GLO,2020,"There is ₱3,500 million and nil long term committed credit facilities as of December 31, 2020 and December 31, 2019, respectively.",0.039411552250385284,0.9443296790122986,0.016258753836154938
GLO_2020.csv,GLO,2020,"There are ₱700 million and nil outstanding short-term loans as of December 31, 2020 and December 31, 2019, respectively.",0.02828189730644226,0.9491322040557861,0.02258589304983616
GLO_2020.csv,GLO,2020,"Stockholders’ equity as of end-December 2020 was higher by 2% from ₱81,247 million to ₱82,804 million this period.",0.9535303711891174,0.026942068710923195,0.01952759176492691
GLO_2020.csv,GLO,2020,Voting Preferred stock at a par value of ₱5 per share of which 158.5 million shares are outstanding out of a total authorized of 160 million shares.,0.030580027028918266,0.9533731937408447,0.016046708449721336
GLO_2020.csv,GLO,2020,"The dividends for voting preferred stock are declared upon the sole discretion of the Globe Telecom’s BOD. To date, none of the voting preferred shares have been converted to common shares.",0.027924366295337677,0.9541907906532288,0.0178848747164011
GLO_2020.csv,GLO,2020,Non-Voting Preferred stock at a par value of ₱50 per share of which 20 million shares are issued out of a total authorized of 40 million shares.,0.03029586747288704,0.9539524912834167,0.015751643106341362
GLO_2020.csv,GLO,2020,Common shares at par value of ₱50 per share of which 133.4 million are issued and outstanding out of a total authorized of 149 million shares.,0.03386136516928673,0.9502883553504944,0.015850264579057693
GLO_2020.csv,GLO,2020,"The dividend payout rate is reviewed annually and subsequently each quarter of the year, to take into consideration Globe Telecom’s operating results, cash flows, debt covenants, capital expenditure levels and liquidity.",0.025528637692332268,0.9366010427474976,0.03787030652165413
GLO_2020.csv,GLO,2020,"On November 8, 2011, the Board of Directors approved the current dividend policy of Globe Telecom to distribute cash dividend at the rate of 75% to 90% of prior year’s core net income.",0.10791852325201035,0.8816213607788086,0.01046010572463274
GLO_2020.csv,GLO,2020,"On August 6, 2013, the Board of Directors further approved the change in distribution from semi-annual dividend payments to quarterly dividend distributions.",0.05404479429125786,0.924315333366394,0.021639905869960785
GLO_2020.csv,GLO,2020,"On December 10, 2013, the BOD approved to defer the implementation of the quarterly dividend payout to the third quarter of 2014.",0.03297058865427971,0.6779435276985168,0.28908592462539673
GLO_2020.csv,GLO,2020,"On November 5, 2018, the Board of Directors likewise approved the proposed change in the dividend policy from 75% to 90% of prior year’s core net income to 60% to 75% of prior year’s core net income, to be applied to the 2019 dividend declaration.",0.13293032348155975,0.8510345220565796,0.016035158187150955
GLO_2020.csv,GLO,2020,"This adjustment will also ensure the sustainability of the operations in this investment-heavy environment, while protecting future dividends, once planned expansion yields beneficial results.",0.9026113152503967,0.08727941662073135,0.01010924857109785
GLO_2020.csv,GLO,2020,"On February 3, 2020, the BOD approved the declaration of the first quarter cash dividend of ₱27 per common share, payable to common stockholders of record as of February 17, 2020.",0.0869135707616806,0.9017825126647949,0.011303882114589214
GLO_2020.csv,GLO,2020,"Total dividends amounting to ₱3.6 billion was paid last March 4, 2020.",0.03420211002230644,0.9454566836357117,0.020341159775853157
GLO_2020.csv,GLO,2020,"On May 4, 2020, the Globe Board of Directors approved the declaration of the second semi-annual cash dividend for holders of its non-voting preferred shares on record as of July 28, 2020.",0.14459197223186493,0.8437252044677734,0.011682759039103985
GLO_2020.csv,GLO,2020,The amount of the cash dividend shall be at a fixed rate of 5.2006% per annum calculated in respect of each share by reference to the offer price of ₱500.00 per share on a 30/360-day basis for the six-month dividend period.,0.023780010640621185,0.9532630443572998,0.022956959903240204
GLO_2020.csv,GLO,2020,"Total amount of the cash dividend was paid last August 24, 2020.",0.029778284952044487,0.9496808648109436,0.020540853962302208
GLO_2020.csv,GLO,2020,"Likewise, the Board of Directors of Globe approved in a separate approval the declaration of two quarterly distributions of cash dividends of P24.83 per common share paid last June 3, 2020 and September 2, 2020 to shareholders on record as of May 18, 2020 and August 17, 2020, respectively.",0.13875606656074524,0.8463303446769714,0.014913621358573437
GLO_2020.csv,GLO,2020,Each cash dividend payment total to about ₱3.3 billion.,0.06708050519227982,0.9140548706054688,0.01886456273496151
GLO_2020.csv,GLO,2020,"The decision to change the dividend payout for the second and third quarter dividend distribution was an effort to conserve cash, as a healthy balance sheet and strong cashflows are key to managing the challenges brought about by the extended quarantine period.",0.8918271064758301,0.09027563035488129,0.017897246405482292
GLO_2020.csv,GLO,2020,"On November 3, 2020 the Board of Directors of Globe approved the declaration of the fourth quarter cash dividends of ₱31.33 per common share paid last December 3, 2020 to stockholders on record as of November 17, 2020.",0.11399408429861069,0.8744611740112305,0.011544703505933285
GLO_2020.csv,GLO,2020,The fourth quarter cash dividend payment total is about ₱4.2 billion.,0.02427087351679802,0.9467951655387878,0.02893400378525257
GLO_2020.csv,GLO,2020,Total common cash dividend distribution as of end-December 2020 amounted to ₱14.4 billion.,0.02927551046013832,0.9487093687057495,0.022015102207660675
GLO_2020.csv,GLO,2020,"On the same date, Globe BOD approved the declaration of the cash dividend for holders of its voting preferred shares paid last December 3, 2020 to shareholders on record as of November 1 7, 2020.",0.12476155906915665,0.8649954199790955,0.010243039578199387
GLO_2020.csv,GLO,2020,"The amount of the cash dividend was based on the 2019 Benchmark rate of the 3-day average of the 5-year BVAL* (i.e. average of October 24, 25, 28, 2019) plus 2%.",0.021900158375501633,0.9453223347663879,0.03277747333049774
GLO_2020.csv,GLO,2020,The aggregate dividend payment for the voting preferred shares was about P50.0 million.,0.033155135810375214,0.948908269405365,0.01793658919632435
GLO_2020.csv,GLO,2020,"On December 11, 2020, the Board of Directors of Globe also approved the declaration and payment of the first semi-annual 2021 cash dividends for the Company’s non-voting preferred shareholders on record as of January 27, 2021.",0.1566862314939499,0.8331442475318909,0.010169456712901592
GLO_2020.csv,GLO,2020,The amount of the cash dividend shall be at a fixed rate of 5.2006% per annum calculated in respect of each share by reference to the offer price of ₱500.00 per share on a 30/360-day basis for the six-month dividend period.,0.023780010640621185,0.9532630443572998,0.022956959903240204
GLO_2020.csv,GLO,2020,"Payment date: February 22, 2021.",0.02309591695666313,0.9275217652320862,0.04938235506415367
GLO_2020.csv,GLO,2020,"Consolidated Return on Average Equity (ROE) registered at 22.7% as of end-December 2020, compared to 28.9% in 2019 using trailing 12 months net income and based on average equity balances for the year ended.",0.13542568683624268,0.020132696256041527,0.8444416522979736
GLO_2020.csv,GLO,2020,"Using trailing 12 months core net income, which excludes the effects of non- recurring expenses on net income, return on average equity as of end-December 2020 and 2019 were 23.8% and 29.1% respectively.",0.06468720734119415,0.8681982755661011,0.06711451709270477
GLO_2020.csv,GLO,2020,"Accordingly, consolidated basic earnings per common share were ₱135.04 and P162.96, while consolidated diluted earnings per common share were ₱134.40 and ₱162.20 as of end-December 2020 and 2019, respectively.",0.0339273139834404,0.9048948884010315,0.061177849769592285
GLO_2020.csv,GLO,2020,Foreign exchange risks are managed such that USD inflows from operations (transaction exposures) are balanced or offset by the net USD liability position of the company (translation exposures).,0.5361617207527161,0.4459806978702545,0.01785767823457718
GLO_2020.csv,GLO,2020,"Globe Group’s objective is to maintain a position which results in, as close as possible, a neutral effect to the P&L relative to movements in the foreign exchange market.",0.3993760645389557,0.5866895318031311,0.013934345915913582
GLO_2020.csv,GLO,2020,Globe has natural net US$ inflows arising from its operations.,0.48016035556793213,0.2804846465587616,0.2393549680709839
GLO_2020.csv,GLO,2020,"Consolidated foreign currency-linked revenues1 were at 7% and 8% of total gross service revenues for the periods ended 31 December 2020 and 2019, respectively.",0.03272523358464241,0.9017465114593506,0.0655282661318779
GLO_2020.csv,GLO,2020,"In contrast, Globe’s foreign-currency linked expenses were at 14% and 12% of total operating expenses for the same periods ended.",0.040949489921331406,0.2180190235376358,0.7410315275192261
GLO_2020.csv,GLO,2020,"Due to these net US$ inflows, an appreciation of the Peso has a negative impact on Globe’s Peso EBITDA.",0.007980241440236568,0.02922409027814865,0.962795615196228
GLO_2020.csv,GLO,2020,"There were no outstanding forward USD sale contracts as of December 31, 2020.",0.022422466427087784,0.9355310797691345,0.04204648733139038
GLO_2020.csv,GLO,2020,"Globe’s foreign exchange translation exposures result primarily from movements of the Philippine Peso (Php) against the U.S. Dollars (USD) with respect to USD-denominated financial assets, USD- denominated financial liabilities and certain USD-denominated revenues.",0.050494614988565445,0.8051137328147888,0.14439162611961365
GLO_2020.csv,GLO,2020,"Majority of revenues are generated in Php, while bulk of capital expenditures are in USD.",0.03501242399215698,0.9487820267677307,0.01620558463037014
GLO_2020.csv,GLO,2020,"In addition, 29% of debt as of December 31, 2020 are denominated in USD before taking into account any swap and hedges.",0.026535093784332275,0.9504522681236267,0.02301260642707348
GLO_2020.csv,GLO,2020,"After swaps, effectively 1% of total debt is denominated in US$.",0.033896833658218384,0.9436408877372742,0.022462286055088043
GLO_2020.csv,GLO,2020,"As of end-December 2020, the Globe Group posted a total of ₱1,691 million net foreign exchange gain.",0.38906076550483704,0.5966654419898987,0.014273714274168015
GLO_2020.csv,GLO,2020,"The Globe Group‘s foreign exchange risk management policy is to maintain a hedged financial position, after taking into account expected USD flows from operations and financing transactions.",0.2108508199453354,0.7782872915267944,0.01086183451116085
GLO_2020.csv,GLO,2020,Globe Telecom enters into short-term foreign currency forwards and long-term foreign currency swap contracts in order to achieve this target.,0.4757241904735565,0.51436448097229,0.009911387227475643
GLO_2020.csv,GLO,2020,"As of end-December 2020, Globe has US$303 million in cross currency swap contracts which are hedges of the interest and foreign exchange risks of some of our US$ loans maturing in December 2023, August 2024, March 2025, and August 2027.",0.054743800312280655,0.9286688566207886,0.016587359830737114
GLO_2020.csv,GLO,2020,"The MTM of the outstanding swap contracts stood at a loss of ₱1,893 million as of end-December 2020.",0.02484944835305214,0.5162286758422852,0.45892179012298584
GLO_2020.csv,GLO,2020,"As of end-December 2020, Globe has US$660 million in principal only swap contracts which are hedges of the foreign exchange risks of some of our US$ loans maturing in April 2022, October 2022, July 2025, July 2027 and July 2030.",0.04810396581888199,0.93109530210495,0.02080080658197403
GLO_2020.csv,GLO,2020,The MTM of the swap contracts stood at a loss of ₱887 million as of end- December 2020.,0.023201080039143562,0.7149694561958313,0.2618294358253479
GLO_2020.csv,GLO,2020,Globe has US$20 million in outstanding forward USD purchase contracts which remain outstanding as of end-December 2020.,0.07929954677820206,0.90888512134552,0.011815332807600498
GLO_2020.csv,GLO,2020,The mark-to-market of the outstanding forward USD purchase contracts stood at a loss of US$47 million as of end-December 2020.,0.034437745809555054,0.24981504678726196,0.7157471776008606
GLO_2020.csv,GLO,2020,"Globe’s policy is to maintain between 44-88% of its peso debt in fixed rate, and between 31-62% of its US$ debt in fixed rate.",0.03939332440495491,0.941213846206665,0.019392842426896095
GLO_2020.csv,GLO,2020,"As of end-December 2020, Globe has a total of US$40 million in US$ interest swaps and US$303 million in cross currency swaps that were entered in to contracts to achieve these targets.",0.4798624813556671,0.5084324479103088,0.011705097742378712
GLO_2020.csv,GLO,2020,"The US$ swaps fixed some of the Company’s outstanding floating rate debts with quarterly payment intervals up to April 2022, October 2022, December 2023, August 2024, March 2025, March 2027 and August 2027.",0.05214609205722809,0.9152321815490723,0.032621707767248154
GLO_2020.csv,GLO,2020,"As of end-December 2020, 85% (excluding short-term debt) of peso debt is fixed, while 91% of USD debt is fixed after swaps.",0.03800710663199425,0.9416152238845825,0.02037772163748741
GLO_2020.csv,GLO,2020,"In 2020, the Globe Group’s USD fixed rate loans ratio increased to 91% as a result of the issuance of the USD 600 million fixed rate notes.",0.939014196395874,0.05124141275882721,0.009744406677782536
GLO_2020.csv,GLO,2020,The MTM of the interest rate swap contracts (not including the currency swap contracts) stood at a loss of ₱54 million as of end-December 2020.,0.02380041964352131,0.6393460631370544,0.3368534445762634
GLO_2020.csv,GLO,2020,"For investments, the Globe Group does not have investments in foreign securities (bonds, collateralized debt obligations (CDO), collateralized mortgage obligations (CMO), or any instruments linked to the mortgage market in the US).",0.027032962068915367,0.9557552933692932,0.01721171848475933
GLO_2020.csv,GLO,2020,Globe’s excess cash is invested in short term bank deposits.,0.022511495277285576,0.9409318566322327,0.0365566611289978
GLO_2020.csv,GLO,2020,"Furthermore, the Globe Group does not have instruments in its portfolio which became inactive in the market nor does the company have any structured notes which require use of judgment for valuation purposes.",0.015118305571377277,0.9045336246490479,0.08034804463386536
GLO_2020.csv,GLO,2020,"For derivative instruments with optionality, the company relies on valuation reports of its counterparty banks, which are the company’s best estimates of the close-out value of the transactions.",0.027534808963537216,0.943499743938446,0.028965456411242485
GLO_2020.csv,GLO,2020,Gains (losses) on derivative instruments represent the net mark-to-market (MTM) gains (losses) on derivative instruments.,0.029534094035625458,0.7797813415527344,0.19068455696105957
GLO_2020.csv,GLO,2020,"As of December 31, 2020, the MTM value of the derivatives of the Globe Group amounted to ₱2,881.26 million while net loss on derivative instruments arising from changes in MTM reflected in the consolidated income statements as of end-December 2020 amounted to ₱1,579.75 million.",0.027542533352971077,0.8292168974876404,0.1432405561208725
GLO_2020.csv,GLO,2020,"To measure riskiness, the Company provides a sensitivity analysis of its profit and loss from financial instruments resulting from movements in foreign exchange and interest rates.",0.10355032235383987,0.872302234172821,0.02414742484688759
GLO_2020.csv,GLO,2020,"The interest rate sensitivity estimates the changes to the following P&L items, given an indicated movement in interest rates: (1) interest income, (2) interest expense, (3) mark-to-market of derivative instruments.",0.02857145108282566,0.9130974411964417,0.05833115801215172
GLO_2020.csv,GLO,2020,"The foreign exchange sensitivity estimates the P&L impact of a change in the USD/PHP rate as it specifically pertains to the revaluation of the net unhedged liability position of the company, and foreign exchange derivatives.",0.048019543290138245,0.9011099934577942,0.050870440900325775
GLO_2020.csv,GLO,2020,"On October 10, 2011, the NTC issued Memorandum Circular No. 02-10-2011 titled Interconnection Charge for Short Messaging Service requiring all public telecommunication entities to reduce their interconnection charge to each other from ₱0.35 to ₱0.15 per text, which Globe Telecom complied as early as November 2011.",0.12869331240653992,0.716593325138092,0.15471328794956207
GLO_2020.csv,GLO,2020,"On December 11, 2011, the NTC One Stop Public Assistance Center (OSPAC) filed a complaint against Globe Telecom, Smart and Digitel alleging violation of the said MC No. 02-10-2011 and asking for the reduction of SMS off-net retail price from P1.00 to P0.80 per text.",0.025921523571014404,0.13040520250797272,0.8436731696128845
GLO_2020.csv,GLO,2020,"On November 20, 2012, the NTC rendered a decision directing Globe Telecom to:  Reduce its regular SMS retail rate from P1.00 to not more than ₱0.80;  Refund/reimburse its subscribers the excess charge of ₱0.20; and  Pay a fine of ₱200.00 per day from December 1, 2011 until date of compliance.",0.09441238641738892,0.6433762311935425,0.2622113525867462
GLO_2020.csv,GLO,2020,"On May 7, 2014, NTC denied the Motion for Reconsideration (MR) filed by Globe Telecom last December 5, 2012 in relation to the November 20, 2012 decision.",0.053034137934446335,0.5530077219009399,0.3939581513404846
GLO_2020.csv,GLO,2020,Globe Telecom’s assessment is that Globe Telecom is in compliance with the NTC Memorandum Circular No. 02-10-2011.,0.5690419673919678,0.41801613569259644,0.012941984459757805
GLO_2020.csv,GLO,2020,"On June 9, 2014, Globe Telecom filed petition for review of the NTC decision and resolution with the Court of Appeals (CA).",0.06664838641881943,0.33179613947868347,0.6015555262565613
GLO_2020.csv,GLO,2020,"The CA granted the petition in a resolution dated September 3, 2014 by issuing a 60-day temporary restraining order on the implementation of Memorandum Circular 02-10-2011 by the NTC.",0.20847372710704803,0.27433231472969055,0.5171939730644226
GLO_2020.csv,GLO,2020,"On October 15, 2014, Globe Telecom posted a surety bond to compensate for possible damages as directed by the CA.",0.8532928228378296,0.11309857666492462,0.03360858932137489
GLO_2020.csv,GLO,2020,"On June 27, 2016, the CA rendered a decision reversing the NTC’s abovementioned decision and resolution requiring telecommunications companies to cut their SMS rates and return the excess amount paid by subscribers.",0.026294412091374397,0.10990111529827118,0.8638045191764832
GLO_2020.csv,GLO,2020,"The CA said that the NTC order was baseless as there is no showing that the reduction in the SMS rate is mandated under MC No. 02-10-2011; there is no showing, either that the present P1.00 per text rate is unreasonable and unjust, as this was not mandated under the memorandum.",0.0349075086414814,0.39415839314460754,0.5709341168403625
GLO_2020.csv,GLO,2020,"Moreover, under the NTC’s own MC No. 02-05-2008, SMS is a value added service (VAS) whose rates are deregulated.",0.04146483913064003,0.9424142241477966,0.01612091436982155
GLO_2020.csv,GLO,2020,The respective motions for reconsideration filed by NTC and that of intervenor Bayan Muna Party List (Bayan Muna),0.020799538120627403,0.9372420907020569,0.04195843264460564
GLO_2020.csv,GLO,2020,"The NTC thus elevated the CA’s ruling to the Supreme Court (SC) via a Petition for Review on Certiorari dated September 15, 2017.",0.34999966621398926,0.6304483413696289,0.019552070647478104
GLO_2020.csv,GLO,2020,"For its part, Bayan Muna filed its own Petition for Review on Certiorari of the CA’s Decision.",0.08438179641962051,0.7212135791778564,0.19440461695194244
GLO_2020.csv,GLO,2020,"On January 4, 2018, Globe received a copy of the SC’s Resolution dated November 6, 2017, requiring it to comment on said petition of Bayan Muna.",0.025561930611729622,0.8455629944801331,0.12887506186962128
GLO_2020.csv,GLO,2020,"Subsequently, on February 21, 2018, Globe received a copy of the SC’s Resolution dated December 13, 2017 consolidating the Petitions for Review filed by Bayan Muna and NTC, and requiring Globe to file its comment on the petition for review filed by NTC.",0.03274168074131012,0.8329490423202515,0.13430926203727722
GLO_2020.csv,GLO,2020,"Thus, on April 2, 2018, Globe filed its Consolidated Comment on both Bayan Muna and the NTC’s petitions for review.",0.052654772996902466,0.7856088280677795,0.16173633933067322
GLO_2020.csv,GLO,2020,"On September 18, 2018, Globe received a copy of Bayan Muna’s Consolidated Reply to Globe’s Consolidated Comment and Digitel and Smart’s Comment.",0.037419676780700684,0.9407073259353638,0.02187298610806465
GLO_2020.csv,GLO,2020,"Globe Telecom believes that it did not violate NTC MC No. 02-10-2011 when it did not reduce its SMS retail rate from Php 1.00 to Php 0.80 per text, and hence, would not be obligated to refund its subscribers.",0.13710428774356842,0.45377734303474426,0.40911832451820374
