filename,ticker,year,sentence,positive,neutral,negative
GTCAP_2021.csv,GTCAP,2021,New business from life insurance expressed in Annualized Premium Equivalent increased by 18.5% from Php5.2 billion in 2020 to Php6.2 billion in 2021.,0.9571319818496704,0.024054596200585365,0.01881343685090542
GTCAP_2021.csv,GTCAP,2021,"This was driven by the strong growth in both Single Premium and Regular Premium, increasing by 50.2% and 6.9%, respectively.",0.9544417858123779,0.030424652621150017,0.015133554115891457
GTCAP_2021.csv,GTCAP,2021,"As a result, premium revenue reached Php39.3 billion in 2021, 24.5% higher than the previous year.",0.9551053047180176,0.025163616985082626,0.019731009379029274
GTCAP_2021.csv,GTCAP,2021,The reported premium revenue mix of life insurance shifted to 54%/46% (Single Premium vs. Regular Premium) in 2021 from 45%/55% in 2020.,0.5843653678894043,0.051618579775094986,0.3640160858631134
GTCAP_2021.csv,GTCAP,2021,"By distribution platform, bancassurance, sales agency and other channels accounted for 61%, 36% and 3% of premium revenues, respectively.",0.02876823954284191,0.9509717226028442,0.02026001177728176
GTCAP_2021.csv,GTCAP,2021,Gross written premiums of the non-life insurance declined from Php3.9 billion in 2020 to Php3.4 billion in 2021 as the resumption of quarantine restrictions continue to impact mobility and consumer spending.,0.006926503032445908,0.01903577148914337,0.974037766456604
GTCAP_2021.csv,GTCAP,2021,"Consolidated net income stood at Php2.3 billion in 2021, 22.4% lower than the previous year resulting from higher death claims from the life business and lower earned premiums and higher attritional and NatCat losses from the general insurance business.",0.010262259282171726,0.01496634166687727,0.9747714400291443
GTCAP_2021.csv,GTCAP,2021,"MPIC reported share in the consolidated operating core income at Php17.1 billion in 2021, an 11% increase from the same period last year, driven by the following: ● Higher volume sold for power; Core net income contribution of Manila Electric Company (Meralco) to MPIC was Php11.2 billion; ● Improved traffic on toll roads and the shift in tax regime to Optional Standard Deduction; Core net income contribution of Metro Pacific Tollways Corporation (MPTC) to MPIC was Php3.9 billion; ● Partially offset by the drop in billed water volumes and limited light rail services; Core net income contribution of Maynilad Water Services (Maynilad) and core net loss contribution of Light Rail Manila Corporation (LRMC) to MPIC was Php2.8 billion and Php0.3 billion, respectively.",0.9451454281806946,0.025319676846265793,0.02953493595123291
GTCAP_2021.csv,GTCAP,2021,Reported net income attributable to equity holders rose by 113% from Php4.7 billion in 2020 to Php10.1 billion in 2021 due to the gain on sale of Global Business Power Corporation (Php4.6 billion) and Don Muang Tollways (Php1.1 billion).,0.9563747644424438,0.022435007616877556,0.02119029127061367
GTCAP_2021.csv,GTCAP,2021,"Excluding non-recurring income or expenses, MPIC reported a core net income of Php12.3 billion in 2021, 20% higher than the same period last year.",0.9519329071044922,0.027044307440519333,0.021022774279117584
GTCAP_2021.csv,GTCAP,2021,"Except for (ii), (iv),(vi) and (vii), the Company does not know of: (i)",0.0219290629029274,0.950593113899231,0.027477841824293137
GTCAP_2021.csv,GTCAP,2021,"Any known trends or any known demands, commitments, events, uncertainties that will result or that are reasonably likely to result in the Company’s liquidity increasing or decreasing in any material way; (ii) Any events that would trigger direct or contingent financial obligation (including contingent obligation) that is material to the Company, including any default or acceleration of an obligation except those disclosed in the notes to the financial statements; (iii) Any material off balance sheet transactions, arrangements, obligations (including contingent obligations) and other relationships of the Company with unconsolidated entities or other persons created during the reporting period; (iv) Any material commitments for capital expenditures, their purpose and sources of funds for such expenditures except as discussed below.",0.03600388020277023,0.7333061099052429,0.23069004714488983
GTCAP_2021.csv,GTCAP,2021,"(v) Any known trends, events or uncertainties that have had or are reasonably expected to have a material favorable or unfavorable impact on net sales or revenues or income from continuing operations; (vi) Any significant elements of income or loss that did not arise from the Company’s continuing operations except those disclosed in the audited financial statements; (vii)",0.2957186698913574,0.5713804364204407,0.1329009234905243
GTCAP_2021.csv,GTCAP,2021,"The causes of any material change from period to period including vertical and horizontal analysis of any material item, the causes of material changes are discussed in the MD & A; and (viii)",0.019428595900535583,0.930202305316925,0.05036914721131325
GTCAP_2021.csv,GTCAP,2021,"In 2019, 2020 and 2021, GT Capital’s principal source of liquidity came from cash dividends received from the investee companies, availment of loans, issuance of bonds and issuance of preferred shares of stock.",0.07796727120876312,0.9105979800224304,0.011434714309871197
GTCAP_2021.csv,GTCAP,2021,"As of December 31, 2021, GT Capital’s cash and cash equivalents reached Php17.40 billion.",0.04660128429532051,0.9334573745727539,0.019941331818699837
GTCAP_2021.csv,GTCAP,2021,"Net cash used in operating activities amounted to Php4.18 billion and Php11.15 billion in 2019 and 2020, respectively, while the net cash provided by operating activities in 2021 amounted to Php10.23 billion.",0.10709413141012192,0.8663715720176697,0.026534268632531166
GTCAP_2021.csv,GTCAP,2021,"In 2019, operating cash amounting to Php18.43 billion was used to increase financial assets at FVTPL by Php1.38 billion, receivables by Php6.32 billion and inventories by Php6.78 billion and to pay dividends, income taxes and interest amounting to Php4.91 billion, Php4.61 billion and Php6.13 billion, respectively.",0.8066608309745789,0.183367058634758,0.009972099214792252
GTCAP_2021.csv,GTCAP,2021,"In 2020, operating cash amounting to Php10.73 billion was used to increase inventories by Php3.41 billion, prepayments and other current assets by Php1.96 billion and pay dividends, income taxes and interest amounting to Php6.49 billion, Php2.21 billion and Php6.33 billion, respectively.",0.8694012761116028,0.11909902095794678,0.01149961818009615
GTCAP_2021.csv,GTCAP,2021,"In 2021, cash generated from operations, dividend, and interest received amounting to Php11.77 billion, Php8.21 billion, and Php1.65 billion, respectively, were used to pay interest, dividends and income taxes amounting to Php6.00 billion, Php2.99 billion, and Php2.32 billion, respectively.",0.0479302704334259,0.9239909648895264,0.028078755363821983
GTCAP_2021.csv,GTCAP,2021,"Net cash used in investing activities amounted to Php3.48 billion, Php4.04 billion and Php6.62 billion in 2019, 2020 and 2021, respectively.",0.1018463671207428,0.8771659135818481,0.020987648516893387
GTCAP_2021.csv,GTCAP,2021,"In 2019, cash flows used in investing activities went to pay for additional investment in associates and a joint venture by Php1.04 billion, property and equipment by Php1.82 billion, and investment properties by Php1.10 billion.",0.1838146597146988,0.8051910400390625,0.010994304902851582
GTCAP_2021.csv,GTCAP,2021,"In 2020, cash flows used in investing activities went to increase investment in associates and a joint venture by Php2.10 billion and property and equipment by Php0.87 billion.",0.8073872327804565,0.1847827434539795,0.00783001072704792
GTCAP_2021.csv,GTCAP,2021,"In 2021, cash flows used in investing activities went to the acquisition of additional property and equipment by Php5.16 billion and increase investments in joint ventures by Php 1.01 billion.",0.4852128326892853,0.5041547417640686,0.010632415302097797
GTCAP_2021.csv,GTCAP,2021,"Net cash provided by financing activities amounted to Php5.31 billion and Php20.02 billion in 2019 and 2020, respectively, while the net cash used in financing activities in 2021 amounted to Php3.24 billion.",0.11456391215324402,0.8628138899803162,0.02262224815785885
GTCAP_2021.csv,GTCAP,2021,"In 2019, cash flows from financing activities came from loan availments of Php43.98 billion which were used to partially settle Php36.15 billion in outstanding loans and Php2.99 billion bonds payable.",0.15747013688087463,0.8236167430877686,0.018913136795163155
GTCAP_2021.csv,GTCAP,2021,"In 2020, cash flows from financing activities came from Php67.80 billion in new loans which were used to partially settle Php44.43 billion in outstanding loans and Php3.90 billion bonds payable.",0.27119049429893494,0.7114061713218689,0.017403284087777138
GTCAP_2021.csv,GTCAP,2021,"In 2021, the cash flows from financing activities that came from the proceeds from loan availments amounting to Php57.65 billion were used to refinance other loans amounting to Php54.38 billion, and settle bonds payable amounting to Php5.00 billion and partially settle liabilities on purchased properties amounting to Php1.29 billion.",0.07593124359846115,0.9074589610099792,0.01660982146859169
