filename,ticker,year,sentence,positive,neutral,negative
JGS_2018.csv,JGS,2018,Interest expense increased by 84.5% to P=311.61 million in 2018 from P=109.51 million in 2017 due to the P=18.60 billion net increase in trust receipts.,0.9544963240623474,0.02165292762219906,0.023850729689002037
JGS_2018.csv,JGS,2018,A net foreign exchange gain of P=16.88 million was also recognized in 2018 from last year’s gain of P=61.90 million.,0.9507379531860352,0.02836182713508606,0.02090020850300789
JGS_2018.csv,JGS,2018,All these factors contributed to the net income of P=1.05 billion in 2018 from P=5.99 billion in 2017.,0.9410517811775208,0.024160275235772133,0.03478794917464256
JGS_2018.csv,JGS,2018,"Banking Services, generated banking revenue of P=6.13 billion in 2018, a 37.0% increase from last year’s P=4.48 billion brought about by higher interest income from finance receivables.",0.9560539126396179,0.024350525811314583,0.01959565468132496
JGS_2018.csv,JGS,2018,"Costs and expenses also increased by 37.5% as the bank continued its expansion, including higher interest expense on deposits from P=1.13 billion in 2017 to P=2.19 billion in 2018.",0.959628164768219,0.021121572703123093,0.019250143319368362
JGS_2018.csv,JGS,2018,"As a result, net income for the year ended December 31, 2018 amounted to P=317.68 million, a 3.4% increase from last year’s P=307.21 million.",0.9502781629562378,0.026951853185892105,0.022770017385482788
JGS_2018.csv,JGS,2018,"Equity in net earnings of associate companies and joint ventures amounted to P=10.18 billion for the year ended December 31, 2018, a 2.8% increase from last year’s P=9.91 billion mainly attributable to the 17.6% increase in equity earnings from Meralco from P=5.60 billion last year to P=6.59 billion this year as a result of higher sales volume and the additional 2.4% equity share acquired in June 2017, partially offset by the decline in equity in net earnings from United Industrial Corporation, Limited (UIC).",0.9411147236824036,0.020114727318286896,0.03877055644989014
JGS_2018.csv,JGS,2018,UICL recorded an 18.1% decline in its net income from operations from S$305.98 million in 2017 to S$250.62 million in 2018 due to lower sales of trading properties as UIC’s development projects were completed and substantially sold in 2017.,0.009180746041238308,0.015766186639666557,0.975053071975708
JGS_2018.csv,JGS,2018,"Since the Group’s policy for the valuation of property, plant and equipment is the cost basis method, the equity income taken up by the Group represents the adjusted amounts after reversal of the effect in the income statement of the revaluation of the said assets.",0.026629328727722168,0.9496206641197205,0.023749977350234985
JGS_2018.csv,JGS,2018,"Cash and cash equivalents decreased to P=49.19 billion as of December 31, 2018, from P=54.34 billion as of December 31, 2017.",0.008267821744084358,0.01902489736676216,0.9727072715759277
JGS_2018.csv,JGS,2018,Cash provided by operating activities amounted to P=56.64 billion.,0.051423728466033936,0.9322310090065002,0.01634528674185276
JGS_2018.csv,JGS,2018,"As of December 31, 2018, net cash used in investing activities amounted to P=86.03 billion mainly for the Group’s capital expenditure program.",0.032632116228342056,0.9485678672790527,0.01879999414086342
JGS_2018.csv,JGS,2018,"The Group’s net cash provided by financing activities amounted to P=24.25 billion mainly due to the Group’s additional loan availments during the year, and the net proceeds from stock rights offering of RLC.",0.28832024335861206,0.7018183469772339,0.009861393831670284
JGS_2018.csv,JGS,2018,"Our financial assets, including those held at fair value through profit and loss (FVTPL) (excluding derivative assets), fair value though other comprehensive income (FVOCI), and investment securities at amortized cost amounted to P=59.62 billion, a 2.2% decrease from P=60.95 billion as of December 31, 2017 due to lower market valuation during the year.",0.043097492307424545,0.011018583551049232,0.9458838701248169
JGS_2018.csv,JGS,2018,"Receivables, including noncurrent portion increased by 3.6% from P=90.26 billion as of December 31, 2017 to P=93.53 billion as of December 31, 2018 mainly due to the significant increase in finance receivables of the banking business.",0.9544457197189331,0.02892443723976612,0.016629928722977638
JGS_2018.csv,JGS,2018,"Inventories increased 15.9% from P=54.76 billion as of December 31, 2017 to P=63.47 billion as of December 31, 2018 due to higher level of finished goods of the food and petrochemicals businesses, as well as increase in subdivision land, condominium and residential units for sale of the real estate business.",0.9534938335418701,0.028054770082235336,0.018451420590281487
JGS_2018.csv,JGS,2018,"Biological assets, including noncurrent portion, decreased by 34.0% due to decline in headcount and market prices of hogs.",0.016085583716630936,0.01647699438035488,0.9674375057220459
JGS_2018.csv,JGS,2018,"Other current assets increased from P=12.85 billion as of December 31, 2017 to P=29.65 billion as of December 31, 2018 mainly coming from RLC’s recognition of contract assets in accordance with PFRS 15 as well as deposits received from buyers of Cheng Du Xin Yao.",0.9440082311630249,0.04140831530094147,0.01458344329148531
JGS_2018.csv,JGS,2018,"Investment properties increased 7.8% from P=87.02 billion as of December 31, 2017 to P=93.82 billion as of December 31, 2018 primarily due to acquisition of several land properties both for residential and commercial development, and ongoing constructions of the real estate business during the year.",0.9481256604194641,0.0352150984108448,0.016659319400787354
JGS_2018.csv,JGS,2018,"Property, plant and equipment increased 20.2% from P=181.66 billion as of December 31, 2017 to P=218.27 billion due to the acquisition of four ATR 72-600 and seven Airbus A321 CEO aircraft, offset by the sale of one Airbus A319 of the airline business, as well as expansion projects of the petrochemicals business.",0.949478805065155,0.035059258341789246,0.015462027862668037
JGS_2018.csv,JGS,2018,"Other noncurrent assets went up by 81.7% from P=10.87 billion as of December 31, 2017 to P=19.74 billion as of December 31, 2018 due to the CEB’s prepayments for Airbus A330 life limited engine parts, power by the hour changes and engine overhaul, and increase in RLC's advances to lot owners and advances to suppliers and contractors for ongoing projects Consolidated total assets reached P=819.29 billion as of end of December 2018.",0.9544600248336792,0.02644251473248005,0.0190974622964859
JGS_2018.csv,JGS,2018,"Accounts payable and accrued expenses increased by 16.5% from P=113.88 billion as of December 31, 2017 to P=132.66 billion as of December 31, 2018 due to higher level of trade payables of the airline and food businesses, and deposit liabilities and bills payable of the banking business.",0.9575406908988953,0.020891688764095306,0.021567652001976967
JGS_2018.csv,JGS,2018,"Short term debt decreased 22.7% to P=34.45 billion as of December 31, 2018 from P=45.88 billion as of December 31, 2017 due to full settlement of short-term loans of the Parent Company and RLC.",0.01930861547589302,0.014856962487101555,0.9658344388008118
JGS_2018.csv,JGS,2018,"Derivative liabilities, including noncurrent portion, which amounted to P=763.32 million as of December 31, 2018 pertain mainly to CEB’s fuel derivative contracts.",0.015659227967262268,0.9029678106307983,0.08137296140193939
JGS_2018.csv,JGS,2018,"Other current liabilities increased 104.4% to P=27.98 billion as of December 31, 2018 due to the current portion of RLC’s contract liabilities to real estate customers, and CEB’s higher unearned transportation revenue on sale of passenger travel services.",0.9513379335403442,0.028243515640497208,0.020418494939804077
JGS_2018.csv,JGS,2018,"Long-term debt, including current portion, increased 15.7% from P=181.69 billion as of December 31, 2017 to P=210.25 billion as of December 31, 2018 due to additional term loans availed by the Parent Company and CEB during the period.",0.9535729289054871,0.02693117968738079,0.019495874643325806
JGS_2018.csv,JGS,2018,"Deferred tax liabilities amounted to P=7.88 billion as of December 31, 2018, a 9.3% increase from P=7.21 billion as of December 31, 2017 due to higher deferred tax liabilities of RLC.",0.9498267769813538,0.02458394132554531,0.02558917924761772
JGS_2018.csv,JGS,2018,"Other noncurrent liabilities increased to P=35.05 billion as of December 31, 2018 from P=28.91 billion as of December 31, 2017 due to CEB’s higher provision for asset retirement obligation, RLC’s noncurrent contract liabilities to real estate customers, and RBC’s higher deposit liabilities.",0.942463755607605,0.01832607202231884,0.039210185408592224
JGS_2018.csv,JGS,2018,"Stockholders’ equity, excluding minority interest, stood at P=276.59 billion as of December 31, 2018 from P=267.84 billion last year.",0.7800042033195496,0.06316591054201126,0.15682995319366455
JGS_2018.csv,JGS,2018,"Book value per share amounted to P=38.61 as of December 31, 2018 from P=37.13 (as restated) as of December 31, 2017.",0.8655495643615723,0.060519590973854065,0.07393083721399307
