filename,ticker,year,sentence,positive,neutral,negative
LTG_2017.csv,LTG,2017,"LT Group, Inc. (LTG) reported a consolidated net income of P=14.6 billion for the year ended December 31, 2017, 20.6% higher than the P=12.1 billion reported in the same period last year.",0.9510483741760254,0.029746823012828827,0.019204825162887573
LTG_2017.csv,LTG,2017,"The consolidated net income attributable to equity holders of LTG was P=10.8 billion for 2017, 15.3% more than the P=9.4 billion in 2016.",0.16609779000282288,0.7963685393333435,0.037533607333898544
LTG_2017.csv,LTG,2017,"The banking segment’s net income was higher by 15.9% from P=7.4 billion for the year ended December 31, 2016 to P=8.6 billion in 2017.",0.956550657749176,0.021955860778689384,0.02149345725774765
LTG_2017.csv,LTG,2017,LTG’s share in the net income of the banking segment improved from P=4.1 billion in 2016 to P=4.8 billion in 2017.,0.9598891735076904,0.021419456228613853,0.018691323697566986
LTG_2017.csv,LTG,2017,"In 2016, LTG’s share in net income of the banking segment included a P=724 million elimination on the gain from sale of land by PNB to Eton.",0.12525108456611633,0.8641237020492554,0.010625213384628296
LTG_2017.csv,LTG,2017,"Including this elimination, the bank’s net contribution to LTG in 2016 was P=3.4 billion, and 2017’s P=4.68 billion, 41.3% higher year-on-year.",0.7108577489852905,0.2636573612689972,0.025484776124358177
LTG_2017.csv,LTG,2017,The tobacco segment’s net income increased by P=1.8 billion from P=2.6 billion in 2016 to P=4.4 billion in 2017.,0.9528152346611023,0.027744663879275322,0.01944008842110634
LTG_2017.csv,LTG,2017,"Distilled spirits segment net income was P=631 million, a decrease of 30.5% versus the 2016 income recorded in 2016.",0.01224708091467619,0.015039282850921154,0.9727135896682739
LTG_2017.csv,LTG,2017,"The beverage and property development segments’ net income were P=552 million and P=348 million in 2017 were lower by 68.6% and 10.3%, respectively, compared to the incomes in the same period last year .",0.008954538032412529,0.018265508115291595,0.9727799296379089
LTG_2017.csv,LTG,2017,Equity in net earnings from our stake in VMC contributed P=174 million for 2017.,0.0733828991651535,0.9151366353034973,0.011480508372187614
LTG_2017.csv,LTG,2017,"As of December 31, 2017, LTG’s stake in VMC stood at 30.9%.",0.028586452826857567,0.949055552482605,0.02235805243253708
LTG_2017.csv,LTG,2017,"Consolidated revenues amounted to P=63.8 billion for the year ended December 31, 2017, 10.4% better than the P=57.8 billion recognized in 2016 on account of the higher revenues in the banking, distilled spirits and beverage segments.",0.9499697089195251,0.018369507044553757,0.031660810112953186
LTG_2017.csv,LTG,2017,"Cost of sales and services increased by 13.6% from P=26.1 billion in 2016 to P=29.7 billion in the current year, primarily attributable to higher interest expense on deposit liabilities and increased cost of sales of the distilled spirits and beverage segments mainly due to higher excise taxes and raw material costs.",0.9437294006347656,0.01606624200940132,0.040204405784606934
LTG_2017.csv,LTG,2017,The property development segment reported a 39.8% decline in cost of sales as a result of lower booked sales from real estate development projects.,0.13763542473316193,0.02191266603767872,0.8404519557952881
LTG_2017.csv,LTG,2017,Operating expenses amounted to P=28.3 billion in 2017 from P=27.9 billion in 2016 or an increase of 1.5%.,0.9407109022140503,0.02098395675420761,0.03830515220761299
LTG_2017.csv,LTG,2017,"This was as a result of higher selling expenses, which amounted to P=2.4 billion in 2016 as against P=2.7 billion in 2017.",0.4611503481864929,0.09257079660892487,0.4462788701057434
LTG_2017.csv,LTG,2017,Other income increased by 30.4% primarily due to higher gain on sale of assets.,0.9591400027275085,0.02211037091910839,0.01874953880906105
LTG_2017.csv,LTG,2017,"Interest income and net foreign exchange gains were higher by 47.6% and 10.8%, respectively.",0.9569814801216125,0.01860550232231617,0.024413034319877625
LTG_2017.csv,LTG,2017,Interest expense was lower by 29.9% due to loan settlements.,0.45398446917533875,0.04464803636074066,0.5013675093650818
LTG_2017.csv,LTG,2017,"The banking segment’s net income was P=8.6 billion for the year ended December 31, 2017, higher by 15.9% compared to the P=7.4 billion recorded for the same period in 2016.",0.9589042067527771,0.018382931128144264,0.02271290495991707
LTG_2017.csv,LTG,2017,"Interest income from banking operations was at P=27.6 billion in 2017, 13.4% higher than the P=24.4 billion realized last year, mainly on account of higher interest income from loans and receivables, deposits with banks and others and interbank loans receivable.",0.9407039284706116,0.04383397102355957,0.015462015755474567
LTG_2017.csv,LTG,2017,"Interest expense was at P=5.6 billion for 2017, an increase of 15.5% from the P=4.8 billion recorded in same period of 2016 resulting to a net interest income of P=22.1 billion, 12.9% higher year-on-year.",0.9555285573005676,0.024410570040345192,0.020060904324054718
LTG_2017.csv,LTG,2017,"Net service fees and commission income exceeded the previous period’s P=2.7 billion to P=3.2 billion in the current period, attributable to higher deposit and trade related fees, arranger’s fees, bancassurance and other bank commission, underwriting and securities dealership transactions, as well as loan related and other fee income.",0.9379057288169861,0.02269786037504673,0.0393965020775795
LTG_2017.csv,LTG,2017,"Miscellaneous income declined by 7.2% to P=8.6 billion, due to lower mark-to market gains on trading and investment securities.",0.008338597603142262,0.01607084646821022,0.9755905866622925
LTG_2017.csv,LTG,2017,"The beverage segment’s net income was P=552 million for the year ended December 31, 2017, 68.5% lower than the P=1.76 billion in the same period last year.",0.007413018960505724,0.020780067890882492,0.9718068838119507
LTG_2017.csv,LTG,2017,Revenues of the beverage segment were higher by 17.2% to P=13.9 billion in 2017 from P=11.9 billion in 2016.,0.9549741148948669,0.01940751262009144,0.025618363171815872
LTG_2017.csv,LTG,2017,"However, gross profit margin dipped from 34% in 2016 to 31% in 2017, on account of the increase in cost of sales by 22.7% due to higher depreciation, labor costs, fuel and utilities expenses.",0.009908861480653286,0.015179111622273922,0.9749119877815247
LTG_2017.csv,LTG,2017,"Likewise, operating expenses increased by 8.8% to P=2.4 billion in 2017 from P=2.2 billion in 2016 on account of higher advertising and promotional expenses, salaries and wages, taxes and licenses and miscellaneous expenses.",0.9377273917198181,0.015337693504989147,0.046934932470321655
LTG_2017.csv,LTG,2017,"The distilled spirits segment posted a net income of P=631 million for the year ended December 31, 2017, 30.5% lower than the P=908 million reported in the same period last year due to lower bio-ethanol sale.",0.009194432757794857,0.01829284429550171,0.9725127220153809
LTG_2017.csv,LTG,2017,Net revenues were higher by 11.9% to P=16.8 billion in 2017 compared to 2016’s P=15.0 billion due to higher volumes of liquor especially the flagship product Tanduay Five Years.,0.9529348015785217,0.014961031265556812,0.03210407868027687
LTG_2017.csv,LTG,2017,"Cost of sales increased by 14.5% to P=14.1 billion in the current period as against P=12.3 billion in the same period last year primarily due to higher distilled spirits volumes, alcohol costs and increase in excise taxes.",0.9581846594810486,0.018284432590007782,0.023530853912234306
LTG_2017.csv,LTG,2017,"Consequently, gross profit margin was at 16.2% in 2017, lower than the 18.1% in 2016.",0.009270007722079754,0.019835125654935837,0.9708948135375977
LTG_2017.csv,LTG,2017,"Operating expenses was at P=1.9 billion in 2017, 22.7% higher than the P=1.6 billion in 2016 on account of higher advertising, freight and handling, management and professional fees and other selling expenses.",0.14798204600811005,0.029732253402471542,0.8222856521606445
LTG_2017.csv,LTG,2017,"The property development segment reported a net income of P=348 million for the year 2017, slightly lower than the P=390 million for the same period last year.",0.009035486727952957,0.019960016012191772,0.9710044264793396
LTG_2017.csv,LTG,2017,Residential property sales were lower by 45.6% to P=845 million for 2017.,0.0087056253105402,0.018945863470435143,0.9723485112190247
LTG_2017.csv,LTG,2017,"Rental revenues in 2017 accounted for P=1.4 billion or 62.2% of revenues, representing a 8.6% growth over the same period in 2016, as the lease contracts were renewed at higher rates for the BPO offices.",0.9526643753051758,0.023886753246188164,0.023448903113603592
LTG_2017.csv,LTG,2017,"Operating expenses were higher by 7.3% from P=682 million in 2016 to P=732 million in 2017, mainly on account of higher repairs and maintenance expense, depreciation and outside services fees.",0.9132097959518433,0.01522814854979515,0.07156211137771606
LTG_2017.csv,LTG,2017,"The tobacco segment’s net income was P=4.4 billion for the year 2017, 70.3% higher than the P=2.6 billion of the same period last year on account of the increase in equity in net earnings from PMFTC from P=2.6 billion last year to P=4.4 billion in 2017.",0.9536254405975342,0.026945609599351883,0.01942901872098446
LTG_2017.csv,LTG,2017,Gross profit ratio in 2017 was 53.5% versus 54.8% in 2016.,0.07602227479219437,0.07441584020853043,0.849561870098114
LTG_2017.csv,LTG,2017,Consolidated Net Income Attributable to Equity Holders of the Parent Company for 2017 amounted to P=10.8 billion; higher by 15.3% from last year’s P=9.4 billion.,0.9560064077377319,0.02235318161547184,0.021640479564666748
LTG_2017.csv,LTG,2017,Ratio of net income to equity is 7.3% in 2017 and 6.9% in 2016.,0.05196639895439148,0.8685372471809387,0.07949639856815338
LTG_2017.csv,LTG,2017,Current Ratio for 2017 is 0.63:1 while last year’s was 0.70:1.,0.04250040277838707,0.7714719772338867,0.1860276609659195
LTG_2017.csv,LTG,2017,Debt-to-equity ratio for 2017 is 3.70:1 as compared to last year’s 3.64:1.,0.4986269772052765,0.05048743635416031,0.45088550448417664
LTG_2017.csv,LTG,2017,Earnings per share attributable to holders of the parent company for 2017 is P=1.00 and P=0.87 in 2016.,0.04092549905180931,0.9158248901367188,0.04324961453676224
LTG_2017.csv,LTG,2017,"(i) There are no other trends or any known demands, commitments, events or uncertainties that will result in or that are reasonably likely to result in the Group’s increasing or decreasing liquidity in any material way.",0.08325875550508499,0.7129024863243103,0.20383881032466888
LTG_2017.csv,LTG,2017,"The Group is not in default or breach of any note, loan, lease or other indebtedness or financing arrangement requiring it to make payments.",0.028219373896718025,0.8797141313552856,0.09206650406122208
LTG_2017.csv,LTG,2017,"(ii) There are no events that will trigger direct or contingent financial obligation that is material to LTG, including any default or acceleration of an obligation.",0.022210674360394478,0.9378957152366638,0.039893556386232376
LTG_2017.csv,LTG,2017,"(iii) There are no known material off-balance sheet transactions, arrangements, obligations (including contingent obligations), and other relationships of LTG with unconsolidated entities or other persons created during the reporting period.",0.01735743321478367,0.9166080355644226,0.06603455543518066
LTG_2017.csv,LTG,2017,"(iv) The Group has on-going and planned capital expenditure projects as follows:   TDI will be implementing, SAP S4/HANA, a new Enterprise-wide Resource Planning (ERP) system, that will cover financial accounting and controlling, warehouse management, procurement, sales and distribution, materials management and production planning.",0.5411418676376343,0.4503554403781891,0.00850269477814436
LTG_2017.csv,LTG,2017,The new system is to be implemented company-wide.,0.19676987826824188,0.7963706254959106,0.006859518121927977
LTG_2017.csv,LTG,2017,The project aims to save on liquid fertilization costs .,0.6194671988487244,0.3690451979637146,0.01148757804185152
LTG_2017.csv,LTG,2017,"In 2017, ABI undertook several major capital expenditure for its glass manufacturing business as well as for the production of bottled water and sweetened beverages.",0.7089157104492188,0.28308457136154175,0.007999719120562077
LTG_2017.csv,LTG,2017,"These expenditures are intended to capitalize on the growing markets such as in the bottled water business, and to improve efficiencies in ABI’s production processes.",0.9313270449638367,0.05768013000488281,0.010992850176990032
LTG_2017.csv,LTG,2017,ABI’s bottled water plant in Cabuyao has been a member of the International Bottled Water Association (IBWA) since it started its bottled water business in 1992.,0.13749399781227112,0.8544735908508301,0.008032450452446938
LTG_2017.csv,LTG,2017,IBWA in reference to U.S. FDA regulations of the Code of Federal Regulations prescribes the Good Manufacturing Practices for Processing and Bottling of Bottled Drinking Water.,0.08501499146223068,0.9010842442512512,0.013900687918066978
LTG_2017.csv,LTG,2017,"This includes specific design and performance requirements for determining whether the facilities, methods, practices, and controls used in the processing, bottling, holding and shipping of bottled drinking water are in conformance with or are operated or administered in conformity with good manufacturing practice to assure that bottled drinking water is safe and has been processed, bottled, held and transported under sanitary conditions.",0.050278548151254654,0.9295932650566101,0.020128158852458
LTG_2017.csv,LTG,2017,"ISO is a standard setting body that provides requirements, specifications, guidelines or characteristics that ensure that products and services are safe, reliable and are of good quality.",0.055611077696084976,0.9290063977241516,0.015382570214569569
LTG_2017.csv,LTG,2017,"To be ISO 9001:2015 certified, an organization must demonstrate its ability to consistently provide product that meets customer and applicable statutory and regulatory requirements.",0.8055192828178406,0.18623164296150208,0.008249047212302685
LTG_2017.csv,LTG,2017,ABI’s manufacturing facilities are ISO 9001:2015 certified.,0.1406669020652771,0.8507079482078552,0.008625197224318981
LTG_2017.csv,LTG,2017,"Waterich and IPI Cabuyao manufacturing facilities are due for the ISO 9001:2015 audit on the first quarter of 2017, but remain to be ISO 9001:2008 certified.",0.05255398526787758,0.9041619896888733,0.04328399524092674
LTG_2017.csv,LTG,2017,ISO 9001:2015 is an update on the ISO 9001:2008 quality management system.,0.041847482323646545,0.9396601915359497,0.018492236733436584
LTG_2017.csv,LTG,2017,"The company has no known trends, events or uncertainties that have had or that are reasonably expected to have a material favorable or unfavorable impact on net sales, revenue or income from continuing operations.",0.06309276819229126,0.8351776599884033,0.10172957181930542
LTG_2017.csv,LTG,2017,There are no significant elements of income or loss that did not arise from the Company’s continuing operations.,0.023378951475024223,0.8799851536750793,0.09663589298725128
LTG_2017.csv,LTG,2017,The causes for any material change from period to period which shall include vertical and horizontal analyses of any material item;,0.02078489400446415,0.9314339756965637,0.047781169414520264
