filename,ticker,year,sentence,positive,neutral,negative
MBT_2020.csv,MBT,2020,"As of December 31, 2020, the Metrobank Group posted a total assets of P2.46 trillion or higher by P4.35 billion compared with P2.45 trillion as of December 31, 2019.",0.6696694493293762,0.06078047677874565,0.269550085067749
MBT_2020.csv,MBT,2020,Total liabilities of the Group decreased to P2.12 trillion from P2.13 trillion or by P10.33 billion.,0.010853012092411518,0.021020550280809402,0.9681264162063599
MBT_2020.csv,MBT,2020,"On the other hand, equity attributable to equity holders of the Parent Company was higher by P14.65 billion from P309.55 billion to P324.20 billion.",0.9545462727546692,0.023702669888734818,0.02175108902156353
MBT_2020.csv,MBT,2020,Cash and Other Cash Items increased by P5.51 billion or 16.73%.,0.9530014991760254,0.026671523228287697,0.020326925441622734
MBT_2020.csv,MBT,2020,Due from BSP which represents 12.42% of the Group’s total assets increased by 38.60% due to the net effect of the increase in overnight deposit facility placement and term deposit with the BSP and lower reserve requirement.,0.9579620361328125,0.021727479994297028,0.02031046710908413
MBT_2020.csv,MBT,2020,Due from Other Banks decreased by P16.53 billion or 30.19% as a result of the net movements in the balances maintained with various local and foreign banks.,0.019824309274554253,0.02002822607755661,0.960147500038147
MBT_2020.csv,MBT,2020,"Interbank Loans Receivable and SPURA went up by P7.22 billion or 10.0% due to the P20.25 billion increase in interbank loans receivable reduced by the P13.03 billion decrease in securities under resale agreement with the BSP. Total investment securities which consisted of FVTPL, FVOCI and securities at amortized cost and represents 27.30% and 21.05% of the Group’s total assets as of December 31, 2020 and 2019, respectively, went up by P154.27 billion or 29.90%.",0.955585777759552,0.025067608803510666,0.019346604123711586
MBT_2020.csv,MBT,2020,"FVTPL securities consist of HFT securities and derivative assets amounting to P65.71 billion and P11.85 billion, respectively, as of December 31, 2020 and P53.38 billion and P8.49 billion, respectively, as of December 31, 2019.",0.02264363318681717,0.9476694464683533,0.029686862602829933
MBT_2020.csv,MBT,2020,"The P366.93 billion increase in FVOCI securities was mainly due to the net effect of the increases in investments in treasury notes and bonds (P230.56 billion), treasury bills (P81.50 billion) and BSP bonds (P30.05 billion).",0.40164390206336975,0.5854302644729614,0.012925836257636547
MBT_2020.csv,MBT,2020,"In 2020, the Group disposed of investment securities at amortized cost as discussed in Note 8 of the audited financial statements of the Group as presented in Exhibit B. Net loans and receivables, representing 51.03% and 60.53% of the Group’s total assets as of December 31, 2020 and 2019, respectively, went down by P230.64 billion or 15.55% due to lower portfolios of corporate, commercial and consumer loans.",0.006893552839756012,0.01908913627266884,0.9740172624588013
MBT_2020.csv,MBT,2020,Investments in Associates and a Joint Venture went down by P0.34 billion or 5.20% due to lower net income and other comprehensive income of the associates and a joint venture.,0.007087696809321642,0.016800489276647568,0.9761117696762085
MBT_2020.csv,MBT,2020,Deferred Tax Assets increased by P3.52 billion or 33.45% due to movements on temporary tax differences.,0.9545672535896301,0.020819859579205513,0.02461289055645466
MBT_2020.csv,MBT,2020,Other Assets decreased by P2.39 billion or 15.35% from P15.57 billion to P13.18 billion primarily due to the decreases in interoffice float items and creditable withholding tax.,0.020552724599838257,0.013448375277221203,0.9659988880157471
MBT_2020.csv,MBT,2020,"Deposit liabilities represent 84.69% and 80.39% of the consolidated total liabilities as of December 31, 2020 and 2019, respectively, wherein, low cost deposits represent 72.97% and 62.86% of the Group’s total deposits, respectively.",0.02980043552815914,0.9489486217498779,0.02125098928809166
MBT_2020.csv,MBT,2020,"The Group’s deposit level, sourced by the Bank, PSBank and MBCL reached P1.80 trillion as of December 31, 2020, an increase of P83.07 billion or 4.85% from P1.71 trillion as of December 31, 2019.",0.948059618473053,0.027985695749521255,0.023954657837748528
MBT_2020.csv,MBT,2020,"The increment came from demand and savings by P103.51billion and P130.35 billion, respectively, while time deposits went down by P142.79 billion.",0.014022699557244778,0.024108275771141052,0.9618690609931946
MBT_2020.csv,MBT,2020,"Further, the P8.00 billion long-term negotiable certificates of deposits of the Parent Company had matured in April 2020.",0.1225283145904541,0.8676035404205322,0.00986816082149744
MBT_2020.csv,MBT,2020,"Bills Payable and SSURA representing 6.58% and 11.17% of the Group’s total liabilities as of December 31, 2020 and 2019, respectively, went down by P98.67 billion or 41.41% due to the net effect of lower borrowings from foreign banks by P38.43 billion, local banks by P7.81 billion and deposit substitutes by P53.99 billion offset by the P1.57 billion increase in SSURA.",0.0069338795728981495,0.017926452681422234,0.9751396775245667
MBT_2020.csv,MBT,2020,"Derivative Liabilities which represent mark-to-market of foreign currency forwards, interest rate swaps, cross currency swaps, credit default swaps and foreign currency options with negative fair value increased by P6.04 billion or 81.30%.",0.9588732719421387,0.022023364901542664,0.01910342648625374
MBT_2020.csv,MBT,2020,The decrease of P0.78 billion or 11.49% in Manager’s Checks and Demand Drafts Outstanding resulted from normal banking operations of the Bank and PSBank.,0.2517474591732025,0.050960853695869446,0.6972916722297668
MBT_2020.csv,MBT,2020,Income taxes payable decreased by P1.48 billion or 35.27% and Accrued Interest and Other Expenses went down by P1.35 billion or 12.86% due to decrease in accruals of interest expenses.,0.010253063403069973,0.015825284644961357,0.9739215970039368
MBT_2020.csv,MBT,2020,"Bonds payable increased by P10.91 billion or 13.56% on account of the P4.65 billion fixed rate bonds issued by PSBank, the P10.50 billion fixed rate bonds and USD500 million senior unsecured notes net of the maturity of P28.0 billion fixed rate bonds issued by the Parent Company.",0.299096018075943,0.6897994875907898,0.01110453438013792
MBT_2020.csv,MBT,2020,"On August 8, 2020, the Parent Company redeemed its 2025 Notes ahead of its maturity, which caused the decrease in Subordinated Debts.",0.04293717071413994,0.028380269184708595,0.9286826252937317
MBT_2020.csv,MBT,2020,Non-equity Non-controlling Interest representing the portion of net income and net assets of the mutual fund subsidiaries of FMIC not attributed to the Group went up by P1.76 billion or 26.89% due to the net effect of the increase in income and the decrease in ownership of these mutual funds.,0.9537551999092102,0.022877782583236694,0.02336699888110161
MBT_2020.csv,MBT,2020,"Other Liabilities decreased by P3.35 billion or 5.95% primarily due to the decreases in bills purchased contra (P3.10 billion), notes payable (maturity in 2020 of the unsecured notes issued by ORIX Metro amounting to P2.59 billion) and marginal deposits (P0.77 billion) offset by the increases in accounts payable (P2.59 billion) and miscellaneous liabilities (P2.84 billion).",0.03838798776268959,0.021987222135066986,0.9396248459815979
MBT_2020.csv,MBT,2020,Equity attributable to equity holders of the Parent Company increased by P14.65 billion or 4.73% mainly due to the net income reported during the year and improvement in net unrealized gain on investment securities at FVOCI.,0.9576049447059631,0.0230314452201128,0.019363585859537125
MBT_2020.csv,MBT,2020,"For the year ended December 31, 2020, interest income went down by P8.40 billion or 7.23% resulting from lower interest income on loans and receivables by P10.16 billion partially offset by the improvements in interest income on investment securities by P0.54 billion and on interbank loans receivable, deposit with banks and others by P1.22 billion.",0.007356254383921623,0.01646677404642105,0.9761769771575928
MBT_2020.csv,MBT,2020,"Meanwhile, lower interest expense on deposit liabilities by P12.08 billion and on borrowings by P5.43 billion accounted for the decrease of P17.51 billion or 44.67% in interest and finance charges.",0.575958788394928,0.029522115364670753,0.39451906085014343
MBT_2020.csv,MBT,2020,These resulted to a P9.11 billion or 11.83% improvement on net interest income.,0.9560419917106628,0.019180625677108765,0.02477729320526123
MBT_2020.csv,MBT,2020,Other operating income of P35.13 billion increased by P6.08 billion or 20.91% from P29.05 billion in 2019 on account of higher net trading and securities and gain by P1.24 billion and foreign exchange gain by P0.61 billion net of the decreases in fee-based income by P2.56 billion and miscellaneous income by P0.73 billion.,0.955510139465332,0.023042665794491768,0.021447209641337395
MBT_2020.csv,MBT,2020,The disposal of investment securities at amortized cost by the Group in 2020 (as discussed in Note 8 of the audited financial statements of the Group as presented in Exhibit B) resulted to a gain of P8.18 billion.,0.7956221103668213,0.19421210885047913,0.010165874846279621
MBT_2020.csv,MBT,2020,"Total operating expenses increased by P2.21 billion or 3.82% from P57.91 billion to P60.12 billion with higher compensation and fringe benefits by P1.18 billion or 4.99%, occupancy and equipment-related costs by P0.21 billion or 11.41% and miscellaneous expenses by P1.10 billion or 6.66%.",0.9539989233016968,0.018129197880625725,0.02787182293832302
MBT_2020.csv,MBT,2020,"To recognize the impact of the current COVID-19 pandemic, the Group’s provision for credit and impairment losses was increased to P40.76 billion from P10.08 billion in previous year.",0.9499158263206482,0.0275071132928133,0.022577105090022087
MBT_2020.csv,MBT,2020,"Provision for income tax was lower by P3.02 billion from P10.06 billion to P7.05 billion due to net movements in corporate, final and deferred income taxes.",0.06064852699637413,0.03980600833892822,0.8995454907417297
MBT_2020.csv,MBT,2020,Income attributable to non-controlling interests went down to P0.14 billion from P0.82 billion or by P0.68 billion or 82.54% due to lower net income.,0.006946646608412266,0.01860077865421772,0.9744526743888855
MBT_2020.csv,MBT,2020,The audited income attributable to equity holders of the Parent Company for the year 2020 went down by P14.22 billion or 50.70% to P13.83 billion from the P28.06 billion net income reported in 2019.,0.006788149476051331,0.016945751383900642,0.9762661457061768
MBT_2020.csv,MBT,2020,"Total comprehensive income went down by P13.22 billion from P32.54 billion to P19.32 billion for the year ended December 31, 2020 and 2019, respectively, due to the net effect of the decrease in net income, lower net unrealized gain recognized this year on FVOCI investments and the gain recognized in retirement liability.",0.006875269580632448,0.017442280426621437,0.9756824970245361
MBT_2020.csv,MBT,2020,"Total comprehensive income attributable to equity holders of the Parent Company for the year ended December 31, 2020, went down to P19.14 billion or by P12.07 billion from P31.21 billion for the same year in 2019.",0.00654351431876421,0.020830338820815086,0.9726261496543884
MBT_2020.csv,MBT,2020,"Market share price was at P49.05 from P66.30 as of December 31, 2019 with a market capitalization of P220.60 billion as at December 31, 2020.",0.05495721101760864,0.9193811416625977,0.02566162869334221
MBT_2020.csv,MBT,2020,Metrobank continues to reinforce its Core Values program and maintains the principles and standards espoused in its Meaningful Banking campaign as the Bank navigates through a new operating environment under this pandemic to deliver the “You’re in Good Hands” promise to each client.,0.7317681312561035,0.2600017786026001,0.008230028674006462
MBT_2020.csv,MBT,2020,"This commitment underpins the Bank’s continued focus on sustaining market relevance, alongside continuous improvement in customer experience, products and services, operational efficiency and people development.",0.926641047000885,0.06371954828500748,0.009639466181397438
MBT_2020.csv,MBT,2020,"Moreover, the Bank aims to deepen its commitment to instill financial discipline across new and underserved markets, and explore venues outside its current CSR activities by which it can increase its socio-economic impact.",0.8806207180023193,0.11178435385227203,0.007594911381602287
MBT_2020.csv,MBT,2020,"To adapt to an evolving environment, the Bank believes that fulfilling its promises will be dependent on a sustainable culture transformation and change management program, a robust IT infrastructure, as well as sound control and risk management practices.",0.8486766815185547,0.1426369696855545,0.008686354383826256
MBT_2020.csv,MBT,2020,"Thus, the Bank’s investments in people are further backed by investments in IT and information security, process efficiencies, and risk and control systems.",0.7232192158699036,0.26963552832603455,0.007145289797335863
MBT_2020.csv,MBT,2020,The Bank will continue to actively improve on the Group's strong capital position.,0.9489128589630127,0.035909730941057205,0.015177443623542786
MBT_2020.csv,MBT,2020,"In 2006, the Bank issued US$125.0 million Hybrid Tier 1 capital security in February and 173,618,400 common shares at P38.00 per common share in October.",0.057745978236198425,0.9264160990715027,0.015837952494621277
MBT_2020.csv,MBT,2020,"In May 2010, the Bank raised an additional P5.0 billion in capital through a private placement of common shares.",0.5962474346160889,0.39492565393447876,0.008826886303722858
MBT_2020.csv,MBT,2020,"In January 2011, the Bank raised approximately US$220.0 million through a rights offer for 200 million common shares at the offer price of P50.00 per rights share.",0.4924966096878052,0.49779510498046875,0.009708366356790066
MBT_2020.csv,MBT,2020,"In August 2013, the Bank increased its capital stock from P50 billion to P100 billion and on September 16, 2013, it issued a stock dividend equivalent to 633,415,049 common shares (with a par value of P20) that was applied as payment of the required subscription to the increase in capital stock.",0.8099791407585144,0.18163099884986877,0.008389878086745739
MBT_2020.csv,MBT,2020,"In April 2015, the Bank raised P32.0 billion through a rights offer for 435,371,720 common shares with par value of P20.00 priced at P73.50 per share.",0.2593786120414734,0.7313491702079773,0.009272209368646145
MBT_2020.csv,MBT,2020,"The newly issued shares were listed on the PSE on April 7, 2015.",0.026699110865592957,0.9556542634963989,0.01764666475355625
MBT_2020.csv,MBT,2020,"Further, in April 2018, the Bank raised P60.0 billion through a rights offer for 799,842,250 common shares with par value of P20.00 priced at P75.00 per share.",0.5732323527336121,0.41788509488105774,0.008882537484169006
MBT_2020.csv,MBT,2020,"The newly issued shares were listed on the PSE on April 12, 2018.",0.027298837900161743,0.9548919200897217,0.01780926249921322
MBT_2020.csv,MBT,2020,"In October 2019, the Bank increased its capital stock from P100 billion to P140 billion and on November 26, 2019, it issued a stock dividend equivalent to 517,400,519 common shares (with a par value of P20) that was applied as payment of the required subscription to the increase in capital stock, which further improved the Bank’s capital position.",0.9407263398170471,0.047584593296051025,0.011689119972288609
MBT_2020.csv,MBT,2020,The Bank issued Basel II compliant Tier 2 subordinated notes in October 2007 for P8.5 billion with a coupon of 7.0%; in October 2008 for P5.5 billion with a coupon of 7.75%; and in May 2009 for P4.5 billion with a coupon of 7.5%.,0.038427188992500305,0.9363495111465454,0.02522328309714794
MBT_2020.csv,MBT,2020,"With the advent of Basel III, the Bank subsequently redeemed these previously issued subordinated debt issuances as they would not have been considered as capital beginning January 1, 2014.",0.02673700451850891,0.934923529624939,0.038339465856552124
MBT_2020.csv,MBT,2020,"The Bank exercised the call option on its P8.5 billion 7.0%; P5.5 billion 7.75% and P4.5 billion 7.5% Lower Tier 2 Notes on October 22, 2012, October 4, 2013 and May 6, 2014, respectively.",0.05322951450943947,0.9177103638648987,0.029060054570436478
MBT_2020.csv,MBT,2020,"By redeeming the notes, the Bank avoided a step-up in the interest rate and the capital decay from the instruments.",0.1232544332742691,0.42990389466285706,0.44684168696403503
MBT_2020.csv,MBT,2020,"In 2014, the Bank raised a total of P22.5 billion in subordinated debt wherein P16.0 billion was issued on March 27, 2014 at a coupon rate of 5.375% and P6.5 billion on August 8, 2014 at 5.25%.",0.09049105644226074,0.8981528878211975,0.011356049217283726
MBT_2020.csv,MBT,2020,"The terms of the notes contain a loss absorption feature, allowing them to be recognized as bank capital in accordance with Basel III standards.",0.11142934113740921,0.878067672252655,0.010503032244741917
MBT_2020.csv,MBT,2020,"As approved by the BSP on April 25, 2019, on June 27, 2019, the Bank redeemed its 2024 Peso Notes amounting to P16.0 billion, ahead of its maturity.",0.34891819953918457,0.6375938653945923,0.013487914577126503
MBT_2020.csv,MBT,2020,"Likewise, on August 8, 2020, the Bank redeemed the 2025 Peso Notes amounting to P6.5 billion, ahead of its maturity after approval by the BSP on May 7, 2020.",0.19309869408607483,0.7968440651893616,0.010057223960757256
MBT_2020.csv,MBT,2020,"As part of the Group’s capital efficiency initiatives, the Group has been active in optimizing its allied and non-allied undertakings.",0.8095846176147461,0.18280640244483948,0.0076089054346084595
MBT_2020.csv,MBT,2020,Among the initiatives include the sale of the Bank’s ownership in Toyota Motor Philippines Corporation in tranches between 2012 and 2013 as well as the sale of FMIC’s holdings in Global Business Power Corporation in tranches between 2013 and 2016 and FMIC’s holdings in Charter Ping An Insurance Corporation in 2014.,0.07810133695602417,0.9125987887382507,0.009299824014306068
MBT_2020.csv,MBT,2020,"In 2014, the Bank and PSBank also disposed of its holdings in Toyota Financial Services Philippines Corporation.",0.022425608709454536,0.9502739310264587,0.027300488203763962
MBT_2020.csv,MBT,2020,"Altogether, these sales further improved the Bank’s capital adequacy under Basel III.",0.9591402411460876,0.02256861887872219,0.018291136249899864
MBT_2020.csv,MBT,2020,"As discussed in Part I - Business item number 2 “Description of Business-Business of Registrant”, on March 13, 2019, the respective BODs of the Bank and MCC approved the proposal to merge MCC into the Bank.",0.10695921629667282,0.8840793371200562,0.008961433544754982
MBT_2020.csv,MBT,2020,"The proposed merger was ratified by the stockholders of the Bank on April 24, 2019, approved by the BSP on October 23, 2019, and approved by the SEC on January 3, 2020.",0.07973593473434448,0.9084338545799255,0.011830179020762444
MBT_2020.csv,MBT,2020,"As of December 31, 2020, the Group’s Capital Adequacy Ratio (CAR) and Common Equity Tier 1 (CET1) Ratio are 20.15% and 19.28%, respectively, both well above the regulatory requirements.",0.7752107381820679,0.21310673654079437,0.011682603508234024
MBT_2020.csv,MBT,2020,"2020 was a very challenging year for the global economy amid the triple shock brought by the COVID-19 pandemic: a health crisis, strict lockdown measures, and a global recession of unprecedented scale.",0.01627381145954132,0.04745660722255707,0.9362695217132568
MBT_2020.csv,MBT,2020,"The Philippines, along with most of the world’s economies, fell into recession, with the full-year 2020 GDP contraction coming in at -9.5%, a significant fall from the positive expansion of 6.0% in 2019.",0.009568251669406891,0.014644165523350239,0.9757876396179199
MBT_2020.csv,MBT,2020,"The sharp economic decline, especially in the second quarter of the year, was mainly attributed to the steep dive in household spending, deep slump in capital formation, and the collapse of external trade due to the impact of strict lockdown measures domestically and globally.",0.010210174135863781,0.016192298382520676,0.973597526550293
MBT_2020.csv,MBT,2020,Full-year average inflation came in slightly higher at 2.6% compared to 2.5% in 2019 amid the faster annual increases in some commodity groups towards the end of the year.,0.9090051054954529,0.01622145064175129,0.07477346062660217
MBT_2020.csv,MBT,2020,"The price of food, a heavily-weighted commodity, was higher in the last quarter of the year as weather-related disturbances adversely affected domestic supply conditions.",0.29697391390800476,0.021295707672834396,0.681730329990387
MBT_2020.csv,MBT,2020,"Nevertheless, the full-year average still came in within the BSP’s target range of 2-4%.",0.9234766364097595,0.03987247124314308,0.03665078058838844
MBT_2020.csv,MBT,2020,"Domestic interest rates remained low throughout 2020 on ample liquidity condition, benign inflation expectations, and subsequent policy rate cuts from the US Federal Reserve and the BSP.",0.0270199216902256,0.024979135021567345,0.9480009078979492
MBT_2020.csv,MBT,2020,The Fed slashed the federal funds rate to near- zero in March and has been buying about $120 billion in government-backed debt every month.,0.08301101624965668,0.3249937891960144,0.5919952392578125
MBT_2020.csv,MBT,2020,The Philippine peso made strong gains and remained within the P48 level from the P50.69 close at the start of the year.,0.9470107555389404,0.023854993283748627,0.029134271666407585
MBT_2020.csv,MBT,2020,The peso was even hailed as Asia’s best performing currency last year.,0.9299200773239136,0.04489913210272789,0.025180833414196968
MBT_2020.csv,MBT,2020,"To overcome the adverse impact of the pandemic on the domestic economy, the government launched a socioeconomic strategy to address the Covid-19 pandemic which included fiscal and monetary measures.",0.7920258641242981,0.1941247582435608,0.013849349692463875
MBT_2020.csv,MBT,2020,"On the fiscal side, the National Government approved several stimulus packages aimed at helping the highly-vulnerable sectors.",0.907969057559967,0.0720457062125206,0.01998523622751236
MBT_2020.csv,MBT,2020,"On the monetary side, the BSP slashed key policy rates by a total of 200 basis points and deployed regulatory relief measures to complement fiscal stimulus and help stimulate the economy.",0.40705668926239014,0.05598040670156479,0.5369628667831421
MBT_2020.csv,MBT,2020,The near-term outlook for the global economy remains highly uncertain amid the renewed infection waves and new variants of the coronavirus.,0.03548805043101311,0.05995679646730423,0.904555082321167
MBT_2020.csv,MBT,2020,"Nevertheless, a likely softening in the 1st half of 2021 is seen to usher in a recovery in the 2nd half as the roll-out of vaccination programs in different countries gain pace.",0.9482550024986267,0.022964486852288246,0.02878054417669773
MBT_2020.csv,MBT,2020,"Furthermore, the unprecedented policy support by governments is seen to continue and will become more targeted and flexible so as to adapt to fast- changing conditions.",0.8689224720001221,0.12307567149400711,0.008001827634871006
MBT_2020.csv,MBT,2020,"For the Philippine economy, support will still largely come from the National Government and the BSP.",0.5843045711517334,0.40602076053619385,0.009674633853137493
MBT_2020.csv,MBT,2020,"A return of consumer confidence -- or the confidence of consumers to once again do both discretionary and non-discretionary spending -- will play a large role in the economic recovery because fundamentally, consumer spending is what drives the economic engines of the Philippines.",0.6078749895095825,0.3769472539424896,0.015177755616605282
MBT_2020.csv,MBT,2020,"To ensure that funds are more than adequate to meet its obligations, the Bank proactively monitors its liquidity position daily.",0.26984861493110657,0.7098440527915955,0.020307336002588272
MBT_2020.csv,MBT,2020,"Based on this system of monitoring, the Bank does not anticipate having any cash flow or liquidity problem within the next twelve months.",0.03740323707461357,0.14747509360313416,0.8151217103004456
MBT_2020.csv,MBT,2020,"As of December 31, 2020, the contractual maturity profile shows that the Bank has at its disposal about P1.192 trillion of cash inflows in the next twelve (12) months from its portfolio of cash, placements with banks, debt securities and receivable from customers.",0.07161246985197067,0.9137183427810669,0.014669119380414486
MBT_2020.csv,MBT,2020,This will cover 76.29% of the P1.561 trillion total deposits that may mature during the same period.,0.06502454727888107,0.9238106608390808,0.011164786294102669
MBT_2020.csv,MBT,2020,These cash inflows exclude securities booked in FVTPL and FVOCI whose maturities beyond one (1) year but may easily be liquidated in an active secondary market.,0.03268849849700928,0.8951435089111328,0.0721680223941803
MBT_2020.csv,MBT,2020,"Inclusive of these securities, the total current assets will cover 101.90% of the total deposits that may mature within one (1) year.",0.045273054391145706,0.9427841901779175,0.011942751705646515
MBT_2020.csv,MBT,2020,"On the other hand, historical balances of deposits showed that no substantial portion has been withdrawn in one year.",0.04173397272825241,0.5881105065345764,0.3701555132865906
