filename,ticker,year,sentence,positive,neutral,negative
MBT_2020.csv,MBT,2020,"In the normal course of the Group’s operations, there are various outstanding commitments and contingent liabilities which are not reflected in the accompanying financial statements.",0.01746891811490059,0.9421346783638,0.040396369993686676
MBT_2020.csv,MBT,2020,Several suits and claims relating to the Group’s operations and labor-related cases remain unsettled.,0.009203130379319191,0.04224291071295738,0.9485539793968201
MBT_2020.csv,MBT,2020,"In the opinion of management, these suits and claims, if decided adversely, will not involve sums having a material effect on the Group’s financial statements.",0.017438672482967377,0.8769545555114746,0.10560672730207443
MBT_2020.csv,MBT,2020,"For the year 2020, the Bank estimates to incur capital expenditures of about P3.0 to P5.0 billion, of which 70% is estimated to be incurred for information technology.",0.29520246386528015,0.6864604949951172,0.01833697408437729
MBT_2020.csv,MBT,2020,Standards issued but not yet effective up to date of issuance of the Group’s financial statements are listed in Note 2 of the audited financial statements of the Group as presented in Exhibit 4.,0.019983313977718353,0.9469731450080872,0.0330435074865818
MBT_2020.csv,MBT,2020,"The listing consists of standards and interpretations issued, which the Group reasonably expects to be applicable at a future date.",0.039219144731760025,0.9462248682975769,0.01455603912472725
MBT_2020.csv,MBT,2020,"Except as otherwise indicated, the Group does not expect the adoption of these new and amended PFRS and Philippine Interpretations to have significant impact on its financial statements.",0.050805795937776566,0.8953551054000854,0.05383911356329918
MBT_2020.csv,MBT,2020,"On January 21, 2021, the BOD of PSBank declared 7.50% regular cash dividend for the fourth quarter of 2020 amounting to P=320.14 million or P=0.75 per share, payable on February 22, 2021 to all stockholders of record as of February 5, 2021. 2.",0.05422450229525566,0.9299156069755554,0.015859829261898994
MBT_2020.csv,MBT,2020,"On February 17, 2021, the BOD of the Parent Company declared a regular cash dividend of P=1.00 per share and a special cash dividend of P=3.00 per share payable on March 18, 2021 to all stockholders of record as of March 5, 2021.",0.051698386669158936,0.9346567392349243,0.013644896447658539
MBT_2020.csv,MBT,2020,"As of December 31, 2020, the Group has no significant matters to report on the following: 1.",0.023487450554966927,0.9473604559898376,0.02915201336145401
MBT_2020.csv,MBT,2020,"Known trends, events or uncertainties that would have material impact on liquidity and on the sales or revenues except that in order to anticipate the impact of COVID-19 pandemic, as required by the expected credit loss model of PFRS 9, the Group increased provisions for credit and impairment losses to P=40.8 billion for the year ended December 31, 2020. 2.",0.5320723056793213,0.26845231652259827,0.19947542250156403
MBT_2020.csv,MBT,2020,"Issuances, repurchases and repayments of debt and equity securities except for (a) maturity of the =P8.0 billion LTNCD and P=28.0 billion fixed rate bonds of the Bank; (b) issuances of the P=10.5 billion fixed rate bonds and US$ 500 million senior unsecured notes of the Bank and the P=4.65 billion fixed rate bonds of PSBank; (c) redemption of the 2025 Peso Notes by the Bank and (d) maturity of the P=1.7 billion and =P895.2 million unsecured notes issued by ORIX Metro on April 29 and October 29, 2020, respectively as discussed in Notes 16, 19, 20 and 21 of the audited financial statements of the Group as presented in Exhibit 4. 4.",0.026873217895627022,0.9477075934410095,0.025419224053621292
MBT_2020.csv,MBT,2020,"Unusual items as to nature, size or incidents affecting assets, liabilities, equity, net income or cash flows except for the disposal of investment securities at amortized cost and payment of cash dividends by the Bank, as discussed in Notes 8 and 23, respectively, of the audited financial statements of the Group as presented in Exhibit 4; and",0.015380832366645336,0.909117579460144,0.07550153136253357
