sentence,positive,neutral,negative
"rlc derives its revenues from real estate operations and hotel operations. revenues from real estate operations account for approximately 93% of the company’s total revenues and are derived from the lease of commercial spaces in the various malls, the lease of space in office buildings and warehouse facilities, the sale of residential units from the company’s various housing projects and the sale of parcels of land. approximately 7% of total revenues are derived from hotel operations.

rlc generated total gross revenues of p=29.55 billion for calendar year 2018, an increase of 31.2% from p=22.52 billion total gross revenues for calendar year 2017. ebit grew 38.8% to p=11.88 billion while ebitda posted a 30.9% growth to p=16.34 billion. net income stood at p=8.22 billion, up by 39.8% compared to last year.
the commercial centers division accounted for p=11.94 billion of the real estate revenues for the year versus p=10.79 billion last year or a 10.7% increase. the increase in rental revenues was brought about by the full year impact of new malls that opened during the second half of 2017, as well as the opening of four new malls in ormoc, iloilo, tuguegarao and bukidnon. robinsons galleria in ortigas also contributed to the rental growth as tenants’ occupancy and sales had started to pick up since the completion of its redevelopment. cinema revenues also improved with the opening of new branches. the division’s ebit and ebitda grew by 6.2% and 8.9%, respectively.
revenues of office buildings division grew by 31.4% to p=4.29 billion from p=3.27 billion over the same period last year. revenue growth was mainly attributable to rental escalations and high renewal rates, as well as contribution from the offices completed in 2017 namely cyber sigma, cybergate delta, cybergate naga and robinsons luisita office and offices completed in 2018 namely exxa tower, zeta tower and cyberscape gamma. the division’s ebit and ebitda showed positive variances of 33.3% and 28.3%, respectively.
the residential division realized revenues is at p=8.69 billion this year versus p=6.55 billion last year, an increase of 32.6%, due to higher level of buyers meeting the equity requirement in recognizing sales based on percentage of construction completion and sale of parcels of land. ebit and ebitda increased by 21.2% and 21.5%, respectively.

the hotels and resorts division registered gross revenues of p=1.98 billion as as against last year's 1.89 billion. the 4.7% increase in hotel revenues principally came from the new hotels namely summit galleria cebu, summit hotel tacloban and go hotels iligan. hotels and resorts division ebit and ebitda declined by 21.6% and 6.9%, respectively, as the division continues to redevelop some of the existing hotels and incurrence of a much accelerated pre-operating expenses on hotels to be opened in 2019 as well as higher overhead expense in the head office.
the iid division accounted for p=2.64 billion revenues, with 95% attributed to the sale of the commercial lots and the remainder 5% is the revenue generated from lease of warehouse facilities. further gains will be realized from the selling of lots with joint ventures. ebit and ebitda for calendar year 2018 stood at p=2.02 billion and p=2.03 billion, respectively.
interest income increased to p=196.3 million from p=36.8 million last year due to higher average balance of cash and cash equivalents during the calendar year 2018.
real estate costs went up by 30.6% to p=12.11 billion from p=9.28 billion last year. the higher level of realized sales of residential units and sale of parcels of land brought cost of real estate sales to increase by p=1.79 billion or 56.9%. the opening of new malls raised the level of depreciation expense of commercial centers division by p=380.2 million or 12.5%; while completion of new office buildings increased depreciation expense of the office buildings division by p=64.2 million or 10.2%. furthermore, cinema expense rose by 10.4% or p=85.2 million in line with the increase in cinema revenues.
hotel expenses rose by 15.3% to p=1.56 billion due substantially to higher level of property and maintenance cost, depreciation, salaries and wages, contracted services, which were all due to higher level of operations brought about by higher room revenues and pre-operating expenses on hotels to be opened in 2019.
general and administrative expenses went up by 20.1% to p=4.00 billion due to higher commission, rent, advertising and promotions and salaries, among others.
gain or loss from foreign exchange mainly pertains to foreign currency denominated transactions of the company’s foreign subsidiary.
as of december 31, 2018, total assets of the group stood at p=174.16 billion, a growth of 17.6% from p=148.13 billion last year.
cash and cash equivalents increased by 22.6% or p=0.47 billion due to the proceeds from the sro, cash generated from operations; offset by payments of dividends, loans, and capital expenditures for new and ongoing projects.
receivables (current and noncurrent-net) decreased by 61.9% or p=5.78 billion to p=3.56 billion due to reclassification to ‘contract assets’ account amounting to p=5.09 billion in 2018.
subdivision land, condominium and residential units for sale grew by 9.0% to p=31.46 billion due to higher level of capital expenditures for new and ongoing projects under the residential division.
contract assets (current and noncurrent) totaling p=11.53 billion refer to the right to consideration in exchange for goods or services transferred to the customers. if the company performs by transferring goods or services to a customer before the customer pays consideration or before payment is due, a contract asset is recognized for the earned consideration that is conditional. this is reclassified as installment contract receivables when the monthly amortization is already due for collection. the movement in contract asset is mainly due to new real estate sales contract recognized during the period, increase in percentage of completion, less reclassification of installment contract receivable.
other current assets went up by 176.3% to p=11.74 billion from p=4.25 billion last year mainly due to increase in cash under escrow which will mainly be used for the construction of real estate inventories.
investment properties and property and equipment increased by 7.8% to p=99.32 billion and 17.2% to p=7.84 billion, respectively. increase in investment properties is due to reclassification of land from ‘subdivision land, condominium and residential units for sale’ account and costs incurred for the construction of new malls and office developments. on the other hand, the increase in property and equipment is due to expansion projects from all three hotel segments namely go hotels, summit hotels, and international. investments in joint venture consist of investments in stocks of joint venture companies intended to acquire, develop, sell and lease real estate properties.
contract liabilities (current and noncurrent) totaling p=15.31 billion consist of collections from real estate customers which have not reached the equity threshold to qualify for revenue recognition and excess of collections over the goods and services transferred by the group based on percentage of completion. the movement in the ‘contract liability’ account is mainly due to reservation sales and advance payment of buyers less real estate sales recognized upon reaching the equity threshold from increase in percentage of completion.
loans payable (current and noncurrent) decreased by 27.2% to p=37.39 billion due to settlement of a significant portion of short-term borrowings.
the increase in deferred tax liabilities - net of 25.0% to p=3.58 billion is mainly attributed to excess of real estate revenues based on percentage-of- completion over real estate revenues based on collections.
deposits (current and noncurrent) and other liabilities went down by 29.0% to p=8.60 billion primarily due to reclassification of deposits from real estate buyers to contract liabilities beginning 2018.
equity attributable to equity of the parent company as of december 31, 2018 stood at p=93.51 billion, up by 39.4% from p=67.09 billion last year due to successful sro during the year, current earnings of p=8.22 billion, net of payment of dividends of p=1.87 billion.

capital additions and additions to subdivision land, condominium and residential units for sale for the calendar year ended december 31, 2018 amounted to p=19.31 billion, funding of which was sourced from proceeds from borrowings and internally-generated funds.",0.9551246762275696,0.0283143762499094,0.016560927033424377
