sentence,positive,neutral,negative
"gt capital holdings, inc. (“gt capital” or the “company” or the “parent company”) consolidated net income attributable to equity holders of the parent company declined by 6% from php14.18 billion in 2017 to php13.39 billion in 2018. the decline in net income growth was principally due to a 10% decline in total revenues.
the decline in revenue came from the following component companies:
(1) lower auto sales from toyota motor philippines corporation (“tmp”) and toyota manila bay corporation (“tmbc”) as combined sales decreased by 15% from php211.69 billion to php179.12 billion accounting for 83% of total revenue; offset by:
(2) higher real estate sales and interest income on real estate sales from federal land inc. (fed land) and property company of friends, inc. (“pcfi”) which grew by 28% from php15.41 billion to php19.72 billion; and
(3) higher equity in net income of associates and joint venture which grew by 32% from php8.70 billion to php11.52 billion.
core net income attributable to equity holders of the parent company reached php13.66 billion in 2018 from php15.02 billion in 2017. core net income for 2018 amounted to php13.66 billion after adding back the php0.27 billion amortization of fair value adjustments arising from business combinations, taxes-related to lot sales, and non-recurring expenses, net of non-recurring gains. core net income for 2017 amounted to php15.02 billion after adding back the php0.84 billion amortization of fair value adjustments arising from business combinations and non-recurring expenses.

the financial statements of fed land, pcfi, tmp, tmbc and gt capital auto dealership holdings, inc. (“gtcad”) are consolidated in the financial statements of the company. the other component companies metro pacific investments corporation (“mpic”), metropolitan bank & trust company (“metrobank” or “mbt’), philippine axa life insurance corporation (“axa philippines), toyota financial services philippines corporation (“tfsph”) and sumisho motor finance corporation (“smfc”) are accounted for through equity accounting.
of the ten (10) component companies, metrobank, pcfi, mpic, tfsph, axa philippines, and smfc posted growths in their respective net income. tmp, tmbc, and fed land, reported declines in their respective net income for the year. gtcad commenced commercial operations in november 2018.
automotive operations comprising the sale of assembled and imported auto vehicles and spare parts declined by 15% from php211.69 billion to php179.12 billion principally driven by the 15% decrease in wholesales volume from 183,209 units to 155,508 units.
real estate sales and interest income on real estate sales rose by 28% from php15.41 billion to php19.72 billion. fed land contributed approximately 54% of total sales, mostly from middle-market development projects. pcfi’s low cost and economic housing projects contributed the remaining balance.
equity in net income of associates and jointly-controlled entities increased by 32% from php8.70 billion to php11.52 billion primarily due to increases in:
(1) net income of metrobank which increased by 21% from php18.22 billion to php22.01 billion given full year impact of increased ownership from 26.47% to 36.09% effective may 1, 2017 and further increasing to 36.36% effective april 1, 2018;
(2) net income of mpic which increased by 7% from php13.15 billion to php14.13 billion;
(3) net income of axa philippines which increased by 25% from php2.47 billion to php3.08 billion; and
(4) net income of tfspc which increased by 14% rom php0.69 billion to php0.79 billion.
rent income, mainly from fed land’s gt tower international office building and blue bay walk, increased by 34% from php0.94 billion to php1.26 billion driven by rate escalation and higher occupancy for imet.
interest income on deposits and investments grew by 13% from php0.77 billion to php0.87 billion due to higher level of time deposit placements.
sale of goods and services, consisting of the sale of petroleum products on a wholesale and retail basis, in the blue wave and blue baywalk malls and roxas boulevard situated in pasay city and marikina city, rose by 22% from php0.64 billion to php0.78 billion due an increase in retail fuel prices and new franchises.
commission income increased by php0.05 billion from php0.06 billion to php0.11 billion due to an increase in booked sales from grand hyatt residences i.
other income grew by 53% from php1.61 billion to php2.46 billion with: (1) federal land contributing php0.87 billion comprising real estate forfeitures, management fees and other income; (2) tmp contributing php0.61 billion consisting of gain on sale of fixed assets, and subscription and ancillary income from its dealer subsidiaries; (3) tmbc contributing php0.44 billion consisting of ancillary income on finance and insurance commissions and other income; and (4) pcfi contributing php0.33 billion consisting of management income and commercial recoveries. the remaining balance of php0.21 billion came from gt capital’s dividend income from investments in toyota motor corporation (tmc) and gain on fvptl investments.
consolidated costs and expenses decreased by 9% from php214.04 billion to php193.75 billion with the following breakdown:
(1) php148.95 billion from tmp comprising cost of goods manufactured, cost of goods and services sold, general and administrative expenses and interest expenses;
(2) php20.37 billion from tmbc consisting of cost of goods and services sold, general and administrative expenses and interest expenses;
(3) php11.29 billion from fed land consisting of cost of real estate sales, cost of goods sold, cost of rental, general and administrative expenses and interest expenses;
(4) php8.94 billion from pcfi comprising cost of real estate sales, general and administrative expenses and interest expenses; and
(5) php4.20 billion from gt capital representing interest expenses and general and administrative expenses.

cost of goods and services sold decreased by 12% from php147.71 billion to php129.85 billion with tmp, tmbc and gtcad’s completely built-up units (cbu) and spare parts accounting for php110.25 billion, php18.73 billion and php0.20 billion, respectively. the balance of php0.67 billion came from federal land’s petroleum service station business.
cost of goods manufactured and sold comprising cost of materials, labor and overhead incurred in the assembly of vehicles from tmp declined by 20% from php39.64 billion in 2017 to php31.81 billion in 2018.
general and administrative expenses grew by 9% from php12.90 billion to php14.04 billion. tmp accounted for php6.49 billion consisting of salaries and wages, taxes and licenses, advertisements and promotional expenses, and delivery and handling expenses. pcfi contributed php3.37 billion consisting of salaries and wages, advertising and promotional expenses, commission expenses, taxes and licenses and outside services. federal land accounted for php2.37 billion composed of salaries and wages, commission expenses, taxes and licenses and repairs and maintenance expenses; and tmbc contributed php1.54 billion representing salaries and wages, commission expenses and taxes and licenses and advertising and promotional expenses. gt capital contributed php0.24 billion consisting of salaries and wages, professional fees and taxes and licenses. the remaining php0.03 came from gtcad which consists mainly of salaries and wages, depreciation and amortization, and taxes and licenses.
cost of real estate sales increased by 26% from php10.04 billion to php12.61 billion arising from the increase in real estate sales. fed land contributed 59% of the cost while pcfi accounted for the remaining 41%.
interest expense increased from php3.39 billion to php4.97 billion with gt capital, pcfi, fed land, tmp, and tmbc accounting for php3.95 billion, php0.40 billion, php0.33 billion, php0.19 billion, and php0.10 billion, respectively.
cost of rental grew by 32% from php0.36 billion to php0.48 billion due to an increase in operating expenses incurred in the leasing business such as depreciation, utilities and other overhead expenses.
provision for income tax declined by 8% from php4.52 billion to php4.17 billion due to lower taxable income.
net income attributable to non-controlling interest decreased by 36% from php7.07 billion to php4.52 billion due decline in net income of non-wholly owned subsidiaries.
consolidated net income attributable to equity holders of the parent company declined by 6% from php14.18 billion in 2017 to php13.39 billion in 2018.

consolidated assets increased by 17% or php52.06 billion from php307.69 billion as of december 31, 2017 to php359.75 billion as of december 31, 2018. total liabilities increased by 32% or php43.46 billion from php134.00 billion to php177.46 billion while total equity increased by 5% or php8.60 billion from php173.69 billion to php182.29 billion.
cash and cash equivalents declined by php5.80 billion from php20.16 billion to php14.35 billion with tmp, gt capital-parent company, pcfi, federal land, tmbc and gtcad accounting for php7.58 billion, php3.67 billion, php1.63 billion, php1.24 billion, php0.20 billion and php0.03 billion, respectively.
short-term investments declined by 96% from php1.67 billion to php0.07 billion comprising short-term money market placements of tmp.
financial assets at fair value through profit or loss (fvtpl) amounting to php3.18 billion pertaining to the parent company’s investment in unit investment trust fund (uitf) following the classification under philippine financial reporting standards (pfrs) 9 effective january 1, 2018. under the old standard, investments in uitf are classified under available for sale (afs) investments.
receivables-current decreased by 38% or php9.22 billion from php24.37 billion to php15.15 billion with tmp contributing php8.15 billion consisting of trade and non-trade receivables; pcfi contributing php2.78 billion comprising of installment contract receivables and other receivables; federal land contributing php1.74 billion, a majority of which were installment contract receivables, rent receivable and other receivables; tmbc and gtcad accounting for php2.35 billion and php0.12 billion, respectively, representing trade receivables from the sale of automobiles and after-sales maintenance services, and gt capital contributing the remaining balance of php0.01 billion.
contract assets-current amounting to php8.33 billion are initially recognized for revenue earned from real estate sales as receipt of consideration is conditional on successful completion of installation. upon completion of performance obligation and acceptance by the customer, the amounts recognized as contract assets are reclassified to trade residential and office development receivables.

inventories grew by 3% from php74.87 billion to php77.47 billion with federal land contributing php38.58 billion comprising land and improvements, condominium units for sale and inventory with construction-in-progress; pcfi contributing php29.66 billion comprising land and improvements, material inventory, ongoing construction of house inventory and condominium units for sale; tmp contributing php8.43 billion mostly finished goods; and the balance of php0.69 billion and php0.11 billion coming from tmbc and gtcad, respectively, representing automobiles and spare parts.
due from related-parties increased by php0.50 billion from php0.17 billion to php0.67 billion mainly fed land’s related-parties.
prepayments and other current assets decreased by 6% from php10.42 billion to php9.79 billion comprising advances to contractors and suppliers, prepaid expenses, deposit to land owners, input vat, and creditable withholding taxes from federal land, (php4.85 billion); pcfi, (php3.61 billion); tmp, (php1.22 billion); tmbc, (php0.04 billion); and gt capital, (php0.07 billion).
receivables - net of current portion decreased by php3.79 billion from php4.72 billion to php0.93 billion mainly due to reclassification to non-current contract asset following the provisions of pfrs 15.
contract assets - net of current portion amounting to php6.89 billion pertain to the non-current portion of the excess of progress of work over the right to an amount of consideration that is unconditional.
financial assets at fair value through other comprehensive income (fvoci) amounted to php10.95 billion mainly the parent company’s acquisition of toyota motor corporation common shares in the tokyo stock exchange following the reclassification under pfrs 9 effective january 1, 2018. under the old standard, investments in equity shares were classified under afs investments.
investments and advances increased by 31% from php124.89 billion to php163.74 billion primarily due to the following:
1) php29.63 billion additional and initial investments broken down as follows:
 php22.45 billion additional investment in metrobank arising from the latter’s stock rights
offering;
 php4.33 billion additional investment in sunshine fort of federal land;
 php1.58 billion initial investment in north bonifacio landmark realty development
corporation (nblrdi), net of php0.11 billion advances in 2017 converted to equity in 2018
of federal land ;
 php0.72 billion additional investment in tfspc arising from its equity call;
 php0.47 billion additional investment in st 6747 of federal land; and
 php0.08 billion initial investment in magnificat and hsl south food, inc. of federal land.
2) php11.52 billion share in net income of associates and joint ventures in 2018;
3) php3.73 billion share in other comprehensive income arising from the adoption of pfrs 9 in january 1,
2018.
these were offset by the following:
1) php2.44 billion share in other comprehensive loss of associates;
2) php2.11 billion dividend income received from metrobank, mpic, axa philippines, and crown central; and
3) php1.48 billion impact of intra-group elimination.
property and equipment grew by 17% from php11.67 billion to php13.64 billion mostly from the newly completed building of tmp and tmbc (marikina facility).
deferred tax asset increased by 40% from php0.73 billion to php1.02 billion with tmp, fed land, tmbc and pcfi accounting for php0.45 billion, php0.43 billion, php0.08 billion and php0.06 billion, respectively.
other noncurrent assets increased by php1.98 billion from php0.91 billion to php2.89 billion comprising long-term deposits, non-current input tax, derivative asset, non-current prepaid rent and other assets from tmp, (php1.55 billion), pcfi, (php0.82 billion); federal land, (php0.43 billion); gtcad, (php0.06 billion); tmbc, (php0.02 billion); and gt capital, (php0.01 billion).

contract liabilities amounting to php8.79 billion consist of collections from real estate customers which have not reached the 10% threshold to qualify for revenue recognition and excess of collections over the recognized receivables and contract assets based on percentage of completion.
short-term debt increased by php4.47 billion from php6.03 billion to php10.50 billion due to loan availments of gt capital, (php10.75 billion); federal land, (php9.20 billion); tmp, (php2.42 billion); tmbc, (php5.92 billion); pcfi, (php3.85 billion); and gtcad (php0.17 billion). these were offset by loan payments by gt capital, (php10.75 billion); federal land, (php7.61 billion); tmbc, (php5.65 billion); tmp, (php2.33 billion); and pcfi, (php1.50 billion).
current portion of long-term debt declined by 67% from php2.47 billion to php0.82 billion primarily due to loan payment by pcfi (php3.51 billion) offset by reclassification from noncurrent portion of long-term debt (php1.85 billion) and amortization of deferred financing cost and fair value adjustment (php0.01 billion).
current portion of liabilities on purchased properties decreased by 29% from php0.58 billion to php0.42 billion due to a reclassification from non-current to current for the loan portion due within one year.
current portion of bonds payable increased by php2.99 billion due to reclassification from noncurrent portion of bonds payable maturing in november 2019.
customers’ deposits pertaining to reservation deposits and collections for accounts which do not qualify for revenue recognition decreased by 89% from php4.94 billion to php0.56 billion.
dividends payable increased by php0.61 billion from php0.59 billion to php1.20 billion due to cash dividends payable to noncontrolling shareholders of non-wholly owned subsidiaries.
due to related parties increased by 8% from php0.19 billion to php0.20 billion primarily due to federal land’s related parties.
income tax payable decreased by 23% from php0.78 billion to php0.60 billion due to decrease in taxable income in 2018 as compared to the taxable income in 2017.
other current liabilities declined by php0.39 billion from php1.23 billion to php0.84 billion primarily due to the settlement of withholding taxes and output tax as of december 31, 2017 which were paid in the first quarter of 2018.
long-term debt increased by php37.33 billion from php57.02 billion to php94.35 billion primarily due to the: 1) php25 billion long-term loan availment by the parent company to fund its participation in the metrobank stock rights offering, net of php0.19 billion documentary stamp tax of, 2) p11.05 billion long-term loan availment by parent company denominated in foreign currency, net of php0.09 billion transaction cost; 3) php3.25 billion long term loan availment by federal land, net of php0.03 billion transaction cost; 4) php0.19 billion translation loss of foreign currency-denominated loans; and 5) php0.07 billion amortization of deferred financing cost; offset by the 1) php1.85 billion reclassification to current portion of long-term debt; and 2) the php0.07 billion loan payments.
non-current portion of bonds payable decreased by php2.96 billion due to reclassification to current portion of bonds payable maturing in november 2019.
non-current portion of liabilities on purchased properties declined by php0.27 billion from php3.15 billion to php2.88 billion mainly due to reclassification to current portion.
pension liabilities declined by 39% from php1.40 billion to php0.86 billion mainly due to increased funding in 2018. deferred tax liabilities grew by 7% from php5.59 billion to php5.96 billion due to an increase in taxable temporary differences.
capital stock increase of php67.41 million pertain to the par value of the 6.74 million common shares representing 3.5% stock dividends declared and issued by gt capital in 2018.
additional paid in capital increase of php6.65 billion pertain to the excess over par value of the 3.5% stock dividends declared and issued by gt capital in 2018 at php997.00 per share.

unappropriated retained earnings increased by php4.88 billion from php48.58 billion to php53.46 billion due to the (1) php13.39 billion net income attributable to equity holders of the parent company; and (2) php19.00 billion retained earnings reverted back to unappropriated retained earnings from appropriated retained earnings; partially offset by the (1) php1.17 billion cash dividends declared to shareholders of common and preferred stock; (2) php6.72 billion stock dividends; (3) php17.00 billion appropriation of retained earnings for strategic investment in financial services; (4) php2.58 billion effect of the adoption of pfrs 9 and 15; and (5) and php0.04 billion realized loss on sale of financial assets at fvoci.
the php17.00 billion appropriated retained earnings as of december 31, 2018 pertains to the appropriation of retained earnings earmarked for strategic investments in property development in 2019.
other comprehensive loss improved by php1.77 billion from a negative php5.98 billion to a negative php4.21 billion primarily due to the (1) php5.54 billion equity in other comprehensive income of associates arising from adoption of pfrs 9; (2) php0.07 bilion gain on remeasurement of cash flow hedge reserve; (3) php0.13 billion gain on remeasurement of pension liabilities; and (4) php0.04 billion effect of adoption of pfrs 9; offset by (1) php2.44 billion equity in other comprehensive loss of associates; and (2) php1.57 billion mark-to-market loss on fvoci investments.
non-controlling interest (nci) declined by 10% from php27.68 billion to php24.91 billion due to the php4.52 billion net income attributable to nci, php0.17 billion other comprehensive income attributable to nci, php0.04 billion share of nci in capital call; offset by php6.93 billion nci share in dividends declared by majority-owned subsidiaries and php0.57 billion effect of adoption of pfrs 9 and 15.

metrobank consolidated net income grew by 20.8% from php18.2 billion in 2017 to php22.0 billion in 2018. this was primarily due to the 9.9% growth in loans and receivables, and acquisition of the remaining 20% in metrobank card corporation (mcc) from anz.
net interest income grew by 12.1% from php61.4 billion in 2017 to php68.8 billion in 2018, comprising 74.0% of total operating income. this was driven by strong loan demand from the commercial and consumer segments. casa ratio maintained at 62.0% of total deposits, thereby, improving net interest margin by 7 basis points to 3.8%.
non-interest income grew by 3.4% from php22.1 billion in 2017 to php22.9 billion in 2018 driven by increases in service charges, fees and commissions and miscellaneous income offset by lower trading and securities, and foreign exchange gains.
total assets grew by 7.9% from php2.1 trillion as of december 31, 2017 to php2.2 trillion as of december 31, 2018 primarily due to increases in loans and receivables, investment securities, interbank loans receivable and securities purchased under resale agreements, and due from other banks offset by a decrease in due from bangko sentral ng pilipinas.
total liabilities, likewise, grew by 4.1% from php1.9 trillion as of december 31, 2017 to php2.0 trillion as of december 31,2018 trillion due to increases in deposit liabilities, bills payable, securities sold under repurchase agreement and bonds payable offset by a decrease in other liabilities. casa grew by 1.5% from php950.2 billion to php964.9 billion. on august 9, 2018 and october 4, 2018, psbank and metrobank issued php5.1 billion and php8.7 billion of long-term negotiable certificate of deposits (ltncd), respectively. as of december 31, 2018, outstanding ltncd amounted to php43.8 billion. further, metrobank issued php10.0 billion fixed rate bonds on november 9, 2018 and additional php18.0 billion fixed rate bonds on december 17, 2018. both bonds bear an interest rate of 7.15% and will mature on november 9, 2020.
equity attributable to equity holders of the parent company grew by 40.1% from php202.0 billion as of december 31, 2017 to php283.0 billion as of december 30, 2018 due to the php60.0 billion stock rights, net income earned and effect of adoption of pfrs 9 offset by php3.7 billion cash dividends, and php5.1 billion translation adjustment from settlement of non-controlling interest.

gt capital’s property companies recorded a 30.4% growth in consolidated revenues from php18.2 billion in 2017 to php23.8 billion in 2018. of total revenues, federal land accounted for 56%, while the balance came from pcfi. consolidated real estate sales grew by 30.3% from php15.4 billion to php20.1 billion, as booked sales of federal land grew by 16.4% and pcfi by 50.2% on a year-on-year basis. together, the two property developers reported a 13.2% growth in consolidated net income from php2.1 billion in 2017 to php2.4 billion in 2018.
consolidated assets of the property companies grew by 7.5% from php115.7 billion as of december 31, 2017 to php124.4 billion as of december 31, 2018. for federal land, the growth mainly came from increases in investments in associates and joint ventures, and receivables from real estate sales. for pcfi, total assets grew mainly due to an increase in receivables arising from higher real estate sales recognized during the period.
in 2018, federal land launched six (6) projects namely: (i) palm beach west – baler, a vertical residential condominium project located in macapagal boulevard, pasay city; (ii) peninsula garden midtown homes – mimosa, a vertical residential condominium project located in paco, manila; (iii) florida sun estates – orlando, a horizontal residential condominium project located in general trias, cavite; (iv) quantum residences – aqua, a vertical residential condominium project located in taft avenue, pasay city; (v) four season riviera – peony, a vertical residential condominium project located in binondo, manila; and (vi) valencia hills – tower e, a vertical residential condominium project located in n. domingo st., quezon city .
in addition, federal land successfully launched two (2) joint venture projects, both in located in grand central, bonifacio global city, taguig city. the first project was the second tower of grand hyatt gold residences (south tower) in october 2018, a joint venture with orix of japan; and the second was the first tower of the seasons residences (haru), a joint venture with nomura real estate development co. ltd.
federal land’s average overall percentage-of-completion of ongoing development projects declined from 53.0% in 2017 to 46.0% in 2018.
for pcfi, new retail outlets such as shopwise, healthwealth (medical clinics and diagnostics) and turks shawarma were opened in lancaster new city (lnc), another flagship project. mc home depot will open a branch in lnc in 2019. as of december 31, 2018, commercial and retail establishments reached an aggregate of 64 outlets.

new business from the life insurance sector of axa philippines grew by 13.2% expressed in annualized premium equivalent (ape) from php6.3 billion in 2017 to php7.1 billion in 2018. the increase in ape was driven by the growth in regular premium and single premium of 16.5% and 3.7%, respectively. the reported sales mix of life insurance premium income was changed to 52%/48% in 2018 from the previous 56%/44% in 2017 (single premium vs. regular premium). by distribution platform, bancassurance and sales agency accounted for 71% and 29% of premium revenues, respectively. on the other hand, gross written premiums from the non-life sector is flat in 2018 at php5.7 billion.
consolidated net income reached php3.1 billion in 2018. excluding cpaic, axa philippines grew its net income by 16.4% from php2.4 billion in 2017 to php2.7 billion in 2018. the net income growth is primarily driven by the: (1) improvement in the life insurance sector’s premium margins by 33.7% equivalent to php8.2 billion and (2) increase in asset management fees by 16.1% reaching php1.8 billion.

mpic’s share in the consolidated operating core income increased by 10% from php17.8 billion in 2017 to php19.6 billion in 2018, primarily reflecting the following:
 expanded power portfolio through the increase in effective shareholding in meralco from 32.48% to 41.22% (beginning may 30, 2016) and investment in gbpc representing 47.78% effective interest (acquired last may 27, 2016); effective july 1, 2017, mpic acquired the remaining 25% stake in beacon electric asset holdings, inc. (beacon electric) from pldt communications and energy ventures (pcev) bringing its effective stake in meralco from 41.22% to 45.5% and in gbpc from 47.78% to 62.5%; core net income contribution from meralco and gbpc in 2018 increased by 15% from php9.4 billion in 2017 to php10.8 billion
 increased share in the tollway business arising from strong traffic growth on all domestic roads held by metro pacific tollways corporation (mptc); core net income contribution of mptc increased by 13% from php3.9 billion in 2017 to php4.4 billion in 2018
 steady volume growth coupled with inflation-linked tariff increase in maynilad; core net income contribution of maynilad increased by 2% from php3.7 billion in 2017 to php3.8 billion in 2018
reported net income attributable to equity holders grew by 7% from php13.2 billion in 2017 to php14.1 billion in 2018. excluding head office, interest, forex and non-recurring income or expenses, core income grew by 7% from php14.1 billion to php15.1 billion.

tmp’s consolidated sales declined by 14.1% from php185.3 billion in 2017 to php159.2 billion in 2018 as wholesales volume declined by 15% from 183,209 units to 155,508 units. tmp retail sales volume, likewise, declined by 17% from 183,908 units to 153,004 units, while industry retail sales volume declined by 15% from 473,376 units to 400,298 units. as a result, tmp market share slightly declined from 38.9% in 2017 to 38.2% in 2018 as demand slowed down attributed to the new auto excise tax law implementation, suspension of the issuance for new franchise to tnvs effective august 2017, supply limitation for commercial vehicles in the first quarter of 2018 and run-out of old vios effective may 2018.
tmp launched two models in 2018: i) all-new rush, leading the subcompact suv segment in may 2018; and ii) the full model change vios, it’s official entry to the government’s cars program in july 2018.
as of december 2018, tmp increased its auto dealership complement from 63 to 69 outlets. last november 8, 2018, tmp inaugurated its 69th dealership - toyota subic, inc., situated in marshaling yard, subic gateway district, subic bay freeport zone, olongapo city, zambales.

the lower sales volume, unfavorable foreign exchange for the philippine peso vis-à-vis the us dollar, higher sales of low profit models and increased operating and overhead costs, resulted in a decline in gross profit, operating profit, net income margins, from 12.4%, 9.3% and 7.2% to 10.5%, 6.9% and 5.1%, respectively. likewise, consolidated net income attributable to equity holders declined by 39.7% from php13.2 billion to php8.0 billion mainly due to the above mentioned profit decreasing factors.
as of december 31, 2018, tmp directly owns seven (7) dealer outlets namely toyota makati with one (1) branch toyota bicutan, toyota san fernando in pampanga with two (2) branches in plaridel bulacan and toyota tarlac in tarlac city, lexus manila, situated in bonifacio global city, taguig city and toyota santa rosa, situated in sta. rosa, laguna, which commenced operations in august 2017.

tfspc recorded a 25.3% growth in gross interest income from php4.9 billion in 2017 to php6.2 billion in 2018, as loans and receivables increased by 12% from php60.4 billion to php67.4 billion on a year-on-year basis.
booking volume, however, declined from 36,365 units to 31,827 units in 2018 attributable to the overall demand slowdown in the auto industry. this, however, resulted in slightly improved penetration rate from 20% to 21%.
net income increased by 14.4% from php687.6 million to php786.8 million due to the 16.4% growth in operating income from php995.9 million to php1.2 billion, as provisions for credit and impairment losses merely increased by 1.7% driven by the change in provisioning policy and shift to the ifrs 9 model, higher ropa reversals and written off accounts and improvement in delinquency ratio.

consolidated sales, comprising of vehicle sales, spare parts and maintenance services, declined by 22.1% from php26.3 billion in 2017 to php20.5 billion in 2018. vehicle sales, accounting for 90.7% of tmbc’s revenues, decreased by 23.2% from php24.2 billion to php18.6 billion arising from lower sales booking.
retail sales volume declined by 29.0% from 22,870 units to 16,231 units due to overall market slowdown attributed to the implementation of the new auto excise tax, suspension of the issuance for new franchise to tnvs effective august 2017, low supply of commercial vehicles in the first quarter of 2018 and old vios model run-out effective may 2018. sales from spare parts and maintenance services, accounting for a combined 9.3% of revenues, increased by 4.7%.
consolidated net income in 2018 decreased by 54.7% from php390.2 million to php176.7 million, as gross profit on vehicle sales declined by 33.3%, along with the decline in ancillary income by 20.3% and interest expense increased by 37.3% due to the outright recognition of interest expenses arising from the start of commercial operations of the new manila bay and marikina dealership facilities, inaugurated last october 2017 and may 2018, respectively and working capital financing.
tmbc currently owns five (5) dealer outlets namely toyota manila bay, toyota abad santos, toyota cubao and toyota marikina, all situated within metro manila; and toyota dasmariñas in cavite.

on august 9, 2017, gt capital completed the acquisition of a 20% direct equity stake in smfc from philippine savings bank (“ps bank”) and the ps bank retirement fund for a total consideration of php379.92 million. the acquisition was gt capital's entry into micro-financing, specifically motorcycle financing, a high growth sector in the philippines. the investment will also strengthen the group's strategic relationship with sumitomo corporation, one of japan's leading conglomerates.
smfc recorded a 37.8% growth in gross interest income from php836.7 million in 2017 to php1.2 billion in 2018, as finance receivable increased by 44.5% from php3.3 billion to php4.8 billion on a year-on-year basis. bookings also grew by 39.9% from 37,421 units to 52,356 units in 2018. this outperformed the strong performance of the philippine motorcycle industry, which increased by 20.6% from 1,319,084 to 1,590,333 units, as disclosed by the motorcycle development program participants association, inc. (“mdppa”) in the federation of asian motorcycle industries (“fami”) website.
net income increased by 27.6% from php205.5 million to php262.2 million, despite the increase in provisions for credit losses due to loan portfolio increase.
except for (ii), (vi) and (vii), the company does not know of:
(i) any known trends or any known demands, commitments, events, uncertainties that will result or that are reasonably likely to result in the company’s liquidity increasing or decreasing in any material way;
(ii) any events that would trigger direct or contingent financial obligation (including contingent obligation) that is material to the company, including any default or acceleration of an obligation except those disclosed in the notes to the financial statements;
(iii) any material off balance sheet transactions, arrangements, obligations (including contingent obligations) and other relationships of the company with unconsolidated entities or other persons created during the reporting period;
(iv) any material commitments for capital expenditures, their purpose and sources of funds for such expenditures;
(v) any known trends, events or uncertainties that have had or are reasonably expected to have a material favorable or unfavorable impact on net sales or revenues or income from continuing operations;
(vi) any significant elements of income or loss that did not arise from the company’s continuing operations except those disclosed in the audited financial statements;
(vii) the causes of any material change from period to period including vertical and horizontal analysis of any material item, the causes of material changes are discussed in the md & a; and
(viii) any seasonal aspects that had a material effect on financial condition or results of operation of the company.

in 2016, 2017 and 2018, gt capital’s principal source of liquidity came from cash dividends received from the investee companies, availment of loans, issuance of bonds and issuance of preferred shares of stock. as of december 31, 2018, gt capital’s cash and cash equivalents reached php14.35 billion.

net cash provided by operating activities amounted to php2.85 billion in 2016, php6.98 billion in 2017 and php0.48 billion in 2018. in 2016, operating cash amounting to php22.71 billion was used to increase inventories by php7.09 billion and prepayments and other current assets by php1.80 billion and pay dividends, income taxes and interest amounting to php9.82 billion, php5.46 billion and php4.45 billion, respectively. in 2017, operating cash amounting to php21.10 billion was used to increase inventories by php8.12 billion, prepayments and other current assets by php2.36 billion and pay dividends, income taxes and interest amounting to php7.25 billion, php3.70 billion and php3.43 billion, respectively. in 2018, operating cash amounting to php15.95 billion was used to increase receivables by php2.21 billion and inventories by php2.83 billion and to pay dividends, income taxes and interest amounting to php7.48 billion, php4.38 billion and php4.63 billion, respectively.

net cash used in investing activities amounted to php33.93 billion in 2016, php30.50 billion in 2017 and php45.92 billion in 2018. in 2016, cash flows used in investing activities went to increase investment in associates and a joint venture by php33.77 billion, investment properties by php0.65 billion, property and equipment by php6.40 billion, and afs investments by php1.28 billion. in 2017, cash flows used in investing activities went to increase investment in associates and a joint venture by php26.78 billion, investment properties by php0.66 billion, property and equipment by php3.48 billion, afs investments by php1.74 billion and intangible assets by php0.23 billion. in 2018, cash flows used in investing activities went to pay for additional investment in associates and a joint venture by php29.63 billion, financial assets at fvoci by php10.48 billion, property and equipment by php3.92 billion, and investment properties by php0.22 billion.

net cash provided by financing activities amounted to php14.64 billion in 2016, php23.11 billion in 2017 and php39.79 billion in 2018. in 2016, cash flows from financing activities came from php46.65 billion in new loans and issuance of perpetual preferred shares of php11.94 billion which were used to partially settle php41.38 billion in outstanding loans, php0.62 billion in liabilities on purchased properties and php1.84 billion in redemption of non- controlling interest. in 2017, cash flows from financing activities came from php38.35 billion in new loans and issuance of capital stock of php21.69 billion which were used to partially settle php38.40 billion in outstanding loans. in 2018, cash flows from financing activities came from loan availments of php71.29 billion which were used to partially settle php31.43 billion in outstanding loans and php0.50 billion in liabilities on purchased properties.

",0.013007765635848045,0.035898882895708084,0.951093316078186
